Category,Event,Event description,Timepoint start,Timepoint end,Quantity outcome 1,Reference/link to data,Accessed on
List of tsunamis,CHILE-SOUTHERN CHILE: 30/01/1950 00:56:32,Earthquake mag: 7; Max water height (m): NA; Magnitude (Iida): NADeaths: NA,1950-01-30,1950-01-30,0,DOI:10.7289/V5PN93H7,2023-02-02
List of tsunamis,NEW ZEALAND-N. NEW ZEALAND: 14/03/1950 18:10:41,Earthquake mag: 5.8; Max water height (m): NA; Magnitude (Iida): NADeaths: NA,1950-03-14,1950-03-14,1,DOI:10.7289/V5PN93H7,2023-02-02
List of tsunamis,PANAMA-OFF COAST: 30/04/1950 23:49:24,Earthquake mag: NA; Max water height (m): NA; Magnitude (Iida): NADeaths: NA,1950-04-30,1950-04-30,1,DOI:10.7289/V5PN93H7,2023-02-02
List of tsunamis,VENEZUELA-EL TOCUYO: 03/08/1950 22:18:22,Earthquake mag: 6.4; Max water height (m): NA; Magnitude (Iida): NADeaths: NA,1950-08-03,1950-08-03,1,DOI:10.7289/V5PN93H7,2023-02-02
List of tsunamis,INDIA-INDIA-CHINA: 15/08/1950 14:09:30,Earthquake mag: 8.6; Max water height (m): 0.5; Magnitude (Iida): NADeaths: NA,1950-08-15,1950-08-15,41,DOI:10.7289/V5PN93H7,2023-02-02
List of tsunamis,COSTA RICA-COSTA RICA-NICARAGUA: 05/10/1950 16:09:31,Earthquake mag: 7.7; Max water height (m): 0.1; Magnitude (Iida): -3.3Deaths: NA,1950-10-05,1950-10-05,8,DOI:10.7289/V5PN93H7,2023-02-02
List of tsunamis,INDONESIA-BANDA SEA: 08/10/1950 03:23:09,Earthquake mag: 7.6; Max water height (m): NA; Magnitude (Iida): 1.5Deaths: 1,1950-10-08,1950-10-08,2,DOI:10.7289/V5PN93H7,2023-02-02
List of tsunamis,NORWAY-MID-NORWAY: 08/10/1950 NA:NA:NA,Earthquake mag: NA; Max water height (m): NA; Magnitude (Iida): NADeaths: NA,1950-10-08,1950-10-08,0,DOI:10.7289/V5PN93H7,2023-02-02
List of tsunamis,GUATEMALA-GUATEMALA: 23/10/1950 16:13:20,Earthquake mag: 7.5; Max water height (m): 0.2; Magnitude (Iida): -1.3Deaths: NA,1950-10-23,1950-10-23,5,DOI:10.7289/V5PN93H7,2023-02-02
List of tsunamis,SOLOMON ISLANDS-SOLOMON SEA: 08/11/1950 02:18:12,Earthquake mag: 7.3; Max water height (m): 1.2; Magnitude (Iida): NADeaths: NA,1950-11-08,1950-11-08,2,DOI:10.7289/V5PN93H7,2023-02-02
List of tsunamis,VANUATU-VANUATU ISLANDS: 02/12/1950 19:51:49,Earthquake mag: 7.8; Max water height (m): 2.5; Magnitude (Iida): NADeaths: NA,1950-12-02,1950-12-02,5,DOI:10.7289/V5PN93H7,2023-02-02
List of tsunamis,PERU-S. PERU: 10/12/1950 02:50:42,Earthquake mag: 7; Max water height (m): 0.7; Magnitude (Iida): -0.5Deaths: NA,1950-12-10,1950-12-10,1,DOI:10.7289/V5PN93H7,2023-02-02
List of tsunamis,MEXICO-S. MEXICO: 14/12/1950 14:15:49,Earthquake mag: 7.5; Max water height (m): 0.3; Magnitude (Iida): -1.5Deaths: NA,1950-12-14,1950-12-14,2,DOI:10.7289/V5PN93H7,2023-02-02
List of tsunamis,PAPUA NEW GUINEA-BISMARCK SEA: 22/02/1951 01:45:48.9,Earthquake mag: 6.1; Max water height (m): 6; Magnitude (Iida): NADeaths: NA,1951-02-22,1951-02-22,1,DOI:10.7289/V5PN93H7,2023-02-02
List of tsunamis,"USA-COLUMBIA RIVER VALLEY, WA: 23/02/1951 16:45:NA",Earthquake mag: NA; Max water height (m): 3; Magnitude (Iida): 1.6Deaths: NA,1951-02-23,1951-02-23,1,DOI:10.7289/V5PN93H7,2023-02-02
List of tsunamis,NICARAGUA-COSIGUINA VOLCANO: 03/08/1951 00:23:58,Earthquake mag: 6; Max water height (m): NA; Magnitude (Iida): NADeaths: NA,1951-08-03,1951-08-03,1,DOI:10.7289/V5PN93H7,2023-02-02
List of tsunamis,USA-HAWAII: 21/08/1951 10:57:00,Earthquake mag: 6.9; Max water height (m): 3.6; Magnitude (Iida): 1.8Deaths: NA,1951-08-21,1951-08-21,7,DOI:10.7289/V5PN93H7,2023-02-02
List of tsunamis,TAIWAN-TAIWAN: 22/10/1951 05:43:01,Earthquake mag: 7.3; Max water height (m): 0.3; Magnitude (Iida): NADeaths: NA,1951-10-22,1951-10-22,2,DOI:10.7289/V5PN93H7,2023-02-02
List of tsunamis,CHINA-CHINA: GANSU AND SHANXI PROVINCES: 21/12/1951 08:37:29,Earthquake mag: 6.3; Max water height (m): 2; Magnitude (Iida): NADeaths: NA,1951-12-21,1951-12-21,1,DOI:10.7289/V5PN93H7,2023-02-02
List of tsunamis,SOLOMON ISLANDS-KAVACHI: 22/12/1951 NA:NA:NA,Earthquake mag: NA; Max water height (m): NA; Magnitude (Iida): 2.6Deaths: NA,1951-12-22,1951-12-22,0,DOI:10.7289/V5PN93H7,2023-02-02
List of tsunamis,NORWAY-MID-NORWAY: 09/01/1952 08:NA:NA,Earthquake mag: NA; Max water height (m): 2; Magnitude (Iida): NADeaths: NA,1952-01-09,1952-01-09,0,DOI:10.7289/V5PN93H7,2023-02-02
List of tsunamis,JAPAN-SE. HOKKAIDO ISLAND: 04/03/1952 01:22:41,Earthquake mag: 8.1; Max water height (m): 6.54; Magnitude (Iida): 2.7Deaths: 33,1952-03-04,1952-03-04,218,DOI:10.7289/V5PN93H7,2023-02-02
List of tsunamis,JAPAN-SE. HOKKAIDO ISLAND: 09/03/1952 17:04:00,Earthquake mag: 7; Max water height (m): 0.3; Magnitude (Iida): -1.7Deaths: NA,1952-03-09,1952-03-09,4,DOI:10.7289/V5PN93H7,2023-02-02
List of tsunamis,USA-HAWAII: 17/03/1952 03:58:00,Earthquake mag: 4.5; Max water height (m): 3; Magnitude (Iida): NADeaths: NA,1952-03-17,1952-03-17,2,DOI:10.7289/V5PN93H7,2023-02-02
List of tsunamis,"PHILIPPINES-E. OF MINDANO, PHILIPPINES: 19/03/1952 10:57:12",Earthquake mag: 7.8; Max water height (m): 0.33; Magnitude (Iida): NADeaths: NA,1952-03-19,1952-03-19,5,DOI:10.7289/V5PN93H7,2023-02-02
List of tsunamis,"USA-COLUMBIA RIVER VALLEY, WA: 10/04/1952 NA:NA:NA",Earthquake mag: NA; Max water height (m): 19.81; Magnitude (Iida): NADeaths: NA,1952-04-10,1952-04-10,1,DOI:10.7289/V5PN93H7,2023-02-02
List of tsunamis,"USA-LAKE HURON, MI: 06/05/1952 NA:NA:NA",Earthquake mag: NA; Max water height (m): 1.52; Magnitude (Iida): NADeaths: NA,1952-05-06,1952-05-06,3,DOI:10.7289/V5PN93H7,2023-02-02
List of tsunamis,COSTA RICA-COSTA RICA-PANAMA: 13/05/1952 19:32:00,Earthquake mag: 6.9; Max water height (m): 0.1; Magnitude (Iida): -3.3Deaths: NA,1952-05-13,1952-05-13,2,DOI:10.7289/V5PN93H7,2023-02-02
List of tsunamis,VANUATU-OFF EAST COAST OF VANUATU: 13/07/1952 11:58:33,Earthquake mag: 6.8; Max water height (m): NA; Magnitude (Iida): NADeaths: NA,1952-07-13,1952-07-13,2,DOI:10.7289/V5PN93H7,2023-02-02
List of tsunamis,JAPAN-MYOJINSHO SUBMARINE VOLCANO: 16/09/1952 02:50:NA,Earthquake mag: NA; Max water height (m): 0.15; Magnitude (Iida): -1Deaths: NA,1952-09-16,1952-09-16,1,DOI:10.7289/V5PN93H7,2023-02-02
List of tsunamis,JAPAN-MYOJINSHO SUBMARINE VOLCANO: 23/09/1952 04:20:00,Earthquake mag: NA; Max water height (m): 0.05; Magnitude (Iida): -1Deaths: NA,1952-09-23,1952-09-23,1,DOI:10.7289/V5PN93H7,2023-02-02
List of tsunamis,JAPAN-MYOJINSHO SUBMARINE VOLCANO: 24/09/1952 03:23:00,Earthquake mag: NA; Max water height (m): 0.15; Magnitude (Iida): -1Deaths: NA,1952-09-24,1952-09-24,1,DOI:10.7289/V5PN93H7,2023-02-02
List of tsunamis,JAPAN-MYOJINSHO SUBMARINE VOLCANO: 26/09/1952 03:33:00,Earthquake mag: NA; Max water height (m): 0.1; Magnitude (Iida): -1Deaths: NA,1952-09-26,1952-09-26,2,DOI:10.7289/V5PN93H7,2023-02-02
List of tsunamis,"USA-COLUMBIA RIVER VALLEY, WA: 13/10/1952 NA:NA:NA",Earthquake mag: NA; Max water height (m): NA; Magnitude (Iida): NADeaths: NA,1952-10-13,1952-10-13,1,DOI:10.7289/V5PN93H7,2023-02-02
List of tsunamis,RUSSIA-KAMCHATKA: 04/11/1952 16:58:27.9,Earthquake mag: 9; Max water height (m): 23; Magnitude (Iida): 4.2Deaths: 10000,1952-11-04,1952-11-04,327,DOI:10.7289/V5PN93H7,2023-02-02
List of tsunamis,"GREENLAND-SOUTH COAST OF NUUSSUAQ, GREENLAND: 15/12/1952 17:00:NA",Earthquake mag: NA; Max water height (m): 2.5; Magnitude (Iida): NADeaths: 1,1952-12-15,1952-12-15,2,DOI:10.7289/V5PN93H7,2023-02-02
List of tsunamis,"USA-COLUMBIA RIVER VALLEY, WA: 14/02/1953 NA:NA:NA",Earthquake mag: NA; Max water height (m): NA; Magnitude (Iida): NADeaths: NA,1953-02-14,1953-02-14,1,DOI:10.7289/V5PN93H7,2023-02-02
List of tsunamis,PERU-CENTRAL PERU: 15/02/1953 NA:NA:NA,Earthquake mag: 5.5; Max water height (m): 0.7; Magnitude (Iida): -0.5Deaths: NA,1953-02-15,1953-02-15,1,DOI:10.7289/V5PN93H7,2023-02-02
List of tsunamis,"USA-COLUMBIA RIVER VALLEY, WA: 16/02/1953 11:43:NA",Earthquake mag: NA; Max water height (m): 4.8; Magnitude (Iida): NADeaths: NA,1953-02-16,1953-02-16,1,DOI:10.7289/V5PN93H7,2023-02-02
List of tsunamis,JAPAN-MYOJINSHO SUBMARINE VOLCANO: 11/03/1953 NA:NA:NA,Earthquake mag: NA; Max water height (m): 6; Magnitude (Iida): -1Deaths: NA,1953-03-11,1953-03-11,2,DOI:10.7289/V5PN93H7,2023-02-02
List of tsunamis,RUSSIA-N. KURIL ISLANDS: 17/03/1953 13:04:NA,Earthquake mag: 5.8; Max water height (m): 3; Magnitude (Iida): 0.6Deaths: NA,1953-03-17,1953-03-17,1,DOI:10.7289/V5PN93H7,2023-02-02
List of tsunamis,JAPAN-MYOJINSHO SUBMARINE VOLCANO: 25/03/1953 NA:NA:NA,Earthquake mag: NA; Max water height (m): 0.05; Magnitude (Iida): -1Deaths: NA,1953-03-25,1953-03-25,1,DOI:10.7289/V5PN93H7,2023-02-02
List of tsunamis,"PAPUA NEW GUINEA-RABAUL, NEW BRITAIN: 23/04/1953 16:24:34",Earthquake mag: 7.4; Max water height (m): NA; Magnitude (Iida): NADeaths: NA,1953-04-23,1953-04-23,2,DOI:10.7289/V5PN93H7,2023-02-02
List of tsunamis,CHILE-CENTRAL CHILE: 06/05/1953 17:16:43,Earthquake mag: 7.6; Max water height (m): NA; Magnitude (Iida): NADeaths: NA,1953-05-06,1953-05-06,0,DOI:10.7289/V5PN93H7,2023-02-02
List of tsunamis,DOMINICAN REPUBLIC-PUERTO PLATA: 31/05/1953 19:58:NA,Earthquake mag: 7.2; Max water height (m): 0.06; Magnitude (Iida): -3.3Deaths: NA,1953-05-31,1953-05-31,1,DOI:10.7289/V5PN93H7,2023-02-02
List of tsunamis,PAPUA NEW GUINEA-BISMARCK SEA: 27/06/1953 NA:NA:NA,Earthquake mag: NA; Max water height (m): NA; Magnitude (Iida): 0.5Deaths: NA,1953-06-27,1953-06-27,1,DOI:10.7289/V5PN93H7,2023-02-02
List of tsunamis,GREECE-IONIAN SEA: 12/08/1953 09:23:52,Earthquake mag: 7.2; Max water height (m): NA; Magnitude (Iida): NADeaths: NA,1953-08-12,1953-08-12,0,DOI:10.7289/V5PN93H7,2023-02-02
List of tsunamis,"USA-COLUMBIA RIVER VALLEY, WA: 19/08/1953 19:00:NA",Earthquake mag: NA; Max water height (m): NA; Magnitude (Iida): NADeaths: NA,1953-08-19,1953-08-19,1,DOI:10.7289/V5PN93H7,2023-02-02
List of tsunamis,CYPRUS-LEVANTIAN SEA: 10/09/1953 04:06:4.1,Earthquake mag: 6.3; Max water height (m): NA; Magnitude (Iida): NADeaths: NA,1953-09-10,1953-09-10,2,DOI:10.7289/V5PN93H7,2023-02-02
List of tsunamis,FIJI-FIJI ISLANDS: 14/09/1953 00:26:36,Earthquake mag: 6.4; Max water height (m): 15; Magnitude (Iida): 1Deaths: 5,1953-09-14,1953-09-14,31,DOI:10.7289/V5PN93H7,2023-02-02
List of tsunamis,AUSTRALIA-TASMANIA: 14/11/1953 NA:NA:NA,Earthquake mag: NA; Max water height (m): 2.4; Magnitude (Iida): NADeaths: 1,1953-11-14,1953-11-14,1,DOI:10.7289/V5PN93H7,2023-02-02
List of tsunamis,"JAPAN-KASHIMA, JAPAN: 25/11/1953 17:48:NA",Earthquake mag: 7.4; Max water height (m): 3; Magnitude (Iida): 1.5Deaths: NA,1953-11-25,1953-11-25,33,DOI:10.7289/V5PN93H7,2023-02-02
List of tsunamis,PERU-N. PERU: 12/12/1953 17:31:25,Earthquake mag: 7.4; Max water height (m): 1; Magnitude (Iida): -1Deaths: NA,1953-12-12,1953-12-12,2,DOI:10.7289/V5PN93H7,2023-02-02
List of tsunamis,ARGENTINA-MAR DEL PLATA: 21/01/1954 14:00:NA,Earthquake mag: NA; Max water height (m): 1; Magnitude (Iida): NADeaths: NA,1954-01-21,1954-01-21,1,DOI:10.7289/V5PN93H7,2023-02-02
List of tsunamis,CHINA-CHINA: GANSU AND SHANXI PROVINCES: 11/02/1954 00:30:15,Earthquake mag: 7.3; Max water height (m): NA; Magnitude (Iida): NADeaths: NA,1954-02-11,1954-02-11,1,DOI:10.7289/V5PN93H7,2023-02-02
List of tsunamis,ITALY-STROMBOLI ISLAND: NA/02/1954 NA:NA:NA,Earthquake mag: NA; Max water height (m): NA; Magnitude (Iida): NADeaths: NA,,,4,DOI:10.7289/V5PN93H7,2023-02-02
List of tsunamis,"USA-MICHIGAN CITY, IN (LAKE MICHIGAN): 26/06/1954 NA:NA:NA",Earthquake mag: NA; Max water height (m): 3; Magnitude (Iida): NADeaths: 7,1954-06-26,1954-06-26,5,DOI:10.7289/V5PN93H7,2023-02-02
List of tsunamis,ALGERIA-SEA OF ALBORAN: 09/09/1954 01:04:43.4,Earthquake mag: 6.7; Max water height (m): 0.33; Magnitude (Iida): NADeaths: NA,1954-09-09,1954-09-09,4,DOI:10.7289/V5PN93H7,2023-02-02
List of tsunamis,"GREENLAND-APUTITEQ POINT, GREENLAND: NA/10/1954 NA:NA:NA",Earthquake mag: NA; Max water height (m): 18.28; Magnitude (Iida): 4.2Deaths: NA,,,1,DOI:10.7289/V5PN93H7,2023-02-02
List of tsunamis,"JAPAN-MIYAGI, JAPAN: 18/11/1954 20:44:55",Earthquake mag: 6.1; Max water height (m): NA; Magnitude (Iida): NADeaths: NA,1954-11-18,1954-11-18,3,DOI:10.7289/V5PN93H7,2023-02-02
List of tsunamis,VENEZUELA-OFF THE COAST NEAR LA VELA: 18/01/1955 NA:NA:NA,Earthquake mag: 5.5; Max water height (m): NA; Magnitude (Iida): NADeaths: NA,1955-01-18,1955-01-18,1,DOI:10.7289/V5PN93H7,2023-02-02
List of tsunamis,GREECE-VOLOS GULF: 19/04/1955 16:47:19,Earthquake mag: 6.2; Max water height (m): NA; Magnitude (Iida): NADeaths: NA,1955-04-19,1955-04-19,1,DOI:10.7289/V5PN93H7,2023-02-02
List of tsunamis,CHILE-CENTRAL CHILE: 19/04/1955 20:24:05,Earthquake mag: 7.1; Max water height (m): 1; Magnitude (Iida): NADeaths: 1,1955-04-19,1955-04-19,7,DOI:10.7289/V5PN93H7,2023-02-02
List of tsunamis,INDIA-LITTLE NICOBAR ISLAND: 17/05/1955 14:49:49,Earthquake mag: 7.3; Max water height (m): NA; Magnitude (Iida): NADeaths: NA,1955-05-17,1955-05-17,0,DOI:10.7289/V5PN93H7,2023-02-02
List of tsunamis,PAPUA NEW GUINEA-SOLOMON SEA: 08/09/1955 03:27:14,Earthquake mag: 6.5; Max water height (m): NA; Magnitude (Iida): NADeaths: NA,1955-09-08,1955-09-08,1,DOI:10.7289/V5PN93H7,2023-02-02
List of tsunamis,"CHINA-JINSHA RIVER, YUNNAN PROVINCE: 23/09/1955 15:06:23",Earthquake mag: 6.8; Max water height (m): 1; Magnitude (Iida): NADeaths: NA,1955-09-23,1955-09-23,0,DOI:10.7289/V5PN93H7,2023-02-02
List of tsunamis,PAPUA NEW GUINEA-BISMARCK SEA: 10/10/1955 08:57:52.9,Earthquake mag: 7.3; Max water height (m): NA; Magnitude (Iida): NADeaths: NA,1955-10-10,1955-10-10,1,DOI:10.7289/V5PN93H7,2023-02-02
List of tsunamis,CHILE-NORTHERN CHILE: 08/01/1956 20:54:13,Earthquake mag: 7.1; Max water height (m): NA; Magnitude (Iida): NADeaths: NA,1956-01-08,1956-01-08,0,DOI:10.7289/V5PN93H7,2023-02-02
List of tsunamis,"NEW ZEALAND-LAKE TAUPO, NORTH ISLAND: 02/03/1956 22:43:NA",Earthquake mag: 5.3; Max water height (m): 0.9; Magnitude (Iida): NADeaths: NA,1956-03-02,1956-03-02,0,DOI:10.7289/V5PN93H7,2023-02-02
List of tsunamis,JAPAN-NE. HOKKAIDO ISLAND: 05/03/1956 23:29:NA,Earthquake mag: 6.3; Max water height (m): 0.4; Magnitude (Iida): -1.3Deaths: NA,1956-03-05,1956-03-05,1,DOI:10.7289/V5PN93H7,2023-02-02
List of tsunamis,RUSSIA-KAMCHATKA: 30/03/1956 06:11:NA,Earthquake mag: NA; Max water height (m): 0.3; Magnitude (Iida): -0.7Deaths: NA,1956-03-30,1956-03-30,13,DOI:10.7289/V5PN93H7,2023-02-02
List of tsunamis,GREECE-CYCLADES: 09/07/1956 03:11:45.2,Earthquake mag: 7.7; Max water height (m): 30; Magnitude (Iida): 5Deaths: 3,1956-07-09,1956-07-09,100,DOI:10.7289/V5PN93H7,2023-02-02
List of tsunamis,"GREECE-AMORGOS ISLAND, AEGEAN ISLANDS: 09/07/1956 03:24:NA",Earthquake mag: 6.8; Max water height (m): 10; Magnitude (Iida): NADeaths: NA,1956-07-09,1956-07-09,1,DOI:10.7289/V5PN93H7,2023-02-02
List of tsunamis,JAPAN-IZU PENINSULA: 12/08/1956 16:59:37.6,Earthquake mag: 6.5; Max water height (m): NA; Magnitude (Iida): -1Deaths: NA,1956-08-12,1956-08-12,1,DOI:10.7289/V5PN93H7,2023-02-02
List of tsunamis,GREECE-NORTH AEGEAN: 02/11/1956 16:04:33,Earthquake mag: 5.8; Max water height (m): 1.2; Magnitude (Iida): 0.3Deaths: NA,1956-11-02,1956-11-02,1,DOI:10.7289/V5PN93H7,2023-02-02
List of tsunamis,CHILE-NORTHERN CHILE: 18/12/1956 02:31:03,Earthquake mag: 7; Max water height (m): NA; Magnitude (Iida): NADeaths: NA,1956-12-18,1956-12-18,0,DOI:10.7289/V5PN93H7,2023-02-02
List of tsunamis,"USA-ANDREANOF ISLANDS, AK: 09/03/1957 14:22:31.9",Earthquake mag: 8.6; Max water height (m): 32; Magnitude (Iida): 3.9Deaths: 2,1957-03-09,1957-03-09,332,DOI:10.7289/V5PN93H7,2023-02-02
List of tsunamis,INDONESIA-NW. IRIAN JAYA: 22/06/1957 23:50:23,Earthquake mag: 7.3; Max water height (m): 1.8; Magnitude (Iida): 0.8Deaths: NA,1957-06-22,1957-06-22,2,DOI:10.7289/V5PN93H7,2023-02-02
List of tsunamis,MEXICO-S. MEXICO: 28/07/1957 08:40:01,Earthquake mag: 7.9; Max water height (m): 1.3; Magnitude (Iida): 1.3Deaths: NA,1957-07-28,1957-07-28,3,DOI:10.7289/V5PN93H7,2023-02-02
List of tsunamis,CHILE-NORTHERN CHILE: 29/07/1957 17:15:14,Earthquake mag: 7; Max water height (m): NA; Magnitude (Iida): NADeaths: NA,1957-07-29,1957-07-29,0,DOI:10.7289/V5PN93H7,2023-02-02
List of tsunamis,INDONESIA-SOUTH OF JAVA: 26/09/1957 NA:NA:NA,Earthquake mag: 5.5; Max water height (m): 0.7; Magnitude (Iida): -0.5Deaths: NA,1957-09-26,1957-09-26,0,DOI:10.7289/V5PN93H7,2023-02-02
List of tsunamis,INDONESIA-MAKASSAR STRAIT: 26/10/1957 14:16:57,Earthquake mag: 6; Max water height (m): NA; Magnitude (Iida): NADeaths: NA,1957-10-26,1957-10-26,1,DOI:10.7289/V5PN93H7,2023-02-02
List of tsunamis,USA-HAWAII: 01/11/1957 05:00:NA,Earthquake mag: NA; Max water height (m): 0.1; Magnitude (Iida): NADeaths: NA,1957-11-01,1957-11-01,5,DOI:10.7289/V5PN93H7,2023-02-02
List of tsunamis,"SOLOMON ISLANDS-MALAITA ISLAND, SOLOMON ISLANDS: NA/11/1957 NA:NA:NA",Earthquake mag: NA; Max water height (m): 2.7; Magnitude (Iida): 1.4Deaths: NA,,,2,DOI:10.7289/V5PN93H7,2023-02-02
List of tsunamis,ECUADOR-COLOMBIA-ECUADOR: 19/01/1958 14:07:27,Earthquake mag: 7.6; Max water height (m): NA; Magnitude (Iida): NADeaths: 4,1958-01-19,1958-01-19,3,DOI:10.7289/V5PN93H7,2023-02-02
List of tsunamis,CHINA-SICHUAN PROVINCE: 07/02/1958 23:23:36,Earthquake mag: 6.2; Max water height (m): NA; Magnitude (Iida): NADeaths: NA,1958-02-07,1958-02-07,1,DOI:10.7289/V5PN93H7,2023-02-02
List of tsunamis,PERU-PERU: 09/04/1958 NA:NA:NA,Earthquake mag: NA; Max water height (m): NA; Magnitude (Iida): NADeaths: NA,1958-04-09,1958-04-09,0,DOI:10.7289/V5PN93H7,2023-02-02
List of tsunamis,"INDONESIA-BENGKULU, SUMATRA: 21/04/1958 22:37:46",Earthquake mag: 6.5; Max water height (m): NA; Magnitude (Iida): NADeaths: NA,1958-04-21,1958-04-21,0,DOI:10.7289/V5PN93H7,2023-02-02
List of tsunamis,"USA-SE. ALASKA, AK: 10/07/1958 06:15:59.9",Earthquake mag: 7.8; Max water height (m): 524.6; Magnitude (Iida): 4.6Deaths: 5,1958-07-10,1958-07-10,17,DOI:10.7289/V5PN93H7,2023-02-02
List of tsunamis,RUSSIA-N. KURIL ISLANDS: 17/09/1958 12:24:NA,Earthquake mag: 5; Max water height (m): 0.23; Magnitude (Iida): -2.3Deaths: NA,1958-09-17,1958-09-17,1,DOI:10.7289/V5PN93H7,2023-02-02
List of tsunamis,VANUATU-KUWAE VOLCANO: 07/10/1958 10:00:NA,Earthquake mag: NA; Max water height (m): NA; Magnitude (Iida): NADeaths: NA,1958-10-07,1958-10-07,1,DOI:10.7289/V5PN93H7,2023-02-02
List of tsunamis,PACIFIC OCEAN-EAST PACIFIC RISE: 04/11/1958 22:54:46,Earthquake mag: 6.1; Max water height (m): 0.1; Magnitude (Iida): NADeaths: NA,1958-11-04,1958-11-04,1,DOI:10.7289/V5PN93H7,2023-02-02
List of tsunamis,RUSSIA-S. KURIL ISLANDS: 06/11/1958 22:58:8.6,Earthquake mag: 8.3; Max water height (m): 5; Magnitude (Iida): 2Deaths: NA,1958-11-06,1958-11-06,60,DOI:10.7289/V5PN93H7,2023-02-02
List of tsunamis,RUSSIA-S. KURIL ISLANDS: 12/11/1958 20:23:NA,Earthquake mag: 7; Max water height (m): 1; Magnitude (Iida): NADeaths: NA,1958-11-12,1958-11-12,8,DOI:10.7289/V5PN93H7,2023-02-02
List of tsunamis,JAPAN-SANRIKU: 22/01/1959 05:10:00,Earthquake mag: 6.8; Max water height (m): 0.8; Magnitude (Iida): -0.3Deaths: NA,1959-01-22,1959-01-22,9,DOI:10.7289/V5PN93H7,2023-02-02
List of tsunamis,PERU-N. PERU: 07/02/1959 09:36:51,Earthquake mag: 7.4; Max water height (m): 0.4; Magnitude (Iida): NADeaths: NA,1959-02-07,1959-02-07,1,DOI:10.7289/V5PN93H7,2023-02-02
List of tsunamis,"GREECE-GRECIAN ARCHIPELAGO, CRETE: 23/02/1959 NA:NA:NA",Earthquake mag: NA; Max water height (m): 1; Magnitude (Iida): NADeaths: NA,1959-02-23,1959-02-23,4,DOI:10.7289/V5PN93H7,2023-02-02
List of tsunamis,RUSSIA-S. KURIL ISLANDS: 09/04/1959 12:24:20,Earthquake mag: 5; Max water height (m): 0.1; Magnitude (Iida): -3.3Deaths: NA,1959-04-09,1959-04-09,1,DOI:10.7289/V5PN93H7,2023-02-02
List of tsunamis,RUSSIA-KAMCHATKA: 04/05/1959 07:15:42,Earthquake mag: 8.2; Max water height (m): 0.2; Magnitude (Iida): 1Deaths: NA,1959-05-04,1959-05-04,7,DOI:10.7289/V5PN93H7,2023-02-02
List of tsunamis,NORWAY-NORTHERN NORWAY: 07/05/1959 NA:NA:NA,Earthquake mag: NA; Max water height (m): 4; Magnitude (Iida): NADeaths: NA,1959-05-07,1959-05-07,1,DOI:10.7289/V5PN93H7,2023-02-02
List of tsunamis,SOLOMON ISLANDS-SOLOMON ISLANDS: 17/08/1959 21:04:40,Earthquake mag: 7.3; Max water height (m): 1; Magnitude (Iida): 1.3Deaths: NA,1959-08-17,1959-08-17,5,DOI:10.7289/V5PN93H7,2023-02-02
List of tsunamis,"USA-HEGBEN LAKE, MONTANA: 18/08/1959 06:37:13.5",Earthquake mag: 7.5; Max water height (m): 1; Magnitude (Iida): NADeaths: NA,1959-08-18,1959-08-18,1,DOI:10.7289/V5PN93H7,2023-02-02
List of tsunamis,RUSSIA-LAKE BAYKAL (BAIKAL): 29/08/1959 17:03:10,Earthquake mag: 6.5; Max water height (m): NA; Magnitude (Iida): NADeaths: NA,1959-08-29,1959-08-29,0,DOI:10.7289/V5PN93H7,2023-02-02
List of tsunamis,JAPAN-SANRIKU: 26/10/1959 07:35:00,Earthquake mag: 6.7; Max water height (m): 0.11; Magnitude (Iida): -3.3Deaths: NA,1959-10-26,1959-10-26,8,DOI:10.7289/V5PN93H7,2023-02-02
List of tsunamis,PERU-S. PERU: 13/01/1960 15:40:34,Earthquake mag: 7.8; Max water height (m): 5.7; Magnitude (Iida): 2.6Deaths: NA,1960-01-13,1960-01-13,1,DOI:10.7289/V5PN93H7,2023-02-02
List of tsunamis,MOROCCO-MOROCCO: 29/02/1960 23:40:12,Earthquake mag: 6.8; Max water height (m): NA; Magnitude (Iida): NADeaths: NA,1960-02-29,1960-02-29,1,DOI:10.7289/V5PN93H7,2023-02-02
List of tsunamis,JAPAN-SANRIKU: 20/03/1960 17:07:30,Earthquake mag: 7.5; Max water height (m): 1; Magnitude (Iida): 0Deaths: NA,1960-03-20,1960-03-20,19,DOI:10.7289/V5PN93H7,2023-02-02
List of tsunamis,JAPAN-SANRIKU: 23/03/1960 00:23:NA,Earthquake mag: 6.7; Max water height (m): 0.75; Magnitude (Iida): -1Deaths: NA,1960-03-23,1960-03-23,12,DOI:10.7289/V5PN93H7,2023-02-02
List of tsunamis,CHILE-CENTRAL CHILE: 21/05/1960 10:02:50,Earthquake mag: 8.2; Max water height (m): 0.5; Magnitude (Iida): NADeaths: NA,1960-05-21,1960-05-21,7,DOI:10.7289/V5PN93H7,2023-02-02
List of tsunamis,CHILE-SOUTHERN CHILE: 22/05/1960 19:11:17,Earthquake mag: 9.5; Max water height (m): 25; Magnitude (Iida): 4.6Deaths: 2226,1960-05-22,1960-05-22,1279,DOI:10.7289/V5PN93H7,2023-02-02
List of tsunamis,CHILE-SOUTHERN CHILE: 24/05/1960 NA:NA:NA,Earthquake mag: 6.7; Max water height (m): NA; Magnitude (Iida): NADeaths: NA,1960-05-24,1960-05-24,0,DOI:10.7289/V5PN93H7,2023-02-02
List of tsunamis,PAPUA NEW GUINEA-SOLOMON SEA: 11/06/1960 15:14:09,Earthquake mag: 6.6; Max water height (m): NA; Magnitude (Iida): -0.5Deaths: NA,1960-06-11,1960-06-11,1,DOI:10.7289/V5PN93H7,2023-02-02
List of tsunamis,JAPAN-SANRIKU: 29/07/1960 17:31:45,Earthquake mag: 6.7; Max water height (m): 0.3; Magnitude (Iida): -1Deaths: NA,1960-07-29,1960-07-29,5,DOI:10.7289/V5PN93H7,2023-02-02
List of tsunamis,CHILE-SOUTHERN CHILE: 01/11/1960 08:45:59,Earthquake mag: 7.4; Max water height (m): NA; Magnitude (Iida): NADeaths: NA,1960-11-01,1960-11-01,0,DOI:10.7289/V5PN93H7,2023-02-02
List of tsunamis,PERU-N. PERU: 20/11/1960 22:01:56.4,Earthquake mag: 6.8; Max water height (m): 9; Magnitude (Iida): 3.2Deaths: 66,1960-11-20,1960-11-20,19,DOI:10.7289/V5PN93H7,2023-02-02
List of tsunamis,"JAPAN-KASHIMA, JAPAN: 16/01/1961 07:20:00",Earthquake mag: 6.8; Max water height (m): 0.4; Magnitude (Iida): -1.3Deaths: NA,1961-01-16,1961-01-16,5,DOI:10.7289/V5PN93H7,2023-02-02
List of tsunamis,"JAPAN-KASHIMA, JAPAN: 16/01/1961 11:19:00",Earthquake mag: 6.4; Max water height (m): 0.4; Magnitude (Iida): -1.3Deaths: NA,1961-01-16,1961-01-16,2,DOI:10.7289/V5PN93H7,2023-02-02
List of tsunamis,"JAPAN-KASHIMA, JAPAN: 16/01/1961 12:12:00",Earthquake mag: 6.5; Max water height (m): 0.4; Magnitude (Iida): -1.3Deaths: NA,1961-01-16,1961-01-16,4,DOI:10.7289/V5PN93H7,2023-02-02
List of tsunamis,RUSSIA-S. KURIL ISLANDS: 12/02/1961 21:53:00,Earthquake mag: 6.6; Max water height (m): 1; Magnitude (Iida): NADeaths: NA,1961-02-12,1961-02-12,5,DOI:10.7289/V5PN93H7,2023-02-02
List of tsunamis,JAPAN-SEIKAIDO: 26/02/1961 18:10:48.7,Earthquake mag: 7.6; Max water height (m): 0.65; Magnitude (Iida): NADeaths: NA,1961-02-26,1961-02-26,34,DOI:10.7289/V5PN93H7,2023-02-02
List of tsunamis,"SOLOMON ISLANDS-HONIARA, GUADALCANAL: 18/03/1961 NA:NA:NA",Earthquake mag: NA; Max water height (m): 3.6; Magnitude (Iida): NADeaths: NA,1961-03-18,1961-03-18,2,DOI:10.7289/V5PN93H7,2023-02-02
List of tsunamis,TURKEY-ASIA MINOR: 23/05/1961 02:45:19,Earthquake mag: 6.4; Max water height (m): NA; Magnitude (Iida): NADeaths: NA,1961-05-23,1961-05-23,0,DOI:10.7289/V5PN93H7,2023-02-02
List of tsunamis,ITALY-AEGEAN SEA: 06/06/1961 NA:NA:NA,Earthquake mag: NA; Max water height (m): 0.9; Magnitude (Iida): -0.1Deaths: NA,1961-06-06,1961-06-06,3,DOI:10.7289/V5PN93H7,2023-02-02
List of tsunamis,COLOMBIA-NORTHEASTERN: 16/06/1961 10:31:57.3,Earthquake mag: 6.5; Max water height (m): NA; Magnitude (Iida): NADeaths: NA,1961-06-16,1961-06-16,1,DOI:10.7289/V5PN93H7,2023-02-02
List of tsunamis,JAPAN-RYUKYU ISLANDS: 18/07/1961 14:04:00,Earthquake mag: 6.6; Max water height (m): 0.2; Magnitude (Iida): -2.3Deaths: NA,1961-07-18,1961-07-18,6,DOI:10.7289/V5PN93H7,2023-02-02
List of tsunamis,VANUATU-VANUATU ISLANDS: 23/07/1961 21:51:10.5,Earthquake mag: 7.3; Max water height (m): 0.9; Magnitude (Iida): NADeaths: NA,1961-07-23,1961-07-23,2,DOI:10.7289/V5PN93H7,2023-02-02
List of tsunamis,SOLOMON ISLANDS-SOLOMON SEA: 01/08/1961 05:39:54.4,Earthquake mag: 6.4; Max water height (m): 0.9; Magnitude (Iida): NADeaths: NA,1961-08-01,1961-08-01,0,DOI:10.7289/V5PN93H7,2023-02-02
List of tsunamis,JAPAN-SE. HOKKAIDO ISLAND: 11/08/1961 15:51:00,Earthquake mag: 7; Max water height (m): 0.1; Magnitude (Iida): -3.3Deaths: NA,1961-08-11,1961-08-11,9,DOI:10.7289/V5PN93H7,2023-02-02
List of tsunamis,CHILE-CENTRAL CHILE: 18/10/1961 16:51:57,Earthquake mag: 6.5; Max water height (m): NA; Magnitude (Iida): NADeaths: NA,1961-10-18,1961-10-18,0,DOI:10.7289/V5PN93H7,2023-02-02
List of tsunamis,CHILE-CENTRAL CHILE: 18/10/1961 16:51:57,Earthquake mag: 6.5; Max water height (m): NA; Magnitude (Iida): NADeaths: NA,1961-10-18,1961-10-18,0,DOI:10.7289/V5PN93H7,2023-02-02
List of tsunamis,JAPAN-SE. HOKKAIDO ISLAND: 15/11/1961 07:17:00,Earthquake mag: 6.9; Max water height (m): 0.1; Magnitude (Iida): -3.3Deaths: NA,1961-11-15,1961-11-15,9,DOI:10.7289/V5PN93H7,2023-02-02
List of tsunamis,CROATIA-DALMATIAN COASTS: 11/01/1962 05:05:NA,Earthquake mag: 6.1; Max water height (m): 0.04; Magnitude (Iida): NADeaths: NA,1962-01-11,1962-01-11,1,DOI:10.7289/V5PN93H7,2023-02-02
List of tsunamis,PANAMA-COSTA RICA-PANAMA: 12/03/1962 11:40:16.7,Earthquake mag: 6.8; Max water height (m): 0.1; Magnitude (Iida): -3.3Deaths: NA,1962-03-12,1962-03-12,2,DOI:10.7289/V5PN93H7,2023-02-02
List of tsunamis,JAPAN-SANRIKU: 12/04/1962 00:52:43,Earthquake mag: 7.2; Max water height (m): 1; Magnitude (Iida): NADeaths: NA,1962-04-12,1962-04-12,12,DOI:10.7289/V5PN93H7,2023-02-02
List of tsunamis,JAPAN-SE. HOKKAIDO ISLAND: 23/04/1962 05:58:00,Earthquake mag: 7; Max water height (m): 0.1; Magnitude (Iida): -3.3Deaths: NA,1962-04-23,1962-04-23,10,DOI:10.7289/V5PN93H7,2023-02-02
List of tsunamis,MEXICO-S. MEXICO: 11/05/1962 14:11:54.1,Earthquake mag: 7; Max water height (m): 0.81; Magnitude (Iida): -0.3Deaths: NA,1962-05-11,1962-05-11,1,DOI:10.7289/V5PN93H7,2023-02-02
List of tsunamis,MEXICO-S. MEXICO: 19/05/1962 14:58:15,Earthquake mag: 7.2; Max water height (m): 0.34; Magnitude (Iida): NADeaths: NA,1962-05-19,1962-05-19,1,DOI:10.7289/V5PN93H7,2023-02-02
List of tsunamis,JAPAN-OFF COAST OF HONSHU ISLAND: 21/05/1962 12:21:NA,Earthquake mag: 5.7; Max water height (m): 0.1; Magnitude (Iida): NADeaths: NA,1962-05-21,1962-05-21,1,DOI:10.7289/V5PN93H7,2023-02-02
List of tsunamis,GREECE-NORTH AEGEAN SEA: 28/05/1962 22:57:47,Earthquake mag: 4.5; Max water height (m): NA; Magnitude (Iida): NADeaths: NA,1962-05-28,1962-05-28,1,DOI:10.7289/V5PN93H7,2023-02-02
List of tsunamis,"USA-FOX ISLANDS, ALEUTIAN ISLANDS, AK: 21/12/1962 08:42:43",Earthquake mag: 6.5; Max water height (m): NA; Magnitude (Iida): NADeaths: NA,1962-12-21,1962-12-21,1,DOI:10.7289/V5PN93H7,2023-02-02
List of tsunamis,GREECE-CORINTH GULF: 07/02/1963 19:28:NA,Earthquake mag: NA; Max water height (m): 6; Magnitude (Iida): NADeaths: 2,1963-02-07,1963-02-07,9,DOI:10.7289/V5PN93H7,2023-02-02
List of tsunamis,TAIWAN-E. TAIWAN-RYUKYU ISLANDS: 13/02/1963 08:50:4.5,Earthquake mag: 7.3; Max water height (m): 0.2; Magnitude (Iida): -2.3Deaths: NA,1963-02-13,1963-02-13,2,DOI:10.7289/V5PN93H7,2023-02-02
List of tsunamis,"CANADA-GRAHAM ISLAND, BRITISH COLUMBIA: 28/03/1963 10:NA:NA",Earthquake mag: NA; Max water height (m): 5.5; Magnitude (Iida): NADeaths: 1,1963-03-28,1963-03-28,7,DOI:10.7289/V5PN93H7,2023-02-02
List of tsunamis,INDONESIA-LESSER SUNDA: BALI: AGUNG VOLCANO: 30/03/1963 NA:NA:NA,Earthquake mag: NA; Max water height (m): NA; Magnitude (Iida): NADeaths: NA,1963-03-30,1963-03-30,2,DOI:10.7289/V5PN93H7,2023-02-02
List of tsunamis,TURKEY-MARMARA SEA: 18/09/1963 16:58:14.8,Earthquake mag: 6.2; Max water height (m): 1; Magnitude (Iida): NADeaths: NA,1963-09-18,1963-09-18,1,DOI:10.7289/V5PN93H7,2023-02-02
List of tsunamis,PERU-CENTRAL PERU: 24/09/1963 16:30:16,Earthquake mag: 7; Max water height (m): NA; Magnitude (Iida): NADeaths: NA,1963-09-24,1963-09-24,0,DOI:10.7289/V5PN93H7,2023-02-02
List of tsunamis,"ITALY-VAJONT DAM, VAJONT RIVER: 09/10/1963 21:39:NA",Earthquake mag: NA; Max water height (m): 235; Magnitude (Iida): NADeaths: 2000,1963-10-09,1963-10-09,6,DOI:10.7289/V5PN93H7,2023-02-02
List of tsunamis,RUSSIA-S. KURIL ISLANDS: 12/10/1963 11:27:0.2,Earthquake mag: 7.1; Max water height (m): 0.12; Magnitude (Iida): -3.3Deaths: NA,1963-10-12,1963-10-12,3,DOI:10.7289/V5PN93H7,2023-02-02
List of tsunamis,RUSSIA-S. KURIL ISLANDS: 13/10/1963 05:17:53.4,Earthquake mag: 8.5; Max water height (m): 4.5; Magnitude (Iida): 2.3Deaths: NA,1963-10-13,1963-10-13,90,DOI:10.7289/V5PN93H7,2023-02-02
List of tsunamis,RUSSIA-S. KURIL ISLANDS: 20/10/1963 00:53:10.9,Earthquake mag: 7.9; Max water height (m): 15; Magnitude (Iida): 3.9Deaths: NA,1963-10-20,1963-10-20,22,DOI:10.7289/V5PN93H7,2023-02-02
List of tsunamis,INDONESIA-JAVA: 16/12/1963 01:51:31,Earthquake mag: 6.6; Max water height (m): NA; Magnitude (Iida): -0.5Deaths: NA,1963-12-16,1963-12-16,1,DOI:10.7289/V5PN93H7,2023-02-02
List of tsunamis,TONGA-TONGA TRENCH: 18/12/1963 00:30:00,Earthquake mag: 7.2; Max water height (m): NA; Magnitude (Iida): NADeaths: NA,1963-12-18,1963-12-18,1,DOI:10.7289/V5PN93H7,2023-02-02
List of tsunamis,"USA-GULF OF ALASKA, AK: 20/03/1964 16:NA:NA",Earthquake mag: NA; Max water height (m): 0.08; Magnitude (Iida): NADeaths: NA,1964-03-20,1964-03-20,1,DOI:10.7289/V5PN93H7,2023-02-02
List of tsunamis,"USA-PRINCE WILLIAM SOUND, AK: 28/03/1964 03:36:14",Earthquake mag: 9.2; Max water height (m): 51.8; Magnitude (Iida): 6.1Deaths: 124,1964-03-28,1964-03-28,426,DOI:10.7289/V5PN93H7,2023-02-02
List of tsunamis,INDONESIA-OFF NORTHWEST COAST OF INDONESIA: 02/04/1964 01:11:51,Earthquake mag: 7; Max water height (m): NA; Magnitude (Iida): -0.5Deaths: NA,1964-04-02,1964-04-02,1,DOI:10.7289/V5PN93H7,2023-02-02
List of tsunamis,JAPAN-NW. HONSHU ISLAND: 07/05/1964 07:58:00,Earthquake mag: 6.9; Max water height (m): 0.6; Magnitude (Iida): -0.1Deaths: NA,1964-05-07,1964-05-07,35,DOI:10.7289/V5PN93H7,2023-02-02
List of tsunamis,JAPAN-NW. HONSHU ISLAND: 07/05/1964 20:13:NA,Earthquake mag: 6.6; Max water height (m): NA; Magnitude (Iida): NADeaths: NA,1964-05-07,1964-05-07,2,DOI:10.7289/V5PN93H7,2023-02-02
List of tsunamis,"USA-LONG ISLAND, NY: 19/05/1964 00:00:00",Earthquake mag: NA; Max water height (m): 0.28; Magnitude (Iida): NADeaths: NA,1964-05-19,1964-05-19,11,DOI:10.7289/V5PN93H7,2023-02-02
List of tsunamis,JAPAN-NW. HONSHU ISLAND: 16/06/1964 04:01:44.3,Earthquake mag: 7.5; Max water height (m): 5.8; Magnitude (Iida): 2.7Deaths: 26,1964-06-16,1964-06-16,168,DOI:10.7289/V5PN93H7,2023-02-02
List of tsunamis,RUSSIA-S. KURIL ISLANDS: 24/07/1964 08:12:39,Earthquake mag: 6.8; Max water height (m): 0.08; Magnitude (Iida): -3.3Deaths: NA,1964-07-24,1964-07-24,5,DOI:10.7289/V5PN93H7,2023-02-02
List of tsunamis,PAPUA NEW GUINEA-NEW BRITAIN: 17/11/1964 08:15:39.3,Earthquake mag: 7.6; Max water height (m): 0.05; Magnitude (Iida): NADeaths: NA,1964-11-17,1964-11-17,1,DOI:10.7289/V5PN93H7,2023-02-02
List of tsunamis,JAPAN-NW. HONSHU ISLAND: 10/12/1964 15:11:7.6,Earthquake mag: 6.3; Max water height (m): 0.1; Magnitude (Iida): -3.3Deaths: NA,1964-12-10,1964-12-10,4,DOI:10.7289/V5PN93H7,2023-02-02
List of tsunamis,INDONESIA-SANANA ISLAND: 24/01/1965 00:11:12.1,Earthquake mag: 7.6; Max water height (m): NA; Magnitude (Iida): 2Deaths: 71,1965-01-24,1965-01-24,4,DOI:10.7289/V5PN93H7,2023-02-02
List of tsunamis,"USA-COLUMBIA RIVER VALLEY, WA: 30/01/1965 09:20:NA",Earthquake mag: NA; Max water height (m): NA; Magnitude (Iida): NADeaths: 1,1965-01-30,1965-01-30,1,DOI:10.7289/V5PN93H7,2023-02-02
List of tsunamis,"USA-RAT ISLANDS, ALEUTIAN ISLANDS, AK: 04/02/1965 05:01:21.6",Earthquake mag: 8.7; Max water height (m): 10.7; Magnitude (Iida): 3.3Deaths: NA,1965-02-04,1965-02-04,83,DOI:10.7289/V5PN93H7,2023-02-02
List of tsunamis,CHILE-SOUTHERN CHILE: 19/02/1965 NA:NA:NA,Earthquake mag: NA; Max water height (m): 60; Magnitude (Iida): NADeaths: 27,1965-02-19,1965-02-19,1,DOI:10.7289/V5PN93H7,2023-02-02
List of tsunamis,CHILE-NORTHERN CHILE: 23/02/1965 22:11:46,Earthquake mag: 7; Max water height (m): NA; Magnitude (Iida): NADeaths: NA,1965-02-23,1965-02-23,0,DOI:10.7289/V5PN93H7,2023-02-02
List of tsunamis,GREECE-AEGEAN SEA: 09/03/1965 17:57:53.7,Earthquake mag: 6.3; Max water height (m): NA; Magnitude (Iida): NADeaths: NA,1965-03-09,1965-03-09,2,DOI:10.7289/V5PN93H7,2023-02-02
List of tsunamis,CHILE-CENTRAL CHILE: 22/03/1965 22:56:28,Earthquake mag: 6; Max water height (m): NA; Magnitude (Iida): NADeaths: NA,1965-03-22,1965-03-22,0,DOI:10.7289/V5PN93H7,2023-02-02
List of tsunamis,"USA-RAT ISLANDS, ALEUTIAN ISLANDS, AK: 30/03/1965 02:27:3.4",Earthquake mag: 7.6; Max water height (m): 0.1; Magnitude (Iida): -2.3Deaths: NA,1965-03-30,1965-03-30,3,DOI:10.7289/V5PN93H7,2023-02-02
List of tsunamis,JAPAN-AICHI PREFECTURE: 19/04/1965 23:42:NA,Earthquake mag: 6; Max water height (m): 0.1; Magnitude (Iida): NADeaths: NA,1965-04-19,1965-04-19,2,DOI:10.7289/V5PN93H7,2023-02-02
List of tsunamis,RUSSIA-S. KURIL ISLANDS: 11/06/1965 03:34:02,Earthquake mag: 7.2; Max water height (m): 0.1; Magnitude (Iida): -3.3Deaths: NA,1965-06-11,1965-06-11,6,DOI:10.7289/V5PN93H7,2023-02-02
List of tsunamis,"USA-FOX ISLANDS, ALEUTIAN ISLANDS, AK: 02/07/1965 20:58:38.1",Earthquake mag: 6.5; Max water height (m): 0.08; Magnitude (Iida): -3.3Deaths: NA,1965-07-02,1965-07-02,3,DOI:10.7289/V5PN93H7,2023-02-02
List of tsunamis,GREECE-NORTH CORINTH GULF: 06/07/1965 03:18:45.8,Earthquake mag: 6.1; Max water height (m): 3; Magnitude (Iida): 4.3Deaths: 1,1965-07-06,1965-07-06,2,DOI:10.7289/V5PN93H7,2023-02-02
List of tsunamis,VANUATU-VANUATU ISLANDS: 11/08/1965 22:31:45.9,Earthquake mag: 7; Max water height (m): 7; Magnitude (Iida): 2.8Deaths: NA,1965-08-11,1965-08-11,4,DOI:10.7289/V5PN93H7,2023-02-02
List of tsunamis,VANUATU-VANUATU ISLANDS: 13/08/1965 12:40:32,Earthquake mag: 7.3; Max water height (m): 2; Magnitude (Iida): 1Deaths: NA,1965-08-13,1965-08-13,1,DOI:10.7289/V5PN93H7,2023-02-02
List of tsunamis,MEXICO-MEXICO: 23/08/1965 19:46:2.9,Earthquake mag: 7.8; Max water height (m): 0.4; Magnitude (Iida): -1.3Deaths: NA,1965-08-23,1965-08-23,1,DOI:10.7289/V5PN93H7,2023-02-02
List of tsunamis,"PHILIPPINES-TAAL, LUZON ISLAND: 28/09/1965 NA:NA:NA",Earthquake mag: NA; Max water height (m): 4.7; Magnitude (Iida): NADeaths: 355,1965-09-28,1965-09-28,1,DOI:10.7289/V5PN93H7,2023-02-02
List of tsunamis,CHILE-SOUTHERN CHILE: 03/10/1965 16:14:56,Earthquake mag: 6.5; Max water height (m): NA; Magnitude (Iida): NADeaths: NA,1965-10-03,1965-10-03,0,DOI:10.7289/V5PN93H7,2023-02-02
List of tsunamis,GRENADA-KICK 'EM JENNY VOLCANO: 24/10/1965 NA:NA:NA,Earthquake mag: NA; Max water height (m): NA; Magnitude (Iida): NADeaths: NA,1965-10-24,1965-10-24,0,DOI:10.7289/V5PN93H7,2023-02-02
List of tsunamis,TAIWAN-E. TAIWAN-RYUKYU ISLANDS: 12/03/1966 16:31:21.8,Earthquake mag: 7.6; Max water height (m): 0.1; Magnitude (Iida): -3.3Deaths: NA,1966-03-12,1966-03-12,5,DOI:10.7289/V5PN93H7,2023-02-02
List of tsunamis,NORWAY-EASTERN NORWAY: 08/05/1966 NA:NA:NA,Earthquake mag: NA; Max water height (m): 6; Magnitude (Iida): NADeaths: NA,1966-05-08,1966-05-08,0,DOI:10.7289/V5PN93H7,2023-02-02
List of tsunamis,SOLOMON ISLANDS-SOLOMON ISLANDS: 15/06/1966 00:59:42.7,Earthquake mag: 7.1; Max water height (m): 0.2; Magnitude (Iida): 0.5Deaths: NA,1966-06-15,1966-06-15,3,DOI:10.7289/V5PN93H7,2023-02-02
List of tsunamis,RUSSIA-BLACK SEA: 12/07/1966 18:53:NA,Earthquake mag: 5.5; Max water height (m): 0.2; Magnitude (Iida): NADeaths: NA,1966-07-12,1966-07-12,7,DOI:10.7289/V5PN93H7,2023-02-02
List of tsunamis,PERU-CENTRAL PERU: 17/10/1966 21:41:56,Earthquake mag: 8.1; Max water height (m): 3; Magnitude (Iida): -1Deaths: NA,1966-10-17,1966-10-17,60,DOI:10.7289/V5PN93H7,2023-02-02
List of tsunamis,"SOLOMON ISLANDS-MOHAWK BAY, SANTA CRUZ ISLANDS: 28/11/1966 NA:NA:NA",Earthquake mag: NA; Max water height (m): NA; Magnitude (Iida): NADeaths: NA,1966-11-28,1966-11-28,1,DOI:10.7289/V5PN93H7,2023-02-02
List of tsunamis,CHILE-NORTHERN CHILE: 28/12/1966 08:18:7.4,Earthquake mag: 7.8; Max water height (m): 0.42; Magnitude (Iida): NADeaths: NA,1966-12-28,1966-12-28,13,DOI:10.7289/V5PN93H7,2023-02-02
List of tsunamis,SOLOMON ISLANDS-SANTA CRUZ ISLANDS: 31/12/1966 18:23:11.1,Earthquake mag: 7.8; Max water height (m): 2; Magnitude (Iida): NADeaths: NA,1966-12-31,1966-12-31,7,DOI:10.7289/V5PN93H7,2023-02-02
List of tsunamis,SOLOMON ISLANDS-SANTA CRUZ ISLANDS: 31/12/1966 22:15:16.6,Earthquake mag: 7.2; Max water height (m): 0.8; Magnitude (Iida): NADeaths: NA,1966-12-31,1966-12-31,1,DOI:10.7289/V5PN93H7,2023-02-02
List of tsunamis,"SOLOMON ISLANDS-TINAKULA, SANTA CRUZ ISLANDS: NA/NA/1966 NA:NA:NA",Earthquake mag: NA; Max water height (m): NA; Magnitude (Iida): NADeaths: NA,,,0,DOI:10.7289/V5PN93H7,2023-02-02
List of tsunamis,RUSSIA-S. KURIL ISLANDS: 19/03/1967 04:01:38.5,Earthquake mag: 7; Max water height (m): NA; Magnitude (Iida): NADeaths: NA,1967-03-19,1967-03-19,0,DOI:10.7289/V5PN93H7,2023-02-02
List of tsunamis,INDONESIA-MAKASSAR STRAIT: 11/04/1967 05:09:12.1,Earthquake mag: 5.5; Max water height (m): NA; Magnitude (Iida): 1.6Deaths: 13,1967-04-11,1967-04-11,2,DOI:10.7289/V5PN93H7,2023-02-02
List of tsunamis,INDONESIA-NORTHEAST SUMATRA: 12/04/1967 04:51:50.2,Earthquake mag: 6.1; Max water height (m): NA; Magnitude (Iida): 1Deaths: NA,1967-04-12,1967-04-12,1,DOI:10.7289/V5PN93H7,2023-02-02
List of tsunamis,VENEZUELA-CARACAS: 30/07/1967 00:00:04,Earthquake mag: 6.6; Max water height (m): 0.08; Magnitude (Iida): NADeaths: NA,1967-07-30,1967-07-30,1,DOI:10.7289/V5PN93H7,2023-02-02
List of tsunamis,PAPUA NEW GUINEA-BISMARCK SEA: 13/08/1967 22:15:10,Earthquake mag: 6.4; Max water height (m): 0.1; Magnitude (Iida): -3.3Deaths: NA,1967-08-13,1967-08-13,1,DOI:10.7289/V5PN93H7,2023-02-02
List of tsunamis,PERU-CENTRAL PERU: 03/09/1967 NA:NA:NA,Earthquake mag: 7; Max water height (m): 2; Magnitude (Iida): 1Deaths: NA,1967-09-03,1967-09-03,2,DOI:10.7289/V5PN93H7,2023-02-02
List of tsunamis,"USA-GREWINGK, AK: NA/10/1967 NA:NA:NA",Earthquake mag: NA; Max water height (m): 60; Magnitude (Iida): NADeaths: NA,,,1,DOI:10.7289/V5PN93H7,2023-02-02
List of tsunamis,CHILE-NORTHERN CHILE: 15/11/1967 21:31:54,Earthquake mag: 5.9; Max water height (m): NA; Magnitude (Iida): NADeaths: NA,1967-11-15,1967-11-15,0,DOI:10.7289/V5PN93H7,2023-02-02
List of tsunamis,"ANTARCTICA-TELEPHONE BAY, DECEPCION ISLAND: 04/12/1967 NA:NA:NA",Earthquake mag: NA; Max water height (m): 1; Magnitude (Iida): NADeaths: NA,1967-12-04,1967-12-04,1,DOI:10.7289/V5PN93H7,2023-02-02
List of tsunamis,USA TERRITORY-NORTHERN COAST OF PUERTO RICO: 04/12/1967 NA:NA:NA,Earthquake mag: NA; Max water height (m): NA; Magnitude (Iida): NADeaths: NA,1967-12-04,1967-12-04,6,DOI:10.7289/V5PN93H7,2023-02-02
List of tsunamis,CHILE-NORTHERN CHILE: 21/12/1967 02:25:23,Earthquake mag: 7.5; Max water height (m): NA; Magnitude (Iida): -0.5Deaths: NA,1967-12-21,1967-12-21,1,DOI:10.7289/V5PN93H7,2023-02-02
List of tsunamis,RUSSIA-S. KURIL ISLANDS: 29/01/1968 10:19:7.2,Earthquake mag: 7.3; Max water height (m): 0.18; Magnitude (Iida): -1.7Deaths: NA,1968-01-29,1968-01-29,17,DOI:10.7289/V5PN93H7,2023-02-02
List of tsunamis,"GREECE-LEMNOS ISLAND, NORTH AEGEAN SEA: 19/02/1968 22:45:45.7",Earthquake mag: 7.2; Max water height (m): 1.2; Magnitude (Iida): 0.3Deaths: NA,1968-02-19,1968-02-19,3,DOI:10.7289/V5PN93H7,2023-02-02
List of tsunamis,JAPAN-SEIKAIDO: 01/04/1968 00:42:4.2,Earthquake mag: 7.5; Max water height (m): 3.07; Magnitude (Iida): 1.3Deaths: NA,1968-04-01,1968-04-01,62,DOI:10.7289/V5PN93H7,2023-02-02
List of tsunamis,ITALY-LIGURIA-COTE D'AZUR: 18/04/1968 19:38:15,Earthquake mag: 4.6; Max water height (m): 3; Magnitude (Iida): NADeaths: NA,1968-04-18,1968-04-18,1,DOI:10.7289/V5PN93H7,2023-02-02
List of tsunamis,CHILE-EASTER ISLAND REGION: 04/05/1968 NA:NA:NA,Earthquake mag: NA; Max water height (m): NA; Magnitude (Iida): NADeaths: NA,1968-05-04,1968-05-04,1,DOI:10.7289/V5PN93H7,2023-02-02
List of tsunamis,JAPAN-OFF EAST COAST OF HONSHU ISLAND: 16/05/1968 00:48:55.4,Earthquake mag: 8.2; Max water height (m): 6; Magnitude (Iida): 2.3Deaths: 52,1968-05-16,1968-05-16,329,DOI:10.7289/V5PN93H7,2023-02-02
List of tsunamis,JAPAN-OFF COAST OF HONSHU ISLAND: 16/05/1968 10:39:1.6,Earthquake mag: 7.5; Max water height (m): 0.58; Magnitude (Iida): NADeaths: NA,1968-05-16,1968-05-16,8,DOI:10.7289/V5PN93H7,2023-02-02
List of tsunamis,JAPAN-SANRIKU: 12/06/1968 13:41:50.7,Earthquake mag: 7.2; Max water height (m): 0.95; Magnitude (Iida): 1.6Deaths: NA,1968-06-12,1968-06-12,28,DOI:10.7289/V5PN93H7,2023-02-02
List of tsunamis,NEW ZEALAND-KERMADEC ISLANDS: 25/07/1968 07:23:7.8,Earthquake mag: 7.3; Max water height (m): 0.05; Magnitude (Iida): NADeaths: NA,1968-07-25,1968-07-25,1,DOI:10.7289/V5PN93H7,2023-02-02
List of tsunamis,PHILIPPINES-E. LUZON ISLAND: 01/08/1968 20:19:21.9,Earthquake mag: 7.3; Max water height (m): 0.16; Magnitude (Iida): -1.7Deaths: 1,1968-08-01,1968-08-01,40,DOI:10.7289/V5PN93H7,2023-02-02
List of tsunamis,MEXICO-ACAPULCO: 02/08/1968 14:06:43.7,Earthquake mag: 7.3; Max water height (m): NA; Magnitude (Iida): NADeaths: NA,1968-08-02,1968-08-02,1,DOI:10.7289/V5PN93H7,2023-02-02
List of tsunamis,JAPAN-SEIKAIDO-NANKAIDO: 05/08/1968 07:17:00,Earthquake mag: 6.5; Max water height (m): 0.03; Magnitude (Iida): NADeaths: NA,1968-08-05,1968-08-05,1,DOI:10.7289/V5PN93H7,2023-02-02
List of tsunamis,INDONESIA-N. MOLUCCAS ISLANDS: 10/08/1968 02:07:4.3,Earthquake mag: 7.6; Max water height (m): 0.4; Magnitude (Iida): -1.3Deaths: NA,1968-08-10,1968-08-10,22,DOI:10.7289/V5PN93H7,2023-02-02
List of tsunamis,INDONESIA-BANDA SEA: 14/08/1968 22:14:19.4,Earthquake mag: 7.8; Max water height (m): 10; Magnitude (Iida): 3.3Deaths: 200,1968-08-14,1968-08-14,7,DOI:10.7289/V5PN93H7,2023-02-02
List of tsunamis,TURKEY-BLACK SEA: 03/09/1968 08:19:52.2,Earthquake mag: 6.6; Max water height (m): 3; Magnitude (Iida): NADeaths: NA,1968-09-03,1968-09-03,2,DOI:10.7289/V5PN93H7,2023-02-02
List of tsunamis,VENEZUELA-CARUPANO: 20/09/1968 06:00:05,Earthquake mag: 6.5; Max water height (m): NA; Magnitude (Iida): NADeaths: NA,1968-09-20,1968-09-20,1,DOI:10.7289/V5PN93H7,2023-02-02
List of tsunamis,MEXICO-S. MEXICO-GUATEMALA-NICARAGUA: 25/09/1968 10:38:39.5,Earthquake mag: 6.1; Max water height (m): 2; Magnitude (Iida): NADeaths: NA,1968-09-25,1968-09-25,0,DOI:10.7289/V5PN93H7,2023-02-02
List of tsunamis,INDONESIA-MAKASSAR STRAIT: 23/02/1969 00:36:58.9,Earthquake mag: 7; Max water height (m): 4; Magnitude (Iida): 2Deaths: 600,1969-02-23,1969-02-23,5,DOI:10.7289/V5PN93H7,2023-02-02
List of tsunamis,PORTUGAL-PORTUGAL: 28/02/1969 02:40:32.5,Earthquake mag: 7.8; Max water height (m): 0.9; Magnitude (Iida): NADeaths: NA,1969-02-28,1969-02-28,19,DOI:10.7289/V5PN93H7,2023-02-02
List of tsunamis,PHILIPPINES-LUZON ISLAND: 21/03/1969 NA:NA:NA,Earthquake mag: NA; Max water height (m): NA; Magnitude (Iida): NADeaths: 3,1969-03-21,1969-03-21,1,DOI:10.7289/V5PN93H7,2023-02-02
List of tsunamis,EGYPT-GULF OF SUEZ: 31/03/1969 NA:NA:NA,Earthquake mag: 7; Max water height (m): NA; Magnitude (Iida): NADeaths: NA,1969-03-31,1969-03-31,1,DOI:10.7289/V5PN93H7,2023-02-02
List of tsunamis,SWEDEN-NORSALV RIVER: 12/04/1969 05:44:NA,Earthquake mag: NA; Max water height (m): 5; Magnitude (Iida): NADeaths: NA,1969-04-12,1969-04-12,1,DOI:10.7289/V5PN93H7,2023-02-02
List of tsunamis,JAPAN-RYUKYU ISLANDS: 21/04/1969 07:19:NA,Earthquake mag: 6.5; Max water height (m): 0.1; Magnitude (Iida): -2.3Deaths: NA,1969-04-21,1969-04-21,6,DOI:10.7289/V5PN93H7,2023-02-02
List of tsunamis,ATLANTIC OCEAN-SOUTHWEST IBERIAN: 17/07/1969 05:NA:NA,Earthquake mag: NA; Max water height (m): 0.06; Magnitude (Iida): NADeaths: NA,1969-07-17,1969-07-17,4,DOI:10.7289/V5PN93H7,2023-02-02
List of tsunamis,CHINA-BOHAI SEA: 18/07/1969 05:24:50,Earthquake mag: 7.4; Max water height (m): 0.1; Magnitude (Iida): NADeaths: NA,1969-07-18,1969-07-18,3,DOI:10.7289/V5PN93H7,2023-02-02
List of tsunamis,PAPUA NEW GUINEA-BISMARCK SEA: 02/08/1969 04:30:29,Earthquake mag: 5.4; Max water height (m): NA; Magnitude (Iida): NADeaths: NA,1969-08-02,1969-08-02,1,DOI:10.7289/V5PN93H7,2023-02-02
List of tsunamis,RUSSIA-S. KURIL ISLANDS: 11/08/1969 21:26:36,Earthquake mag: 8.2; Max water height (m): 5; Magnitude (Iida): 1.4Deaths: NA,1969-08-11,1969-08-11,75,DOI:10.7289/V5PN93H7,2023-02-02
List of tsunamis,SOUTH AFRICA-SOUTH AFRICA: 27/08/1969 01:30:NA,Earthquake mag: NA; Max water height (m): 2.9; Magnitude (Iida): NADeaths: NA,1969-08-27,1969-08-27,15,DOI:10.7289/V5PN93H7,2023-02-02
List of tsunamis,RUSSIA-KAMCHATKA: 22/11/1969 23:09:37,Earthquake mag: 7.7; Max water height (m): 15; Magnitude (Iida): 3.9Deaths: NA,1969-11-22,1969-11-22,16,DOI:10.7289/V5PN93H7,2023-02-02
List of tsunamis,GUADELOUPE (FRENCH TERRITORY)-GRAND BOURG: 25/12/1969 21:32:27.3,Earthquake mag: 7.2; Max water height (m): 0.23; Magnitude (Iida): -3.3Deaths: NA,1969-12-25,1969-12-25,3,DOI:10.7289/V5PN93H7,2023-02-02
List of tsunamis,PHILIPPINES-PHILIPPINE TRENCH: 10/01/1970 12:07:8.6,Earthquake mag: 7.6; Max water height (m): 0.06; Magnitude (Iida): NADeaths: NA,1970-01-10,1970-01-10,1,DOI:10.7289/V5PN93H7,2023-02-02
List of tsunamis,"USA-ANDREANOF ISLANDS, AK: 11/03/1970 22:38:34.6",Earthquake mag: 6; Max water height (m): 0.03; Magnitude (Iida): NADeaths: NA,1970-03-11,1970-03-11,1,DOI:10.7289/V5PN93H7,2023-02-02
List of tsunamis,PHILIPPINES-PHILIPPINE SEA: 07/04/1970 05:34:5.6,Earthquake mag: 7.3; Max water height (m): NA; Magnitude (Iida): 1Deaths: NA,1970-04-07,1970-04-07,1,DOI:10.7289/V5PN93H7,2023-02-02
List of tsunamis,RUSSIA-CASPIAN SEA: 14/05/1970 18:12:NA,Earthquake mag: 6.5; Max water height (m): NA; Magnitude (Iida): NADeaths: NA,1970-05-14,1970-05-14,0,DOI:10.7289/V5PN93H7,2023-02-02
List of tsunamis,PERU-N. PERU: 31/05/1970 20:23:27.3,Earthquake mag: 7.9; Max water height (m): 0.46; Magnitude (Iida): 0.8Deaths: NA,1970-05-31,1970-05-31,15,DOI:10.7289/V5PN93H7,2023-02-02
List of tsunamis,CHILE-SOUTHERN CHILE: 14/06/1970 NA:NA:NA,Earthquake mag: 6; Max water height (m): NA; Magnitude (Iida): NADeaths: NA,1970-06-14,1970-06-14,0,DOI:10.7289/V5PN93H7,2023-02-02
List of tsunamis,CHILE-NORTHERN CHILE: 19/06/1970 10:56:13.5,Earthquake mag: 6.4; Max water height (m): NA; Magnitude (Iida): NADeaths: NA,1970-06-19,1970-06-19,0,DOI:10.7289/V5PN93H7,2023-02-02
List of tsunamis,JAPAN-SEIKAIDO: 25/07/1970 22:41:10.7,Earthquake mag: 7; Max water height (m): 0.32; Magnitude (Iida): -0.7Deaths: NA,1970-07-25,1970-07-25,35,DOI:10.7289/V5PN93H7,2023-02-02
List of tsunamis,NEW ZEALAND-NEW ZEALAND: 28/09/1970 19:01:NA,Earthquake mag: 5.1; Max water height (m): 1; Magnitude (Iida): NADeaths: NA,1970-09-28,1970-09-28,1,DOI:10.7289/V5PN93H7,2023-02-02
List of tsunamis,PHILIPPINES-PHILIPPINE TRENCH: 30/09/1970 09:52:22.7,Earthquake mag: 5.3; Max water height (m): NA; Magnitude (Iida): NADeaths: NA,1970-09-30,1970-09-30,1,DOI:10.7289/V5PN93H7,2023-02-02
List of tsunamis,PAPUA NEW GUINEA-PAPUA NEW GUINEA: 31/10/1970 17:53:9.3,Earthquake mag: 7.3; Max water height (m): 3; Magnitude (Iida): 0.3Deaths: 3,1970-10-31,1970-10-31,3,DOI:10.7289/V5PN93H7,2023-02-02
List of tsunamis,CHILE-NORTHERN CHILE: 28/11/1970 11:08:40,Earthquake mag: 6; Max water height (m): NA; Magnitude (Iida): NADeaths: NA,1970-11-28,1970-11-28,0,DOI:10.7289/V5PN93H7,2023-02-02
List of tsunamis,RUSSIA-BLACK SEA: 04/12/1970 01:59:25,Earthquake mag: 5.1; Max water height (m): 0.8; Magnitude (Iida): NADeaths: NA,1970-12-04,1970-12-04,1,DOI:10.7289/V5PN93H7,2023-02-02
List of tsunamis,PERU-CHUNGAR: 19/03/1971 NA:NA:NA,Earthquake mag: NA; Max water height (m): 30; Magnitude (Iida): NADeaths: 600,1971-03-19,1971-03-19,0,DOI:10.7289/V5PN93H7,2023-02-02
List of tsunamis,"USA-ANDREANOF ISLANDS, AK: 02/05/1971 06:08:27.8",Earthquake mag: 7.1; Max water height (m): 0.04; Magnitude (Iida): NADeaths: NA,1971-05-02,1971-05-02,1,DOI:10.7289/V5PN93H7,2023-02-02
List of tsunamis,CHILE-CENTRAL CHILE: 09/07/1971 03:03:18.7,Earthquake mag: 7.8; Max water height (m): 0.6; Magnitude (Iida): 0.3Deaths: NA,1971-07-09,1971-07-09,1,DOI:10.7289/V5PN93H7,2023-02-02
List of tsunamis,PAPUA NEW GUINEA-SOLOMON SEA: 14/07/1971 06:11:29.1,Earthquake mag: 7.9; Max water height (m): 6; Magnitude (Iida): 1.6Deaths: 1,1971-07-14,1971-07-14,32,DOI:10.7289/V5PN93H7,2023-02-02
List of tsunamis,PAPUA NEW GUINEA-SOLOMON SEA: 26/07/1971 01:23:21.3,Earthquake mag: 7.9; Max water height (m): 10; Magnitude (Iida): 3.3Deaths: NA,1971-07-26,1971-07-26,39,DOI:10.7289/V5PN93H7,2023-02-02
List of tsunamis,JAPAN-JAPAN TRENCH: 02/08/1971 07:24:56.8,Earthquake mag: 7.3; Max water height (m): 0.51; Magnitude (Iida): -2.3Deaths: NA,1971-08-02,1971-08-02,17,DOI:10.7289/V5PN93H7,2023-02-02
List of tsunamis,RUSSIA-TATAR STRAIT: 05/09/1971 18:35:25,Earthquake mag: 7.1; Max water height (m): 2; Magnitude (Iida): NADeaths: NA,1971-09-05,1971-09-05,29,DOI:10.7289/V5PN93H7,2023-02-02
List of tsunamis,RUSSIA-TATAR STRAIT: 06/09/1971 13:37:10.8,Earthquake mag: 5.5; Max water height (m): 0.32; Magnitude (Iida): NADeaths: NA,1971-09-06,1971-09-06,11,DOI:10.7289/V5PN93H7,2023-02-02
List of tsunamis,"SOLOMON ISLANDS-TINAKULA, SANTA CRUZ ISLANDS: 06/09/1971 20:NA:NA",Earthquake mag: NA; Max water height (m): NA; Magnitude (Iida): NADeaths: NA,1971-09-06,1971-09-06,1,DOI:10.7289/V5PN93H7,2023-02-02
List of tsunamis,RUSSIA-TATAR STRAIT: 08/09/1971 11:48:23.4,Earthquake mag: 6.6; Max water height (m): 0.09; Magnitude (Iida): NADeaths: NA,1971-09-08,1971-09-08,2,DOI:10.7289/V5PN93H7,2023-02-02
List of tsunamis,RUSSIA-TATAR STRAIT: 08/09/1971 16:59:52.6,Earthquake mag: 6.2; Max water height (m): 0.07; Magnitude (Iida): -0.7Deaths: NA,1971-09-08,1971-09-08,1,DOI:10.7289/V5PN93H7,2023-02-02
List of tsunamis,PAPUA NEW GUINEA-BISMARCK SEA: 25/09/1971 04:36:14,Earthquake mag: 7; Max water height (m): 1.8; Magnitude (Iida): 0.8Deaths: NA,1971-09-25,1971-09-25,1,DOI:10.7289/V5PN93H7,2023-02-02
List of tsunamis,RUSSIA-TATAR STRAIT: 27/09/1971 19:01:45.3,Earthquake mag: 6; Max water height (m): 0.03; Magnitude (Iida): NADeaths: NA,1971-09-27,1971-09-27,1,DOI:10.7289/V5PN93H7,2023-02-02
List of tsunamis,"USA-RAT ISLANDS, ALEUTIAN ISLANDS, AK: 06/11/1971 22:00:0.1",Earthquake mag: 5.7; Max water height (m): 0.1; Magnitude (Iida): NADeaths: NA,1971-11-06,1971-11-06,2,DOI:10.7289/V5PN93H7,2023-02-02
List of tsunamis,RUSSIA-KAMCHATKA: 15/12/1971 08:29:55.3,Earthquake mag: 7.8; Max water height (m): 0.47; Magnitude (Iida): NADeaths: NA,1971-12-15,1971-12-15,12,DOI:10.7289/V5PN93H7,2023-02-02
List of tsunamis,TAIWAN-E. TAIWAN: 25/01/1972 02:06:23.3,Earthquake mag: 7.5; Max water height (m): 0.05; Magnitude (Iida): -1Deaths: NA,1972-01-25,1972-01-25,2,DOI:10.7289/V5PN93H7,2023-02-02
List of tsunamis,JAPAN-EAST OFF HACHIJO ISLAND: 29/02/1972 09:22:59.8,Earthquake mag: 7.4; Max water height (m): 0.42; Magnitude (Iida): -1.3Deaths: NA,1972-02-29,1972-02-29,28,DOI:10.7289/V5PN93H7,2023-02-02
List of tsunamis,CHILE-CENTRAL CHILE: 08/06/1972 18:53:41.7,Earthquake mag: 6.6; Max water height (m): NA; Magnitude (Iida): NADeaths: NA,1972-06-08,1972-06-08,0,DOI:10.7289/V5PN93H7,2023-02-02
List of tsunamis,"USA-SE. ALASKA, AK: 30/07/1972 21:45:14.1",Earthquake mag: 7.6; Max water height (m): 0.1; Magnitude (Iida): -2.3Deaths: NA,1972-07-30,1972-07-30,3,DOI:10.7289/V5PN93H7,2023-02-02
List of tsunamis,PAPUA NEW GUINEA-SOLOMON SEA: 17/08/1972 23:44:5.9,Earthquake mag: 7.1; Max water height (m): 0.6; Magnitude (Iida): -1Deaths: NA,1972-08-17,1972-08-17,1,DOI:10.7289/V5PN93H7,2023-02-02
List of tsunamis,PAPUA NEW GUINEA-SOLOMON SEA: 26/08/1972 08:15:NA,Earthquake mag: NA; Max water height (m): 1.5; Magnitude (Iida): 0.6Deaths: NA,1972-08-26,1972-08-26,2,DOI:10.7289/V5PN93H7,2023-02-02
List of tsunamis,JAPAN-JAPAN: 06/09/1972 11:42:23.9,Earthquake mag: 5.2; Max water height (m): NA; Magnitude (Iida): NADeaths: NA,1972-09-06,1972-09-06,0,DOI:10.7289/V5PN93H7,2023-02-02
List of tsunamis,"PAPUA NEW GUINEA-RITTER ISLAND, PAPUA NEW GUINEA: 09/10/1972 NA:NA:NA",Earthquake mag: NA; Max water height (m): NA; Magnitude (Iida): NADeaths: NA,1972-10-09,1972-10-09,1,DOI:10.7289/V5PN93H7,2023-02-02
List of tsunamis,"PHILIPPINES-MINDANAO ISLAND, PHILIPPINES: 02/12/1972 00:19:47.2",Earthquake mag: 7.4; Max water height (m): 0.5; Magnitude (Iida): -2.3Deaths: NA,1972-12-02,1972-12-02,32,DOI:10.7289/V5PN93H7,2023-02-02
List of tsunamis,JAPAN-CHICHI JIMA: 04/12/1972 10:16:12,Earthquake mag: 7.4; Max water height (m): 0.5; Magnitude (Iida): -1Deaths: NA,1972-12-04,1972-12-04,39,DOI:10.7289/V5PN93H7,2023-02-02
List of tsunamis,CHILE-CENTRAL CHILE: 29/12/1972 04:51:1.6,Earthquake mag: 5.4; Max water height (m): NA; Magnitude (Iida): NADeaths: NA,1972-12-29,1972-12-29,0,DOI:10.7289/V5PN93H7,2023-02-02
List of tsunamis,MEXICO-S. MEXICO: 30/01/1973 21:01:12.5,Earthquake mag: 7.5; Max water height (m): 1.13; Magnitude (Iida): 0.1Deaths: NA,1973-01-30,1973-01-30,9,DOI:10.7289/V5PN93H7,2023-02-02
List of tsunamis,RUSSIA-N. KURIL ISLANDS: 28/02/1973 06:37:49.5,Earthquake mag: 7.2; Max water height (m): 1.5; Magnitude (Iida): 0.6Deaths: NA,1973-02-28,1973-02-28,7,DOI:10.7289/V5PN93H7,2023-02-02
List of tsunamis,PHILIPPINES-QUEZON: 17/03/1973 08:30:51.8,Earthquake mag: 7.5; Max water height (m): 1.3; Magnitude (Iida): NADeaths: NA,1973-03-17,1973-03-17,2,DOI:10.7289/V5PN93H7,2023-02-02
List of tsunamis,JAPAN-HOKKAIDO ISLAND: 17/06/1973 03:55:2.9,Earthquake mag: 7.7; Max water height (m): 5.96; Magnitude (Iida): 2.2Deaths: NA,1973-06-17,1973-06-17,72,DOI:10.7289/V5PN93H7,2023-02-02
List of tsunamis,RUSSIA-S. KURIL ISLANDS: 24/06/1973 02:43:25.5,Earthquake mag: 7.1; Max water height (m): 0.64; Magnitude (Iida): 2.2Deaths: NA,1973-06-24,1973-06-24,32,DOI:10.7289/V5PN93H7,2023-02-02
List of tsunamis,RUSSIA-S. KURIL ISLANDS: 26/06/1973 22:32:0.2,Earthquake mag: 6.6; Max water height (m): 0.21; Magnitude (Iida): NADeaths: NA,1973-06-26,1973-06-26,2,DOI:10.7289/V5PN93H7,2023-02-02
List of tsunamis,CHILE-CENTRAL CHILE: 05/10/1973 05:47:51.1,Earthquake mag: 6.7; Max water height (m): 0.2; Magnitude (Iida): -1.3Deaths: NA,1973-10-05,1973-10-05,1,DOI:10.7289/V5PN93H7,2023-02-02
List of tsunamis,INDONESIA-LESSER SUNDA ISLANDS: NA/12/1973 NA:NA:NA,Earthquake mag: NA; Max water height (m): NA; Magnitude (Iida): NADeaths: 2,,,0,DOI:10.7289/V5PN93H7,2023-02-02
List of tsunamis,SOLOMON ISLANDS-SOLOMON ISLANDS: 31/01/1974 23:30:5.3,Earthquake mag: 7; Max water height (m): 1.5; Magnitude (Iida): 2.2Deaths: NA,1974-01-31,1974-01-31,2,DOI:10.7289/V5PN93H7,2023-02-02
List of tsunamis,SOLOMON ISLANDS-SOLOMON ISLANDS: 01/02/1974 03:12:33.1,Earthquake mag: 7.1; Max water height (m): 4.5; Magnitude (Iida): 2.2Deaths: NA,1974-02-01,1974-02-01,4,DOI:10.7289/V5PN93H7,2023-02-02
List of tsunamis,JAPAN-TOKAIDO: 08/05/1974 23:33:25.2,Earthquake mag: 6.7; Max water height (m): 0.2; Magnitude (Iida): -2.3Deaths: NA,1974-05-08,1974-05-08,5,DOI:10.7289/V5PN93H7,2023-02-02
List of tsunamis,CHILE-SOUTHERN CHILE: 18/08/1974 10:44:12.8,Earthquake mag: 7.1; Max water height (m): NA; Magnitude (Iida): NADeaths: NA,1974-08-18,1974-08-18,0,DOI:10.7289/V5PN93H7,2023-02-02
List of tsunamis,RUSSIA-S. KURIL ISLANDS: 27/09/1974 05:47:29.4,Earthquake mag: 6.7; Max water height (m): 0.37; Magnitude (Iida): 0.6Deaths: NA,1974-09-27,1974-09-27,3,DOI:10.7289/V5PN93H7,2023-02-02
List of tsunamis,PERU-CENTRAL PERU: 03/10/1974 14:21:29.1,Earthquake mag: 8.1; Max water height (m): 0.92; Magnitude (Iida): 0.8Deaths: NA,1974-10-03,1974-10-03,35,DOI:10.7289/V5PN93H7,2023-02-02
List of tsunamis,"CANADA-KITIMAT INLET, BRITISH COLOMBIA: 17/10/1974 19:05:NA",Earthquake mag: NA; Max water height (m): 2.8; Magnitude (Iida): NADeaths: NA,1974-10-17,1974-10-17,0,DOI:10.7289/V5PN93H7,2023-02-02
List of tsunamis,"PAPUA NEW GUINEA-RITTER ISLAND, PAPUA NEW GUINEA: 17/10/1974 NA:NA:NA",Earthquake mag: NA; Max water height (m): 0.5; Magnitude (Iida): -1Deaths: NA,1974-10-17,1974-10-17,2,DOI:10.7289/V5PN93H7,2023-02-02
List of tsunamis,PAKISTAN-PAKISTAN: 28/12/1974 12:11:43.7,Earthquake mag: 6.2; Max water height (m): NA; Magnitude (Iida): NADeaths: NA,1974-12-28,1974-12-28,0,DOI:10.7289/V5PN93H7,2023-02-02
List of tsunamis,INDONESIA-BANDA SEA: 15/01/1975 09:42:24,Earthquake mag: 5.9; Max water height (m): NA; Magnitude (Iida): NADeaths: NA,1975-01-15,1975-01-15,1,DOI:10.7289/V5PN93H7,2023-02-02
List of tsunamis,CHILE-CENTRAL CHILE: 13/03/1975 15:26:42.5,Earthquake mag: 6.9; Max water height (m): NA; Magnitude (Iida): NADeaths: NA,1975-03-13,1975-03-13,0,DOI:10.7289/V5PN93H7,2023-02-02
List of tsunamis,"CANADA-KITIMAT INLET, BRITISH COLUMBIA: 27/04/1975 18:05:NA",Earthquake mag: NA; Max water height (m): 4.1; Magnitude (Iida): NADeaths: NA,1975-04-27,1975-04-27,5,DOI:10.7289/V5PN93H7,2023-02-02
List of tsunamis,ATLANTIC OCEAN-AZORES GIBRALTAR FRACTURE ZONE: 26/05/1975 09:11:51.1,Earthquake mag: 7.8; Max water height (m): 0.5; Magnitude (Iida): NADeaths: NA,1975-05-26,1975-05-26,8,DOI:10.7289/V5PN93H7,2023-02-02
List of tsunamis,RUSSIA-S. KURIL ISLANDS: 10/06/1975 13:47:14.5,Earthquake mag: 7; Max water height (m): 5.5; Magnitude (Iida): 2.3Deaths: NA,1975-06-10,1975-06-10,52,DOI:10.7289/V5PN93H7,2023-02-02
List of tsunamis,PAPUA NEW GUINEA-SOLOMON SEA: 20/07/1975 14:37:39.9,Earthquake mag: 7.9; Max water height (m): 2; Magnitude (Iida): 1Deaths: NA,1975-07-20,1975-07-20,18,DOI:10.7289/V5PN93H7,2023-02-02
List of tsunamis,PHILIPPINES-PHILIPPINE TRENCH: 31/10/1975 08:28:2.6,Earthquake mag: 7.6; Max water height (m): 3; Magnitude (Iida): -0.7Deaths: 1,1975-10-31,1975-10-31,28,DOI:10.7289/V5PN93H7,2023-02-02
List of tsunamis,USA-HAWAII: 29/11/1975 14:47:40.9,Earthquake mag: 7.7; Max water height (m): 14.3; Magnitude (Iida): 3Deaths: 2,1975-11-29,1975-11-29,76,DOI:10.7289/V5PN93H7,2023-02-02
List of tsunamis,FIJI-FIJI ISLANDS: 16/12/1975 21:01:39,Earthquake mag: 4.9; Max water height (m): 0.25; Magnitude (Iida): NADeaths: NA,1975-12-16,1975-12-16,1,DOI:10.7289/V5PN93H7,2023-02-02
List of tsunamis,SAMOA-SAMOA ISLANDS: 26/12/1975 15:56:38.7,Earthquake mag: 7.8; Max water height (m): 0.38; Magnitude (Iida): -0.3Deaths: NA,1975-12-26,1975-12-26,3,DOI:10.7289/V5PN93H7,2023-02-02
List of tsunamis,NEW ZEALAND-KERMADEC ISLANDS: 14/01/1976 16:47:33.5,Earthquake mag: 8; Max water height (m): 0.9; Magnitude (Iida): -0.1Deaths: NA,1976-01-14,1976-01-14,15,DOI:10.7289/V5PN93H7,2023-02-02
List of tsunamis,RUSSIA-S. KURIL ISLANDS: 21/01/1976 10:05:24.1,Earthquake mag: 7; Max water height (m): 0.38; Magnitude (Iida): -1.3Deaths: NA,1976-01-21,1976-01-21,5,DOI:10.7289/V5PN93H7,2023-02-02
List of tsunamis,GUATEMALA-GUATEMALA: 04/02/1976 09:01:43.4,Earthquake mag: 7.5; Max water height (m): 0.12; Magnitude (Iida): -0.5Deaths: NA,1976-02-04,1976-02-04,1,DOI:10.7289/V5PN93H7,2023-02-02
List of tsunamis,PANAMA-PANAMA: 11/07/1976 16:54:31.8,Earthquake mag: 6.7; Max water height (m): NA; Magnitude (Iida): -1Deaths: NA,1976-07-11,1976-07-11,0,DOI:10.7289/V5PN93H7,2023-02-02
List of tsunamis,PHILIPPINES-MORO GULF: 16/08/1976 16:11:7.3,Earthquake mag: 8; Max water height (m): 9; Magnitude (Iida): 2.3Deaths: 6800,1976-08-16,1976-08-16,28,DOI:10.7289/V5PN93H7,2023-02-02
List of tsunamis,SAMOA-SAMOA ISLANDS: 02/04/1977 07:15:22.7,Earthquake mag: 7.6; Max water height (m): 0.08; Magnitude (Iida): -3.3Deaths: NA,1977-04-02,1977-04-02,2,DOI:10.7289/V5PN93H7,2023-02-02
List of tsunamis,SOLOMON ISLANDS-SOLOMON ISLANDS: 20/04/1977 23:13:10.4,Earthquake mag: 6.8; Max water height (m): 0.15; Magnitude (Iida): -3.3Deaths: NA,1977-04-20,1977-04-20,6,DOI:10.7289/V5PN93H7,2023-02-02
List of tsunamis,SOLOMON ISLANDS-SOLOMON ISLANDS: 20/04/1977 23:42:50.5,Earthquake mag: 7.6; Max water height (m): NA; Magnitude (Iida): NADeaths: NA,1977-04-20,1977-04-20,1,DOI:10.7289/V5PN93H7,2023-02-02
List of tsunamis,SOLOMON ISLANDS-SOLOMON ISLANDS: 21/04/1977 04:24:9.6,Earthquake mag: 8.1; Max water height (m): 0.04; Magnitude (Iida): -3.3Deaths: NA,1977-04-21,1977-04-21,5,DOI:10.7289/V5PN93H7,2023-02-02
List of tsunamis,TONGA-TONGA TRENCH: 22/06/1977 12:08:33.4,Earthquake mag: 7.2; Max water height (m): 0.4; Magnitude (Iida): NADeaths: NA,1977-06-22,1977-06-22,19,DOI:10.7289/V5PN93H7,2023-02-02
List of tsunamis,INDONESIA-SUNDA ISLANDS: 19/08/1977 06:08:55.2,Earthquake mag: 8; Max water height (m): 15; Magnitude (Iida): 3.9Deaths: 189,1977-08-19,1977-08-19,16,DOI:10.7289/V5PN93H7,2023-02-02
List of tsunamis,PAPUA NEW GUINEA-ADMIRALTY ISLANDS: 20/08/1977 NA:NA:NA,Earthquake mag: 5.5; Max water height (m): 0.5; Magnitude (Iida): -1Deaths: NA,1977-08-20,1977-08-20,0,DOI:10.7289/V5PN93H7,2023-02-02
List of tsunamis,PAPUA NEW GUINEA-ADMIRALTY ISLANDS: 28/08/1977 20:10:05,Earthquake mag: 5.5; Max water height (m): 0.6; Magnitude (Iida): -0.7Deaths: NA,1977-08-28,1977-08-28,1,DOI:10.7289/V5PN93H7,2023-02-02
List of tsunamis,TONGA-TONGA TRENCH: 10/10/1977 11:53:53.6,Earthquake mag: 7.2; Max water height (m): 0.03; Magnitude (Iida): NADeaths: NA,1977-10-10,1977-10-10,2,DOI:10.7289/V5PN93H7,2023-02-02
List of tsunamis,JAPAN-TOKAIDO: 14/01/1978 03:24:39,Earthquake mag: 6.6; Max water height (m): 0.35; Magnitude (Iida): -0.7Deaths: NA,1978-01-14,1978-01-14,14,DOI:10.7289/V5PN93H7,2023-02-02
List of tsunamis,RUSSIA-S. KURIL ISLANDS: 22/03/1978 00:50:32.2,Earthquake mag: 6.7; Max water height (m): 0.07; Magnitude (Iida): 0.1Deaths: NA,1978-03-22,1978-03-22,2,DOI:10.7289/V5PN93H7,2023-02-02
List of tsunamis,RUSSIA-S. KURIL ISLANDS: 22/03/1978 21:34:33.4,Earthquake mag: 6.6; Max water height (m): 0.05; Magnitude (Iida): NADeaths: NA,1978-03-22,1978-03-22,2,DOI:10.7289/V5PN93H7,2023-02-02
List of tsunamis,RUSSIA-S. KURIL ISLANDS: 23/03/1978 00:31:2.1,Earthquake mag: 6.8; Max water height (m): 0.17; Magnitude (Iida): -2.3Deaths: NA,1978-03-23,1978-03-23,4,DOI:10.7289/V5PN93H7,2023-02-02
List of tsunamis,RUSSIA-S. KURIL ISLANDS: 23/03/1978 03:15:20.3,Earthquake mag: 7.5; Max water height (m): 0.3; Magnitude (Iida): -2.3Deaths: NA,1978-03-23,1978-03-23,15,DOI:10.7289/V5PN93H7,2023-02-02
List of tsunamis,RUSSIA-S. KURIL ISLANDS: 24/03/1978 19:47:50.7,Earthquake mag: 7.6; Max water height (m): 0.65; Magnitude (Iida): -1.7Deaths: NA,1978-03-24,1978-03-24,20,DOI:10.7289/V5PN93H7,2023-02-02
List of tsunamis,NORWAY-NORWAY: RISSA: 29/04/1978 NA:NA:NA,Earthquake mag: NA; Max water height (m): 6.8; Magnitude (Iida): NADeaths: NA,1978-04-29,1978-04-29,0,DOI:10.7289/V5PN93H7,2023-02-02
List of tsunamis,JAPAN-SANRIKU: 12/06/1978 08:14:26.4,Earthquake mag: 7.7; Max water height (m): 0.6; Magnitude (Iida): NADeaths: NA,1978-06-12,1978-06-12,31,DOI:10.7289/V5PN93H7,2023-02-02
List of tsunamis,INDIA-INDIA: 12/06/1978 NA:NA:NA,Earthquake mag: NA; Max water height (m): NA; Magnitude (Iida): NADeaths: NA,1978-06-12,1978-06-12,0,DOI:10.7289/V5PN93H7,2023-02-02
List of tsunamis,"PHILIPPINES-MINDANAO ISLAND, PHILIPPINES: 14/06/1978 12:32:33.9",Earthquake mag: 6.9; Max water height (m): 0.03; Magnitude (Iida): -3.3Deaths: NA,1978-06-14,1978-06-14,1,DOI:10.7289/V5PN93H7,2023-02-02
List of tsunamis,"GREECE-THESSALONIKI (SALONICA), GREECE: 20/06/1978 20:03:21",Earthquake mag: 6.4; Max water height (m): 0.45; Magnitude (Iida): NADeaths: NA,1978-06-20,1978-06-20,5,DOI:10.7289/V5PN93H7,2023-02-02
List of tsunamis,"ITALY-EASTERN ITALY, ADRIATIC SEA: 21/06/1978 NA:NA:NA",Earthquake mag: NA; Max water height (m): 3; Magnitude (Iida): NADeaths: NA,1978-06-21,1978-06-21,8,DOI:10.7289/V5PN93H7,2023-02-02
List of tsunamis,TAIWAN-TAIWAN: 23/07/1978 14:42:36.9,Earthquake mag: 7.4; Max water height (m): 0.05; Magnitude (Iida): -3.3Deaths: NA,1978-07-23,1978-07-23,1,DOI:10.7289/V5PN93H7,2023-02-02
List of tsunamis,SPAIN-CADIZ: 14/08/1978 14:17:50.4,Earthquake mag: 4.4; Max water height (m): 0.12; Magnitude (Iida): NADeaths: NA,1978-08-14,1978-08-14,1,DOI:10.7289/V5PN93H7,2023-02-02
List of tsunamis,NEW ZEALAND-OFF EAST COAST OF SOUTH ISLAND: 10/10/1978 NA:NA:NA,Earthquake mag: NA; Max water height (m): NA; Magnitude (Iida): NADeaths: NA,1978-10-10,1978-10-10,1,DOI:10.7289/V5PN93H7,2023-02-02
List of tsunamis,MEXICO-MEXICO: 29/11/1978 19:52:47.6,Earthquake mag: 7.8; Max water height (m): 1.5; Magnitude (Iida): 0.6Deaths: NA,1978-11-29,1978-11-29,1,DOI:10.7289/V5PN93H7,2023-02-02
List of tsunamis,VIETNAM-TRA CO COAST: NA/NA/1978 NA:NA:NA,Earthquake mag: NA; Max water height (m): 3; Magnitude (Iida): NADeaths: NA,,,0,DOI:10.7289/V5PN93H7,2023-02-02
List of tsunamis,"JAPAN-IWATE, JAPAN: 20/02/1979 06:32:32.2",Earthquake mag: 6.4; Max water height (m): 0.12; Magnitude (Iida): -1.7Deaths: NA,1979-02-20,1979-02-20,11,DOI:10.7289/V5PN93H7,2023-02-02
List of tsunamis,"USA-SE. ALASKA, AK: 28/02/1979 21:27:8.1",Earthquake mag: 7.5; Max water height (m): 0.15; Magnitude (Iida): -1.7Deaths: NA,1979-02-28,1979-02-28,2,DOI:10.7289/V5PN93H7,2023-02-02
List of tsunamis,MEXICO-S. MEXICO: 14/03/1979 11:07:16.3,Earthquake mag: 7.6; Max water height (m): 1.3; Magnitude (Iida): -3.3Deaths: NA,1979-03-14,1979-03-14,3,DOI:10.7289/V5PN93H7,2023-02-02
List of tsunamis,"JAPAN-NAGASAKI, JAPAN: 31/03/1979 NA:NA:NA",Earthquake mag: NA; Max water height (m): 4.8; Magnitude (Iida): NADeaths: 3,1979-03-31,1979-03-31,2,DOI:10.7289/V5PN93H7,2023-02-02
List of tsunamis,MONTENEGRO-MONTENEGRO: BAR ULCINJ: 09/04/1979 02:10:20.3,Earthquake mag: 5.3; Max water height (m): NA; Magnitude (Iida): NADeaths: NA,1979-04-09,1979-04-09,0,DOI:10.7289/V5PN93H7,2023-02-02
List of tsunamis,MONTENEGRO-MONTENEGRO: 15/04/1979 06:19:44.1,Earthquake mag: 6.9; Max water height (m): 3; Magnitude (Iida): NADeaths: 1,1979-04-15,1979-04-15,6,DOI:10.7289/V5PN93H7,2023-02-02
List of tsunamis,GREECE-CRETE: 15/05/1979 06:59:21.2,Earthquake mag: 5.6; Max water height (m): NA; Magnitude (Iida): NADeaths: NA,1979-05-15,1979-05-15,1,DOI:10.7289/V5PN93H7,2023-02-02
List of tsunamis,INDONESIA-LOMBLEN ISLAND [LEMBATA]: 18/07/1979 NA:NA:NA,Earthquake mag: NA; Max water height (m): 9; Magnitude (Iida): NADeaths: 1239,1979-07-18,1979-07-18,1,DOI:10.7289/V5PN93H7,2023-02-02
List of tsunamis,INDONESIA-LOMBLEN ISLAND [LEMBATA]: 09/08/1979 NA:NA:NA,Earthquake mag: NA; Max water height (m): NA; Magnitude (Iida): NADeaths: NA,1979-08-09,1979-08-09,1,DOI:10.7289/V5PN93H7,2023-02-02
List of tsunamis,VENEZUELA-PUERTO CUMAREBO: 03/09/1979 02:12:NA,Earthquake mag: 5; Max water height (m): NA; Magnitude (Iida): NADeaths: NA,1979-09-03,1979-09-03,1,DOI:10.7289/V5PN93H7,2023-02-02
List of tsunamis,INDONESIA-IRIAN JAYA: 12/09/1979 05:17:51.4,Earthquake mag: 7.9; Max water height (m): 2; Magnitude (Iida): 1Deaths: 100,1979-09-12,1979-09-12,2,DOI:10.7289/V5PN93H7,2023-02-02
List of tsunamis,NORWAY-NORTHERN NORWAY: 06/10/1979 NA:NA:NA,Earthquake mag: NA; Max water height (m): 2; Magnitude (Iida): NADeaths: NA,1979-10-06,1979-10-06,1,DOI:10.7289/V5PN93H7,2023-02-02
List of tsunamis,FRANCE-FRENCH RIVIERA (LIGURIAN SEA): 16/10/1979 13:57:NA,Earthquake mag: NA; Max water height (m): 10; Magnitude (Iida): 1.6Deaths: 9,1979-10-16,1979-10-16,6,DOI:10.7289/V5PN93H7,2023-02-02
List of tsunamis,FIJI-FIJI ISLANDS: 16/11/1979 15:21:25.7,Earthquake mag: 6.9; Max water height (m): NA; Magnitude (Iida): NADeaths: NA,1979-11-16,1979-11-16,1,DOI:10.7289/V5PN93H7,2023-02-02
List of tsunamis,"COLOMBIA-COLOMBIA: OFF SHORE, PACIFIC OCEAN: 12/12/1979 07:59:5.6",Earthquake mag: 8.1; Max water height (m): 6; Magnitude (Iida): 2.3Deaths: 600,1979-12-12,1979-12-12,54,DOI:10.7289/V5PN93H7,2023-02-02
List of tsunamis,PORTUGAL-AZORES: 01/01/1980 16:42:42.1,Earthquake mag: 6.9; Max water height (m): 0.41; Magnitude (Iida): NADeaths: NA,1980-01-01,1980-01-01,2,DOI:10.7289/V5PN93H7,2023-02-02
List of tsunamis,RUSSIA-S. KURIL ISLANDS: 23/02/1980 05:51:3.2,Earthquake mag: 7; Max water height (m): 0.16; Magnitude (Iida): -0.7Deaths: NA,1980-02-23,1980-02-23,10,DOI:10.7289/V5PN93H7,2023-02-02
List of tsunamis,USA-WASHINGTON: 18/05/1980 NA:NA:NA,Earthquake mag: NA; Max water height (m): 250; Magnitude (Iida): NADeaths: NA,1980-05-18,1980-05-18,2,DOI:10.7289/V5PN93H7,2023-02-02
List of tsunamis,PORTUGAL-AZORES: 22/05/1980 NA:NA:NA,Earthquake mag: NA; Max water height (m): NA; Magnitude (Iida): NADeaths: NA,1980-05-22,1980-05-22,0,DOI:10.7289/V5PN93H7,2023-02-02
List of tsunamis,JAPAN-HONSHU ISLAND: 29/06/1980 07:20:5.5,Earthquake mag: 6.2; Max water height (m): 0.56; Magnitude (Iida): -0.7Deaths: NA,1980-06-29,1980-06-29,16,DOI:10.7289/V5PN93H7,2023-02-02
List of tsunamis,SOLOMON ISLANDS-SOLOMON ISLANDS: 17/07/1980 19:42:23.2,Earthquake mag: 7.9; Max water height (m): 0.14; Magnitude (Iida): -1.7Deaths: NA,1980-07-17,1980-07-17,34,DOI:10.7289/V5PN93H7,2023-02-02
List of tsunamis,ALGERIA-EL ASNAM: 10/10/1980 12:25:26,Earthquake mag: 7.1; Max water height (m): 0.7; Magnitude (Iida): NADeaths: NA,1980-10-10,1980-10-10,6,DOI:10.7289/V5PN93H7,2023-02-02
List of tsunamis,JAPAN-E. HONSHU ISLAND: 18/01/1981 18:17:24.4,Earthquake mag: 6.9; Max water height (m): 0.37; Magnitude (Iida): -1.3Deaths: NA,1981-01-18,1981-01-18,28,DOI:10.7289/V5PN93H7,2023-02-02
List of tsunamis,GREECE-ATHENS-EASTERN GULF OF CORINTH: 24/02/1981 20:53:38.4,Earthquake mag: 6.7; Max water height (m): 1; Magnitude (Iida): NADeaths: NA,1981-02-24,1981-02-24,4,DOI:10.7289/V5PN93H7,2023-02-02
List of tsunamis,GREECE-GULF OF CORINTH: 04/03/1981 21:58:5.9,Earthquake mag: 6.4; Max water height (m): 1; Magnitude (Iida): NADeaths: NA,1981-03-04,1981-03-04,0,DOI:10.7289/V5PN93H7,2023-02-02
List of tsunamis,SOUTH AFRICA-AGULHAS BANK: 11/05/1981 07:10:NA,Earthquake mag: NA; Max water height (m): 0.29; Magnitude (Iida): NADeaths: NA,1981-05-11,1981-05-11,9,DOI:10.7289/V5PN93H7,2023-02-02
List of tsunamis,NEW ZEALAND-NEW ZEALAND: 25/05/1981 05:25:14.4,Earthquake mag: 7.6; Max water height (m): 0.3; Magnitude (Iida): -1.7Deaths: NA,1981-05-25,1981-05-25,1,DOI:10.7289/V5PN93H7,2023-02-02
List of tsunamis,SAMOA-SAMOA ISLANDS: 01/09/1981 09:29:31.5,Earthquake mag: 7.7; Max water height (m): 1; Magnitude (Iida): -3.3Deaths: NA,1981-09-01,1981-09-01,4,DOI:10.7289/V5PN93H7,2023-02-02
List of tsunamis,INDONESIA-KRAKATAU: 20/10/1981 NA:NA:NA,Earthquake mag: NA; Max water height (m): 2; Magnitude (Iida): NADeaths: NA,1981-10-20,1981-10-20,1,DOI:10.7289/V5PN93H7,2023-02-02
List of tsunamis,MEXICO-MEXICO: 25/10/1981 03:22:15.5,Earthquake mag: 7.3; Max water height (m): 0.09; Magnitude (Iida): NADeaths: NA,1981-10-25,1981-10-25,1,DOI:10.7289/V5PN93H7,2023-02-02
List of tsunamis,PHILIPPINES-PHILIPPINES: 11/01/1982 06:10:6.4,Earthquake mag: 7.1; Max water height (m): 0.1; Magnitude (Iida): NADeaths: NA,1982-01-11,1982-01-11,1,DOI:10.7289/V5PN93H7,2023-02-02
List of tsunamis,INDONESIA-JAVA TRENCH: 24/02/1982 04:22:40.3,Earthquake mag: 5.4; Max water height (m): NA; Magnitude (Iida): NADeaths: NA,1982-02-24,1982-02-24,0,DOI:10.7289/V5PN93H7,2023-02-02
List of tsunamis,INDONESIA-SUMBAWA ISLAND: 11/03/1982 10:32:27.1,Earthquake mag: 6.6; Max water height (m): 0.1; Magnitude (Iida): NADeaths: NA,1982-03-11,1982-03-11,0,DOI:10.7289/V5PN93H7,2023-02-02
List of tsunamis,JAPAN-HOKKAIDO ISLAND: 21/03/1982 02:32:7.7,Earthquake mag: 6.9; Max water height (m): 1.3; Magnitude (Iida): 0.4Deaths: NA,1982-03-21,1982-03-21,31,DOI:10.7289/V5PN93H7,2023-02-02
List of tsunamis,"JAPAN-IBARAKI, JAPAN: 23/07/1982 14:23:53.5",Earthquake mag: 7.2; Max water height (m): 0.4; Magnitude (Iida): -1.3Deaths: NA,1982-07-23,1982-07-23,22,DOI:10.7289/V5PN93H7,2023-02-02
List of tsunamis,TONGA-KERMADEC ISLANDS: 19/12/1982 17:43:54.8,Earthquake mag: 7.5; Max water height (m): 0.2; Magnitude (Iida): -2.3Deaths: NA,1982-12-19,1982-12-19,4,DOI:10.7289/V5PN93H7,2023-02-02
List of tsunamis,INDONESIA-FLORES SEA: 25/12/1982 12:28:2.8,Earthquake mag: 6; Max water height (m): NA; Magnitude (Iida): NADeaths: NA,1982-12-25,1982-12-25,0,DOI:10.7289/V5PN93H7,2023-02-02
List of tsunamis,JAPAN-S. OF HONSHU ISLAND: 28/12/1982 06:37:42.5,Earthquake mag: 6.4; Max water height (m): 0.19; Magnitude (Iida): -1.3Deaths: NA,1982-12-28,1982-12-28,1,DOI:10.7289/V5PN93H7,2023-02-02
List of tsunamis,GREECE-IONIAN SEA: 17/01/1983 12:41:29.7,Earthquake mag: 7.2; Max water height (m): NA; Magnitude (Iida): NADeaths: NA,1983-01-17,1983-01-17,1,DOI:10.7289/V5PN93H7,2023-02-02
List of tsunamis,INDONESIA-BANDA SEA: 12/03/1983 01:36:35.8,Earthquake mag: 6.9; Max water height (m): 3; Magnitude (Iida): 1.6Deaths: NA,1983-03-12,1983-03-12,1,DOI:10.7289/V5PN93H7,2023-02-02
List of tsunamis,PAPUA NEW GUINEA-NEW BRITAIN: 18/03/1983 09:05:50,Earthquake mag: 7.9; Max water height (m): 0.13; Magnitude (Iida): -1.7Deaths: NA,1983-03-18,1983-03-18,4,DOI:10.7289/V5PN93H7,2023-02-02
List of tsunamis,"JAPAN-NOSHIRO, JAPAN: 26/05/1983 02:59:59.6",Earthquake mag: 7.8; Max water height (m): 14.93; Magnitude (Iida): 3.9Deaths: 100,1983-05-26,1983-05-26,230,DOI:10.7289/V5PN93H7,2023-02-02
List of tsunamis,"JAPAN-NOSHIRO, JAPAN: 09/06/1983 12:49:3.8",Earthquake mag: 5.9; Max water height (m): 0.6; Magnitude (Iida): NADeaths: NA,1983-06-09,1983-06-09,1,DOI:10.7289/V5PN93H7,2023-02-02
List of tsunamis,JAPAN-N. HONSHU ISLAND: 21/06/1983 06:25:27.3,Earthquake mag: 6.9; Max water height (m): 1; Magnitude (Iida): NADeaths: NA,1983-06-21,1983-06-21,27,DOI:10.7289/V5PN93H7,2023-02-02
List of tsunamis,GREECE-NORTH AEGEAN SEA: 06/08/1983 15:43:51.2,Earthquake mag: 7; Max water height (m): NA; Magnitude (Iida): NADeaths: NA,1983-08-06,1983-08-06,1,DOI:10.7289/V5PN93H7,2023-02-02
List of tsunamis,"RUSSIA-KAMCHATKA BAY, RUSSIA: 17/08/1983 10:55:54.1",Earthquake mag: 7.1; Max water height (m): 0.1; Magnitude (Iida): -3.3Deaths: NA,1983-08-17,1983-08-17,1,DOI:10.7289/V5PN93H7,2023-02-02
List of tsunamis,PHILIPPINES-LUZON ISLAND: 17/08/1983 12:17:56,Earthquake mag: 6.6; Max water height (m): 0.1; Magnitude (Iida): NADeaths: NA,1983-08-17,1983-08-17,1,DOI:10.7289/V5PN93H7,2023-02-02
List of tsunamis,INDONESIA-LESSER SUNDA ISLANDS: 17/08/1983 NA:NA:NA,Earthquake mag: NA; Max water height (m): NA; Magnitude (Iida): NADeaths: NA,1983-08-17,1983-08-17,0,DOI:10.7289/V5PN93H7,2023-02-02
List of tsunamis,NORWAY-WESTERN NORWAY: 18/08/1983 09:NA:NA,Earthquake mag: NA; Max water height (m): 7; Magnitude (Iida): NADeaths: NA,1983-08-18,1983-08-18,1,DOI:10.7289/V5PN93H7,2023-02-02
List of tsunamis,CHILE-NORTHERN CHILE: 04/10/1983 18:52:13.3,Earthquake mag: 7.7; Max water height (m): 0.2; Magnitude (Iida): -2.3Deaths: NA,1983-10-04,1983-10-04,1,DOI:10.7289/V5PN93H7,2023-02-02
List of tsunamis,UK TERRITORY-CHAGOS ARCHIPELAGO REGION: 30/11/1983 17:46:0.6,Earthquake mag: 7.7; Max water height (m): 1.5; Magnitude (Iida): -1.3Deaths: NA,1983-11-30,1983-11-30,3,DOI:10.7289/V5PN93H7,2023-02-02
List of tsunamis,INDONESIA-SULAWESI: 08/01/1984 15:24:13.5,Earthquake mag: 6.8; Max water height (m): NA; Magnitude (Iida): NADeaths: NA,1984-01-08,1984-01-08,0,DOI:10.7289/V5PN93H7,2023-02-02
List of tsunamis,"GREECE-CORINTHOS GULF, GREECE: 11/02/1984 08:02:52.1",Earthquake mag: 5.6; Max water height (m): NA; Magnitude (Iida): NADeaths: NA,1984-02-11,1984-02-11,1,DOI:10.7289/V5PN93H7,2023-02-02
List of tsunamis,RUSSIA-S. KURIL ISLANDS: 24/03/1984 09:44:2.6,Earthquake mag: 7.2; Max water height (m): 0.2; Magnitude (Iida): -2.3Deaths: NA,1984-03-24,1984-03-24,3,DOI:10.7289/V5PN93H7,2023-02-02
List of tsunamis,"JAPAN-TORI SHIMA, OKINAWA: 13/06/1984 02:29:25.3",Earthquake mag: 5.5; Max water height (m): 0.5; Magnitude (Iida): 0.6Deaths: NA,1984-06-13,1984-06-13,9,DOI:10.7289/V5PN93H7,2023-02-02
List of tsunamis,"JAPAN-KYUSHU, JAPAN: 06/08/1984 19:06:38.3",Earthquake mag: 7; Max water height (m): 0.2; Magnitude (Iida): -2.3Deaths: NA,1984-08-06,1984-08-06,6,DOI:10.7289/V5PN93H7,2023-02-02
List of tsunamis,CAMEROON-LAKE MONOUN: 15/08/1984 NA:NA:NA,Earthquake mag: NA; Max water height (m): 5; Magnitude (Iida): NADeaths: NA,1984-08-15,1984-08-15,1,DOI:10.7289/V5PN93H7,2023-02-02
List of tsunamis,JAPAN-HONSHU ISLAND: 18/09/1984 17:02:44.3,Earthquake mag: 6.9; Max water height (m): 0.13; Magnitude (Iida): -3.3Deaths: NA,1984-09-18,1984-09-18,12,DOI:10.7289/V5PN93H7,2023-02-02
List of tsunamis,RUSSIA-KAMCHATKA: 28/12/1984 10:37:53.7,Earthquake mag: 6.8; Max water height (m): 0.2; Magnitude (Iida): -2.3Deaths: NA,1984-12-28,1984-12-28,2,DOI:10.7289/V5PN93H7,2023-02-02
List of tsunamis,CHILE-CENTRAL CHILE: 03/03/1985 22:47:9.5,Earthquake mag: 8; Max water height (m): 3.5; Magnitude (Iida): 1.6Deaths: NA,1985-03-03,1985-03-03,64,DOI:10.7289/V5PN93H7,2023-02-02
List of tsunamis,GUADELOUPE (FRENCH TERRITORY)-GUADELOUPE: 16/03/1985 14:54:0.7,Earthquake mag: 6.4; Max water height (m): 0.12; Magnitude (Iida): -3.3Deaths: NA,1985-03-16,1985-03-16,1,DOI:10.7289/V5PN93H7,2023-02-02
List of tsunamis,INDONESIA-BALI ISLAND: 13/04/1985 01:06:0.1,Earthquake mag: 6.2; Max water height (m): 2; Magnitude (Iida): NADeaths: NA,1985-04-13,1985-04-13,1,DOI:10.7289/V5PN93H7,2023-02-02
List of tsunamis,PAPUA NEW GUINEA-NEW IRELAND: 03/07/1985 04:36:51.7,Earthquake mag: 7.3; Max water height (m): 1.3; Magnitude (Iida): 0.4Deaths: NA,1985-07-03,1985-07-03,2,DOI:10.7289/V5PN93H7,2023-02-02
List of tsunamis,MEXICO-MEXICO: 19/09/1985 13:17:47.3,Earthquake mag: 8; Max water height (m): 3; Magnitude (Iida): 1.6Deaths: NA,1985-09-19,1985-09-19,19,DOI:10.7289/V5PN93H7,2023-02-02
List of tsunamis,MEXICO-MEXICO: 21/09/1985 01:37:13.4,Earthquake mag: 7.6; Max water height (m): 1.2; Magnitude (Iida): 0.3Deaths: NA,1985-09-21,1985-09-21,3,DOI:10.7289/V5PN93H7,2023-02-02
List of tsunamis,"USA-ANDREANOF ISLANDS, AK: 07/05/1986 22:47:10.8",Earthquake mag: 8; Max water height (m): 0.9; Magnitude (Iida): -0.1Deaths: NA,1986-05-07,1986-05-07,66,DOI:10.7289/V5PN93H7,2023-02-02
List of tsunamis,"USA-ANDREANOF ISLANDS, AK: 17/05/1986 16:20:22.2",Earthquake mag: 6.4; Max water height (m): NA; Magnitude (Iida): NADeaths: NA,1986-05-17,1986-05-17,0,DOI:10.7289/V5PN93H7,2023-02-02
List of tsunamis,CAMEROON-LAKE NYOS: 21/08/1986 NA:NA:NA,Earthquake mag: NA; Max water height (m): 75; Magnitude (Iida): NADeaths: NA,1986-08-21,1986-08-21,1,DOI:10.7289/V5PN93H7,2023-02-02
List of tsunamis,NEW ZEALAND-KERMADEC ISLANDS: 20/10/1986 06:46:9.9,Earthquake mag: 7.8; Max water height (m): 0.22; Magnitude (Iida): -2.18Deaths: NA,1986-10-20,1986-10-20,8,DOI:10.7289/V5PN93H7,2023-02-02
List of tsunamis,TAIWAN-TAIWAN: 14/11/1986 21:20:10.5,Earthquake mag: 7.8; Max water height (m): 0.3; Magnitude (Iida): NADeaths: NA,1986-11-14,1986-11-14,5,DOI:10.7289/V5PN93H7,2023-02-02
List of tsunamis,JAPAN-E. HONSHU ISLAND: 06/02/1987 13:16:17.8,Earthquake mag: 6.7; Max water height (m): 0.1; Magnitude (Iida): -3.3Deaths: NA,1987-02-06,1987-02-06,3,DOI:10.7289/V5PN93H7,2023-02-02
List of tsunamis,PAPUA NEW GUINEA-SOLOMON SEA: 08/02/1987 18:33:58.3,Earthquake mag: 7.4; Max water height (m): 1.5; Magnitude (Iida): 1Deaths: NA,1987-02-08,1987-02-08,1,DOI:10.7289/V5PN93H7,2023-02-02
List of tsunamis,NORWAY-WESTERN NORWAY: 21/02/1987 07:40:NA,Earthquake mag: NA; Max water height (m): 3; Magnitude (Iida): NADeaths: NA,1987-02-21,1987-02-21,1,DOI:10.7289/V5PN93H7,2023-02-02
List of tsunamis,CHILE-NORTHERN CHILE: 05/03/1987 09:17:5.2,Earthquake mag: 7.6; Max water height (m): 0.2; Magnitude (Iida): -2.3Deaths: NA,1987-03-05,1987-03-05,6,DOI:10.7289/V5PN93H7,2023-02-02
List of tsunamis,JAPAN-KYUSHU ISLAND: 18/03/1987 03:36:30.3,Earthquake mag: 6.7; Max water height (m): 0.04; Magnitude (Iida): -3.3Deaths: NA,1987-03-18,1987-03-18,1,DOI:10.7289/V5PN93H7,2023-02-02
List of tsunamis,JAPAN-HONSHU ISLAND: 24/03/1987 12:49:47,Earthquake mag: 5.1; Max water height (m): 0.16; Magnitude (Iida): NADeaths: NA,1987-03-24,1987-03-24,3,DOI:10.7289/V5PN93H7,2023-02-02
List of tsunamis,NEW ZEALAND-DEEP COVE: 20/05/1987 NA:NA:NA,Earthquake mag: NA; Max water height (m): NA; Magnitude (Iida): NADeaths: NA,1987-05-20,1987-05-20,1,DOI:10.7289/V5PN93H7,2023-02-02
List of tsunamis,SOLOMON ISLANDS-SOLOMON ISLANDS: 18/06/1987 14:03:16.7,Earthquake mag: 6.3; Max water height (m): NA; Magnitude (Iida): NADeaths: NA,1987-06-18,1987-06-18,1,DOI:10.7289/V5PN93H7,2023-02-02
List of tsunamis,VANUATU-VANUATU ISLANDS: 06/07/1987 02:49:42.7,Earthquake mag: 6.7; Max water height (m): 0.1; Magnitude (Iida): NADeaths: NA,1987-07-06,1987-07-06,1,DOI:10.7289/V5PN93H7,2023-02-02
List of tsunamis,TONGA-TONGA ISLANDS: 06/10/1987 04:19:06,Earthquake mag: 7.3; Max water height (m): 0.25; Magnitude (Iida): -3.3Deaths: NA,1987-10-06,1987-10-06,2,DOI:10.7289/V5PN93H7,2023-02-02
List of tsunamis,PAPUA NEW GUINEA-SOLOMON SEA: 12/10/1987 13:57:4.7,Earthquake mag: 7; Max water height (m): 0.04; Magnitude (Iida): -0.5Deaths: NA,1987-10-12,1987-10-12,1,DOI:10.7289/V5PN93H7,2023-02-02
List of tsunamis,PAPUA NEW GUINEA-SOLOMON SEA: 16/10/1987 20:48:1.6,Earthquake mag: 7.4; Max water height (m): 0.07; Magnitude (Iida): -3.3Deaths: NA,1987-10-16,1987-10-16,2,DOI:10.7289/V5PN93H7,2023-02-02
List of tsunamis,"USA-GULF OF ALASKA, AK: 17/11/1987 08:46:53.3",Earthquake mag: 7.2; Max water height (m): 0.06; Magnitude (Iida): -3.3Deaths: NA,1987-11-17,1987-11-17,1,DOI:10.7289/V5PN93H7,2023-02-02
List of tsunamis,INDONESIA-TIMOR SEA: 26/11/1987 01:43:14,Earthquake mag: 6.6; Max water height (m): 0.1; Magnitude (Iida): NADeaths: NA,1987-11-26,1987-11-26,0,DOI:10.7289/V5PN93H7,2023-02-02
List of tsunamis,"USA-GULF OF ALASKA, AK: 30/11/1987 19:23:19.5",Earthquake mag: 7.9; Max water height (m): 0.43; Magnitude (Iida): -1Deaths: NA,1987-11-30,1987-11-30,10,DOI:10.7289/V5PN93H7,2023-02-02
List of tsunamis,CHILE-NORTHERN CHILE: 05/02/1988 14:01:2.7,Earthquake mag: 7.2; Max water height (m): 0.1; Magnitude (Iida): NADeaths: NA,1988-02-05,1988-02-05,1,DOI:10.7289/V5PN93H7,2023-02-02
List of tsunamis,"USA-GULF OF ALASKA, AK: 06/03/1988 22:35:36.9",Earthquake mag: 7.8; Max water height (m): 0.19; Magnitude (Iida): -2.3Deaths: NA,1988-03-06,1988-03-06,8,DOI:10.7289/V5PN93H7,2023-02-02
List of tsunamis,"ITALY-LA FOSSA VOLCANO, VULCANO IS.: 20/04/1988 05:30:NA",Earthquake mag: NA; Max water height (m): 2; Magnitude (Iida): NADeaths: NA,1988-04-20,1988-04-20,1,DOI:10.7289/V5PN93H7,2023-02-02
List of tsunamis,USA-S. CALIFORNIA: 30/04/1988 NA:NA:NA,Earthquake mag: NA; Max water height (m): NA; Magnitude (Iida): NADeaths: NA,1988-04-30,1988-04-30,1,DOI:10.7289/V5PN93H7,2023-02-02
List of tsunamis,PHILIPPINES-NORTH OF LUZON ISLAND: 24/06/1988 02:06:26.3,Earthquake mag: 5.4; Max water height (m): 1.03; Magnitude (Iida): NADeaths: NA,1988-06-24,1988-06-24,2,DOI:10.7289/V5PN93H7,2023-02-02
List of tsunamis,PAPUA NEW GUINEA-PAPUA NEW GUINEA: 05/07/1988 20:32:7.2,Earthquake mag: 6.8; Max water height (m): NA; Magnitude (Iida): NADeaths: NA,1988-07-05,1988-07-05,2,DOI:10.7289/V5PN93H7,2023-02-02
List of tsunamis,"BANGLADESH-JAMUNA RIVER, ARICHA, BANGLADESH: 06/08/1988 00:36:24.6",Earthquake mag: 7.2; Max water height (m): NA; Magnitude (Iida): NADeaths: 2,1988-08-06,1988-08-06,0,DOI:10.7289/V5PN93H7,2023-02-02
List of tsunamis,SOLOMON ISLANDS-SOLOMON ISLANDS: 10/08/1988 04:38:29.2,Earthquake mag: 7.6; Max water height (m): 0.09; Magnitude (Iida): -3.3Deaths: 1,1988-08-10,1988-08-10,2,DOI:10.7289/V5PN93H7,2023-02-02
List of tsunamis,BANGLADESH-BANGLADESH: 20/08/1988 23:09:9.5,Earthquake mag: 6.6; Max water height (m): NA; Magnitude (Iida): NADeaths: 2,1988-08-20,1988-08-20,1,DOI:10.7289/V5PN93H7,2023-02-02
List of tsunamis,AUSTRALIA-MACQUARIE ISLAND: 23/05/1989 10:54:46.3,Earthquake mag: 8.1; Max water height (m): 0.15; Magnitude (Iida): -1.7Deaths: NA,1989-05-23,1989-05-23,4,DOI:10.7289/V5PN93H7,2023-02-02
List of tsunamis,USA-HAWAII: 26/06/1989 03:27:3.9,Earthquake mag: 6.5; Max water height (m): 0.29; Magnitude (Iida): -1.7Deaths: NA,1989-06-26,1989-06-26,3,DOI:10.7289/V5PN93H7,2023-02-02
List of tsunamis,"USA-SEMIDI ISLANDS, AK: 04/09/1989 13:14:58.2",Earthquake mag: 7.1; Max water height (m): 0.1; Magnitude (Iida): -3.3Deaths: NA,1989-09-04,1989-09-04,2,DOI:10.7289/V5PN93H7,2023-02-02
List of tsunamis,USA-N. CALIFORNIA: 18/10/1989 00:04:15.2,Earthquake mag: 6.9; Max water height (m): 1; Magnitude (Iida): -3.3Deaths: NA,1989-10-18,1989-10-18,3,DOI:10.7289/V5PN93H7,2023-02-02
List of tsunamis,JAPAN-N. HONSHU ISLAND: 29/10/1989 05:25:38.2,Earthquake mag: 6.5; Max water height (m): 0.11; Magnitude (Iida): NADeaths: NA,1989-10-29,1989-10-29,4,DOI:10.7289/V5PN93H7,2023-02-02
List of tsunamis,"ALGERIA-ALGIERS, CHERCHELL, TIPAZA: 29/10/1989 19:09:12.9",Earthquake mag: 5.9; Max water height (m): NA; Magnitude (Iida): NADeaths: NA,1989-10-29,1989-10-29,1,DOI:10.7289/V5PN93H7,2023-02-02
List of tsunamis,USA TERRITORY-PUERTO RICO: 01/11/1989 10:25:52.2,Earthquake mag: 4.4; Max water height (m): 0.1; Magnitude (Iida): NADeaths: NA,1989-11-01,1989-11-01,1,DOI:10.7289/V5PN93H7,2023-02-02
List of tsunamis,JAPAN-JAPAN: 01/11/1989 18:25:34.9,Earthquake mag: 7.4; Max water height (m): 0.9; Magnitude (Iida): -0.7Deaths: NA,1989-11-01,1989-11-01,12,DOI:10.7289/V5PN93H7,2023-02-02
List of tsunamis,PHILIPPINES-PHILIPPINES: 08/02/1990 07:15:32.2,Earthquake mag: 6.6; Max water height (m): 2.1; Magnitude (Iida): NADeaths: NA,1990-02-08,1990-02-08,0,DOI:10.7289/V5PN93H7,2023-02-02
List of tsunamis,JAPAN-JAPAN: 20/02/1990 06:53:39.8,Earthquake mag: 6.4; Max water height (m): 0.16; Magnitude (Iida): -1.7Deaths: NA,1990-02-20,1990-02-20,1,DOI:10.7289/V5PN93H7,2023-02-02
List of tsunamis,COSTA RICA-COSTA RICA: 25/03/1990 13:22:55.6,Earthquake mag: 7; Max water height (m): 1; Magnitude (Iida): NADeaths: NA,1990-03-25,1990-03-25,4,DOI:10.7289/V5PN93H7,2023-02-02
List of tsunamis,"USA TERRITORY-MARIANA TRENCH, N. MARIANA ISLANDS: 05/04/1990 21:12:35.5",Earthquake mag: 7.5; Max water height (m): 1.8; Magnitude (Iida): -1Deaths: NA,1990-04-05,1990-04-05,34,DOI:10.7289/V5PN93H7,2023-02-02
List of tsunamis,"PHILIPPINES-CANIGUIN IS.,PHILIPPINES: NA/05/1990 NA:NA:NA",Earthquake mag: NA; Max water height (m): 5; Magnitude (Iida): NADeaths: NA,,,1,DOI:10.7289/V5PN93H7,2023-02-02
List of tsunamis,IRAN-CASPIAN SEA: 20/06/1990 21:00:9.9,Earthquake mag: 7.3; Max water height (m): 2; Magnitude (Iida): NADeaths: NA,1990-06-20,1990-06-20,6,DOI:10.7289/V5PN93H7,2023-02-02
List of tsunamis,"JAPAN-W. OF BONIN ISLANDS, IZU IS., JAPAN: 23/09/1990 21:13:7.4",Earthquake mag: 6.5; Max water height (m): 0.2; Magnitude (Iida): NADeaths: NA,1990-09-23,1990-09-23,4,DOI:10.7289/V5PN93H7,2023-02-02
List of tsunamis,ITALY-EASTERN SICILY: 13/12/1990 00:24:25.7,Earthquake mag: 5.3; Max water height (m): 0.1; Magnitude (Iida): NADeaths: NA,1990-12-13,1990-12-13,1,DOI:10.7289/V5PN93H7,2023-02-02
List of tsunamis,TAIWAN-TAIWAN: 13/12/1990 19:50:17.8,Earthquake mag: 6.3; Max water height (m): 0.04; Magnitude (Iida): NADeaths: NA,1990-12-13,1990-12-13,2,DOI:10.7289/V5PN93H7,2023-02-02
List of tsunamis,GREECE-EAST AEGEAN SEA: 04/01/1991 NA:NA:NA,Earthquake mag: NA; Max water height (m): NA; Magnitude (Iida): NADeaths: NA,1991-01-04,1991-01-04,1,DOI:10.7289/V5PN93H7,2023-02-02
List of tsunamis,SOLOMON ISLANDS-SOLOMON ISLANDS: 09/02/1991 16:18:58.3,Earthquake mag: 6.9; Max water height (m): 0.02; Magnitude (Iida): -3.3Deaths: NA,1991-02-09,1991-02-09,1,DOI:10.7289/V5PN93H7,2023-02-02
List of tsunamis,RUSSIA-N. KURIL ISLANDS: 16/02/1991 01:23:40.4,Earthquake mag: 5.7; Max water height (m): 0.1; Magnitude (Iida): -3.3Deaths: NA,1991-02-16,1991-02-16,1,DOI:10.7289/V5PN93H7,2023-02-02
List of tsunamis,"USA-BERING SEA, AK: 21/02/1991 02:35:34",Earthquake mag: 6.7; Max water height (m): 0.15; Magnitude (Iida): -1.7Deaths: NA,1991-02-21,1991-02-21,2,DOI:10.7289/V5PN93H7,2023-02-02
List of tsunamis,"COSTA RICA-LIMON, PANDORA: 22/04/1991 21:56:51.8",Earthquake mag: 7.6; Max water height (m): 3; Magnitude (Iida): 1Deaths: 3,1991-04-22,1991-04-22,30,DOI:10.7289/V5PN93H7,2023-02-02
List of tsunamis,GREECE-EAST AEGEAN SEA: 07/05/1991 NA:NA:NA,Earthquake mag: NA; Max water height (m): 0.5; Magnitude (Iida): -3.3Deaths: NA,1991-05-07,1991-05-07,1,DOI:10.7289/V5PN93H7,2023-02-02
List of tsunamis,SOLOMON ISLANDS-SOLOMON ISLANDS: 14/10/1991 15:58:12.7,Earthquake mag: 7.2; Max water height (m): 0.15; Magnitude (Iida): -3.3Deaths: NA,1991-10-14,1991-10-14,2,DOI:10.7289/V5PN93H7,2023-02-02
List of tsunamis,CHINA-AOSHAN: NA/11/1991 NA:NA:NA,Earthquake mag: NA; Max water height (m): 3; Magnitude (Iida): NADeaths: NA,,,0,DOI:10.7289/V5PN93H7,2023-02-02
List of tsunamis,RUSSIA-S. KURIL ISLANDS: 22/12/1991 08:43:13.4,Earthquake mag: 7.6; Max water height (m): 0.52; Magnitude (Iida): NADeaths: NA,1991-12-22,1991-12-22,6,DOI:10.7289/V5PN93H7,2023-02-02
List of tsunamis,CHINA-SOUTH CHINA SEA: 05/01/1992 06:NA:NA,Earthquake mag: 3.7; Max water height (m): 0.8; Magnitude (Iida): -0.3Deaths: NA,1992-01-05,1992-01-05,5,DOI:10.7289/V5PN93H7,2023-02-02
List of tsunamis,"USA-CAPE MENDOCINO, N. CALIFORNIA: 25/04/1992 18:06:4.2",Earthquake mag: 7.2; Max water height (m): 1.8; Magnitude (Iida): 0.8Deaths: NA,1992-04-25,1992-04-25,14,DOI:10.7289/V5PN93H7,2023-02-02
List of tsunamis,PHILIPPINES-PHILIPPINES: 17/05/1992 10:15:31.3,Earthquake mag: 7.3; Max water height (m): 6; Magnitude (Iida): NADeaths: NA,1992-05-17,1992-05-17,3,DOI:10.7289/V5PN93H7,2023-02-02
List of tsunamis,SOLOMON ISLANDS-SANTA CRUZ ISLANDS: 27/05/1992 05:13:38.8,Earthquake mag: 7.1; Max water height (m): NA; Magnitude (Iida): NADeaths: NA,1992-05-27,1992-05-27,1,DOI:10.7289/V5PN93H7,2023-02-02
List of tsunamis,"USA-DAYTONA BEACH, FL: 03/07/1992 NA:NA:NA",Earthquake mag: NA; Max water height (m): 3; Magnitude (Iida): NADeaths: NA,1992-07-03,1992-07-03,4,DOI:10.7289/V5PN93H7,2023-02-02
List of tsunamis,JAPAN-HONSHU ISLAND: 18/07/1992 08:36:58.7,Earthquake mag: 7; Max water height (m): 0.3; Magnitude (Iida): -2.3Deaths: NA,1992-07-18,1992-07-18,4,DOI:10.7289/V5PN93H7,2023-02-02
List of tsunamis,JAPAN-HONSHU: 11/08/1992 15:14:55.1,Earthquake mag: 6.3; Max water height (m): NA; Magnitude (Iida): NADeaths: NA,1992-08-11,1992-08-11,0,DOI:10.7289/V5PN93H7,2023-02-02
List of tsunamis,NICARAGUA-NICARAGUA: 02/09/1992 00:16:3.3,Earthquake mag: 7.6; Max water height (m): 9.9; Magnitude (Iida): 3.3Deaths: 170,1992-09-02,1992-09-02,81,DOI:10.7289/V5PN93H7,2023-02-02
List of tsunamis,INDONESIA-FLORES SEA: 12/12/1992 05:29:26.3,Earthquake mag: 7.8; Max water height (m): 26.2; Magnitude (Iida): 4.7Deaths: 1169,1992-12-12,1992-12-12,111,DOI:10.7289/V5PN93H7,2023-02-02
List of tsunamis,JAPAN-HONSHU ISLAND: 07/02/1993 13:27:42,Earthquake mag: 6.3; Max water height (m): 0.5; Magnitude (Iida): -1Deaths: NA,1993-02-07,1993-02-07,1,DOI:10.7289/V5PN93H7,2023-02-02
List of tsunamis,WALLIS AND FUTUNA (FRENCH TERRITORY)-FUTUNA: 12/03/1993 14:01:35.4,Earthquake mag: 6.4; Max water height (m): NA; Magnitude (Iida): NADeaths: NA,1993-03-12,1993-03-12,1,DOI:10.7289/V5PN93H7,2023-02-02
List of tsunamis,RUSSIA-KAMCHATKA: 08/06/1993 13:03:36.4,Earthquake mag: 7.5; Max water height (m): 0.1; Magnitude (Iida): -1Deaths: NA,1993-06-08,1993-06-08,6,DOI:10.7289/V5PN93H7,2023-02-02
List of tsunamis,NEW ZEALAND-KERMADEC ISLANDS: 18/06/1993 11:52:54.8,Earthquake mag: 6.6; Max water height (m): NA; Magnitude (Iida): NADeaths: NA,1993-06-18,1993-06-18,1,DOI:10.7289/V5PN93H7,2023-02-02
List of tsunamis,JAPAN-SEA OF JAPAN: 12/07/1993 13:17:11.9,Earthquake mag: 7.7; Max water height (m): 32; Magnitude (Iida): 5Deaths: 208,1993-07-12,1993-07-12,196,DOI:10.7289/V5PN93H7,2023-02-02
List of tsunamis,JAPAN-JAPAN: 07/08/1993 19:42:41.9,Earthquake mag: 6.3; Max water height (m): 0.16; Magnitude (Iida): NADeaths: NA,1993-08-07,1993-08-07,1,DOI:10.7289/V5PN93H7,2023-02-02
List of tsunamis,"USA TERRITORY-GUAM, MARIANA ISLANDS: 08/08/1993 08:34:24.9",Earthquake mag: 7.8; Max water height (m): 2.4; Magnitude (Iida): -1Deaths: NA,1993-08-08,1993-08-08,48,DOI:10.7289/V5PN93H7,2023-02-02
List of tsunamis,RUSSIA-KAMCHATKA: 13/11/1993 01:18:4.1,Earthquake mag: 7; Max water height (m): 0.05; Magnitude (Iida): -3.3Deaths: NA,1993-11-13,1993-11-13,1,DOI:10.7289/V5PN93H7,2023-02-02
List of tsunamis,"USA-COREA HARBOR, MAINE: 04/01/1994 NA:NA:NA",Earthquake mag: NA; Max water height (m): 1.5; Magnitude (Iida): NADeaths: NA,1994-01-04,1994-01-04,1,DOI:10.7289/V5PN93H7,2023-02-02
List of tsunamis,"USA-WEST COAST, USA: 17/01/1994 12:30:55.3",Earthquake mag: 6.7; Max water height (m): 0.1; Magnitude (Iida): -3.3Deaths: NA,1994-01-17,1994-01-17,0,DOI:10.7289/V5PN93H7,2023-02-02
List of tsunamis,INDONESIA-HALMAHERA: 21/01/1994 02:24:29.9,Earthquake mag: 7; Max water height (m): 2; Magnitude (Iida): 1Deaths: NA,1994-01-21,1994-01-21,3,DOI:10.7289/V5PN93H7,2023-02-02
List of tsunamis,INDONESIA-SOUTHERN SUMATRA: 15/02/1994 17:07:43.8,Earthquake mag: 6.9; Max water height (m): NA; Magnitude (Iida): NADeaths: NA,1994-02-15,1994-02-15,0,DOI:10.7289/V5PN93H7,2023-02-02
List of tsunamis,JAPAN-HOKKAIDO ISLAND: 08/04/1994 01:10:40.8,Earthquake mag: 6.4; Max water height (m): 0.11; Magnitude (Iida): -2.3Deaths: NA,1994-04-08,1994-04-08,3,DOI:10.7289/V5PN93H7,2023-02-02
List of tsunamis,NORWAY-WESTERN NORWAY: 28/04/1994 11:30:NA,Earthquake mag: NA; Max water height (m): 4; Magnitude (Iida): NADeaths: NA,1994-04-28,1994-04-28,1,DOI:10.7289/V5PN93H7,2023-02-02
List of tsunamis,TAIWAN-TAIWAN: 24/05/1994 04:00:42.1,Earthquake mag: 6.5; Max water height (m): 0.02; Magnitude (Iida): NADeaths: NA,1994-05-24,1994-05-24,1,DOI:10.7289/V5PN93H7,2023-02-02
List of tsunamis,INDONESIA-SOUTH OF JAVA: 02/06/1994 18:17:34,Earthquake mag: 7.8; Max water height (m): 13.9; Magnitude (Iida): 3.7Deaths: 238,1994-06-02,1994-06-02,74,DOI:10.7289/V5PN93H7,2023-02-02
List of tsunamis,INDONESIA-SOUTH OF JAVA: 03/06/1994 21:06:59.8,Earthquake mag: 6.6; Max water height (m): 3.7; Magnitude (Iida): NADeaths: NA,1994-06-03,1994-06-03,1,DOI:10.7289/V5PN93H7,2023-02-02
List of tsunamis,INDONESIA-SOUTH OF JAVA: 04/06/1994 00:57:50.6,Earthquake mag: 6.5; Max water height (m): NA; Magnitude (Iida): NADeaths: NA,1994-06-04,1994-06-04,0,DOI:10.7289/V5PN93H7,2023-02-02
List of tsunamis,INDONESIA-SOUTH OF JAVA: 05/06/1994 01:45:2.7,Earthquake mag: 6.1; Max water height (m): 3; Magnitude (Iida): NADeaths: NA,1994-06-05,1994-06-05,1,DOI:10.7289/V5PN93H7,2023-02-02
List of tsunamis,USA-N. CALIFORNIA: 01/09/1994 15:15:53,Earthquake mag: 7; Max water height (m): 0.07; Magnitude (Iida): -3.3Deaths: NA,1994-09-01,1994-09-01,1,DOI:10.7289/V5PN93H7,2023-02-02
List of tsunamis,TAIWAN-TAIWAN STRAIT: 16/09/1994 06:20:18.7,Earthquake mag: 6.7; Max water height (m): 0.24; Magnitude (Iida): NADeaths: NA,1994-09-16,1994-09-16,3,DOI:10.7289/V5PN93H7,2023-02-02
List of tsunamis,PAPUA NEW GUINEA-PAPUA NEW GUINEA: 19/09/1994 NA:NA:NA,Earthquake mag: NA; Max water height (m): 3; Magnitude (Iida): 1.2Deaths: NA,1994-09-19,1994-09-19,3,DOI:10.7289/V5PN93H7,2023-02-02
List of tsunamis,RUSSIA-S. KURIL ISLANDS: 04/10/1994 13:22:55.8,Earthquake mag: 8.3; Max water height (m): 10.4; Magnitude (Iida): 2.3Deaths: NA,1994-10-04,1994-10-04,118,DOI:10.7289/V5PN93H7,2023-02-02
List of tsunamis,INDONESIA-HALMAHERA: 08/10/1994 21:44:7.2,Earthquake mag: 6.8; Max water height (m): 3; Magnitude (Iida): 1.6Deaths: 1,1994-10-08,1994-10-08,1,DOI:10.7289/V5PN93H7,2023-02-02
List of tsunamis,RUSSIA-S. KURIL ISLANDS: 09/10/1994 07:55:39.5,Earthquake mag: 7.3; Max water height (m): 0.2; Magnitude (Iida): -3.3Deaths: NA,1994-10-09,1994-10-09,2,DOI:10.7289/V5PN93H7,2023-02-02
List of tsunamis,"USA-SKAGWAY, AK: 04/11/1994 04:12:NA",Earthquake mag: NA; Max water height (m): 9; Magnitude (Iida): 3.5Deaths: 1,1994-11-04,1994-11-04,2,DOI:10.7289/V5PN93H7,2023-02-02
List of tsunamis,PHILIPPINES-PHILIPPINE ISLANDS: 14/11/1994 19:15:30.6,Earthquake mag: 7.1; Max water height (m): 7.3; Magnitude (Iida): 2.9Deaths: 81,1994-11-14,1994-11-14,56,DOI:10.7289/V5PN93H7,2023-02-02
List of tsunamis,"JAPAN-TOHUKU, JAPAN: 28/12/1994 12:19:23",Earthquake mag: 7.8; Max water height (m): 0.53; Magnitude (Iida): NADeaths: NA,1994-12-28,1994-12-28,13,DOI:10.7289/V5PN93H7,2023-02-02
List of tsunamis,RUSSIA-KERCH STRAIT: NA/NA/1994 NA:NA:NA,Earthquake mag: NA; Max water height (m): 0.5; Magnitude (Iida): NADeaths: NA,,,0,DOI:10.7289/V5PN93H7,2023-02-02
List of tsunamis,"JAPAN-KOBE, JAPAN: 16/01/1995 20:46:53.6",Earthquake mag: 6.9; Max water height (m): 0.34; Magnitude (Iida): -2.3Deaths: NA,1995-01-16,1995-01-16,2,DOI:10.7289/V5PN93H7,2023-02-02
List of tsunamis,SAMOA-SAMOA ISLANDS: 07/04/1995 22:06:56.8,Earthquake mag: 7.4; Max water height (m): 0.09; Magnitude (Iida): -1.7Deaths: NA,1995-04-07,1995-04-07,2,DOI:10.7289/V5PN93H7,2023-02-02
List of tsunamis,PHILIPPINES-SAMAR ISLAND: 21/04/1995 00:34:46,Earthquake mag: 7.2; Max water height (m): 0.2; Magnitude (Iida): -3.3Deaths: NA,1995-04-21,1995-04-21,1,DOI:10.7289/V5PN93H7,2023-02-02
List of tsunamis,PHILIPPINES-SAMAR ISLAND: 21/04/1995 05:17:1.3,Earthquake mag: 6.8; Max water height (m): 0.2; Magnitude (Iida): -2.3Deaths: NA,1995-04-21,1995-04-21,0,DOI:10.7289/V5PN93H7,2023-02-02
List of tsunamis,GREECE-GREECE: 13/05/1995 08:47:12.7,Earthquake mag: 6.6; Max water height (m): NA; Magnitude (Iida): NADeaths: NA,1995-05-13,1995-05-13,1,DOI:10.7289/V5PN93H7,2023-02-02
List of tsunamis,INDONESIA-TIMOR SEA: 14/05/1995 11:33:21.1,Earthquake mag: 6.9; Max water height (m): 4; Magnitude (Iida): 2Deaths: 11,1995-05-14,1995-05-14,2,DOI:10.7289/V5PN93H7,2023-02-02
List of tsunamis,NEW CALEDONIA-LOYALTY ISLANDS: 16/05/1995 20:12:44.2,Earthquake mag: 7.7; Max water height (m): 0.5; Magnitude (Iida): -1.3Deaths: NA,1995-05-16,1995-05-16,9,DOI:10.7289/V5PN93H7,2023-02-02
List of tsunamis,RUSSIA-SAKHALIN ISLAND: 27/05/1995 13:03:52.6,Earthquake mag: 7.1; Max water height (m): 0.1; Magnitude (Iida): -2.3Deaths: NA,1995-05-27,1995-05-27,2,DOI:10.7289/V5PN93H7,2023-02-02
List of tsunamis,GREECE-GULF OF CORINTH: AIYION: 15/06/1995 00:15:48.7,Earthquake mag: 6.5; Max water height (m): 1; Magnitude (Iida): -1Deaths: NA,1995-06-15,1995-06-15,2,DOI:10.7289/V5PN93H7,2023-02-02
List of tsunamis,CHILE-NORTHERN CHILE: 30/07/1995 05:11:23.6,Earthquake mag: 8; Max water height (m): 3; Magnitude (Iida): 1.6Deaths: NA,1995-07-30,1995-07-30,91,DOI:10.7289/V5PN93H7,2023-02-02
List of tsunamis,PAPUA NEW GUINEA-SOLOMON SEA: 16/08/1995 10:27:28.6,Earthquake mag: 7.7; Max water height (m): 0.28; Magnitude (Iida): -1Deaths: NA,1995-08-16,1995-08-16,2,DOI:10.7289/V5PN93H7,2023-02-02
List of tsunamis,MEXICO-S. MEXICO: 14/09/1995 14:04:31.4,Earthquake mag: 7.4; Max water height (m): 0.4; Magnitude (Iida): -1.3Deaths: NA,1995-09-14,1995-09-14,1,DOI:10.7289/V5PN93H7,2023-02-02
List of tsunamis,MEXICO-S. MEXICO: 09/10/1995 15:35:53.9,Earthquake mag: 8; Max water height (m): 11; Magnitude (Iida): 2.3Deaths: 1,1995-10-09,1995-10-09,34,DOI:10.7289/V5PN93H7,2023-02-02
List of tsunamis,JAPAN-RYUKYU ISLANDS: 18/10/1995 10:37:26.3,Earthquake mag: 7.1; Max water height (m): 2.59; Magnitude (Iida): 0.8Deaths: NA,1995-10-18,1995-10-18,42,DOI:10.7289/V5PN93H7,2023-02-02
List of tsunamis,JAPAN-RYUKYU ISLANDS: 19/10/1995 02:41:36.1,Earthquake mag: 6.8; Max water height (m): 1.5; Magnitude (Iida): 0.6Deaths: NA,1995-10-19,1995-10-19,16,DOI:10.7289/V5PN93H7,2023-02-02
List of tsunamis,CHILE-NORTHERN CHILE: 01/11/1995 00:35:32.7,Earthquake mag: 6.7; Max water height (m): 0.07; Magnitude (Iida): -3.3Deaths: NA,1995-11-01,1995-11-01,1,DOI:10.7289/V5PN93H7,2023-02-02
List of tsunamis,EGYPT-GULF OF ELAT-AQABA: 22/11/1995 04:15:11.9,Earthquake mag: 7.2; Max water height (m): 4; Magnitude (Iida): NADeaths: NA,1995-11-22,1995-11-22,7,DOI:10.7289/V5PN93H7,2023-02-02
List of tsunamis,RUSSIA-S. KURIL ISLANDS: 03/12/1995 18:01:8.9,Earthquake mag: 7.9; Max water height (m): 1.1; Magnitude (Iida): 0.1Deaths: NA,1995-12-03,1995-12-03,37,DOI:10.7289/V5PN93H7,2023-02-02
List of tsunamis,INDONESIA-SULAWESI: 01/01/1996 08:05:10.8,Earthquake mag: 7.9; Max water height (m): 3.43; Magnitude (Iida): 2.3Deaths: 9,1996-01-01,1996-01-01,16,DOI:10.7289/V5PN93H7,2023-02-02
List of tsunamis,GREECE-W. CORINTH GULF: 01/01/1996 NA:NA:NA,Earthquake mag: NA; Max water height (m): 2; Magnitude (Iida): NADeaths: NA,1996-01-01,1996-01-01,1,DOI:10.7289/V5PN93H7,2023-02-02
List of tsunamis,"RUSSIA-KARYMSKOYE, KAMCHATKA, RUSSIA: 02/01/1996 15:40:NA",Earthquake mag: NA; Max water height (m): 30; Magnitude (Iida): NADeaths: NA,1996-01-02,1996-01-02,1,DOI:10.7289/V5PN93H7,2023-02-02
List of tsunamis,INDONESIA-IRIAN JAYA: 17/02/1996 05:59:30.5,Earthquake mag: 8.2; Max water height (m): 7.7; Magnitude (Iida): 2.9Deaths: 110,1996-02-17,1996-02-17,115,DOI:10.7289/V5PN93H7,2023-02-02
List of tsunamis,PERU-N. PERU: 21/02/1996 12:51:1.3,Earthquake mag: 7.5; Max water height (m): 5.04; Magnitude (Iida): 2.3Deaths: 12,1996-02-21,1996-02-21,59,DOI:10.7289/V5PN93H7,2023-02-02
List of tsunamis,MEXICO-MEXICO: 25/02/1996 03:08:15.8,Earthquake mag: 7.1; Max water height (m): 0.1; Magnitude (Iida): -3.3Deaths: NA,1996-02-25,1996-02-25,1,DOI:10.7289/V5PN93H7,2023-02-02
List of tsunamis,SWITZERLAND-LAKE BRIENZ: 24/04/1996 08:00:NA,Earthquake mag: NA; Max water height (m): 0.5; Magnitude (Iida): NADeaths: NA,1996-04-24,1996-04-24,0,DOI:10.7289/V5PN93H7,2023-02-02
List of tsunamis,"USA-ANDREANOF ISLANDS, AK: 10/06/1996 04:03:35.4",Earthquake mag: 7.9; Max water height (m): 0.51; Magnitude (Iida): NADeaths: NA,1996-06-10,1996-06-10,64,DOI:10.7289/V5PN93H7,2023-02-02
List of tsunamis,"USA-ANDREANOF ISLANDS, AK: 10/06/1996 15:24:56",Earthquake mag: 7.3; Max water height (m): 0.18; Magnitude (Iida): -3.3Deaths: NA,1996-06-10,1996-06-10,1,DOI:10.7289/V5PN93H7,2023-02-02
List of tsunamis,JAPAN-HONSHU ISLAND: 04/09/1996 18:16:1.9,Earthquake mag: 5.7; Max water height (m): 0.3; Magnitude (Iida): -2.3Deaths: NA,1996-09-04,1996-09-04,14,DOI:10.7289/V5PN93H7,2023-02-02
List of tsunamis,CHILE-EASTER ISLAND REGION: 05/09/1996 08:14:14.4,Earthquake mag: 6.9; Max water height (m): 0.09; Magnitude (Iida): -3.3Deaths: NA,1996-09-05,1996-09-05,2,DOI:10.7289/V5PN93H7,2023-02-02
List of tsunamis,TAIWAN-TAIWAN REGION: 05/09/1996 23:42:06,Earthquake mag: 6.8; Max water height (m): 0.11; Magnitude (Iida): NADeaths: NA,1996-09-05,1996-09-05,3,DOI:10.7289/V5PN93H7,2023-02-02
List of tsunamis,JAPAN-KYUSHU ISLAND: 18/10/1996 10:50:20.8,Earthquake mag: 6.6; Max water height (m): 0.2; Magnitude (Iida): -2.3Deaths: NA,1996-10-18,1996-10-18,1,DOI:10.7289/V5PN93H7,2023-02-02
List of tsunamis,JAPAN-KYUSHU ISLAND: 19/10/1996 14:44:40.7,Earthquake mag: 6.7; Max water height (m): 0.55; Magnitude (Iida): 0.1Deaths: NA,1996-10-19,1996-10-19,6,DOI:10.7289/V5PN93H7,2023-02-02
List of tsunamis,PERU-S. PERU: 12/11/1996 16:59:44,Earthquake mag: 7.7; Max water height (m): 0.4; Magnitude (Iida): -1.7Deaths: NA,1996-11-12,1996-11-12,3,DOI:10.7289/V5PN93H7,2023-02-02
List of tsunamis,JAPAN-SEA OF JAPAN: 02/12/1996 22:17:59.2,Earthquake mag: 6.7; Max water height (m): 0.2; Magnitude (Iida): -2.3Deaths: NA,1996-12-02,1996-12-02,4,DOI:10.7289/V5PN93H7,2023-02-02
List of tsunamis,NEW CALEDONIA-NEW CALEDONIA: 12/03/1997 NA:NA:NA,Earthquake mag: NA; Max water height (m): 2; Magnitude (Iida): NADeaths: NA,1997-03-12,1997-03-12,1,DOI:10.7289/V5PN93H7,2023-02-02
List of tsunamis,HONDURAS-GULF OF FONSECA: 10/04/1997 NA:NA:NA,Earthquake mag: NA; Max water height (m): 15; Magnitude (Iida): NADeaths: NA,1997-04-10,1997-04-10,1,DOI:10.7289/V5PN93H7,2023-02-02
List of tsunamis,AUSTRALIA-NORFOLK ISLAND: 18/04/1997 NA:NA:NA,Earthquake mag: NA; Max water height (m): NA; Magnitude (Iida): NADeaths: NA,1997-04-18,1997-04-18,1,DOI:10.7289/V5PN93H7,2023-02-02
List of tsunamis,SOLOMON ISLANDS-SANTA CRUZ IS. VANUATU: 21/04/1997 12:02:26.4,Earthquake mag: 7.7; Max water height (m): 3; Magnitude (Iida): -2.3Deaths: NA,1997-04-21,1997-04-21,41,DOI:10.7289/V5PN93H7,2023-02-02
List of tsunamis,VENEZUELA-CARIACO-CUMANA: 09/07/1997 19:24:13.1,Earthquake mag: 7; Max water height (m): NA; Magnitude (Iida): NADeaths: NA,1997-07-09,1997-07-09,1,DOI:10.7289/V5PN93H7,2023-02-02
List of tsunamis,JAPAN-S. OF HONSHU ISLAND: 30/09/1997 06:27:24.7,Earthquake mag: 6.2; Max water height (m): 0.03; Magnitude (Iida): NADeaths: NA,1997-09-30,1997-09-30,1,DOI:10.7289/V5PN93H7,2023-02-02
List of tsunamis,TONGA-TONGA ISLANDS: 14/10/1997 09:53:18.1,Earthquake mag: 7.7; Max water height (m): 0.1; Magnitude (Iida): NADeaths: NA,1997-10-14,1997-10-14,1,DOI:10.7289/V5PN93H7,2023-02-02
List of tsunamis,RUSSIA-KAMCHATKA: 05/12/1997 11:26:54.6,Earthquake mag: 7.8; Max water height (m): 8; Magnitude (Iida): 0.6Deaths: NA,1997-12-05,1997-12-05,18,DOI:10.7289/V5PN93H7,2023-02-02
List of tsunamis,RUSSIA-KAMCHATKA: 14/12/1997 03:30:NA,Earthquake mag: NA; Max water height (m): 8; Magnitude (Iida): 3Deaths: NA,1997-12-14,1997-12-14,1,DOI:10.7289/V5PN93H7,2023-02-02
List of tsunamis,MONTSERRAT-WHITE RIVER VALLEY: 26/12/1997 08:NA:NA,Earthquake mag: NA; Max water height (m): 3; Magnitude (Iida): NADeaths: NA,1997-12-26,1997-12-26,1,DOI:10.7289/V5PN93H7,2023-02-02
List of tsunamis,NORWAY-WESTERN NORWAY: 19/03/1998 18:30:NA,Earthquake mag: NA; Max water height (m): 6; Magnitude (Iida): NADeaths: NA,1998-03-19,1998-03-19,1,DOI:10.7289/V5PN93H7,2023-02-02
List of tsunamis,ANTARCTICA-BALLENY ISLANDS: 25/03/1998 03:12:25,Earthquake mag: 8.1; Max water height (m): 0.01; Magnitude (Iida): NADeaths: NA,1998-03-25,1998-03-25,0,DOI:10.7289/V5PN93H7,2023-02-02
List of tsunamis,TAIWAN-TAIWAN:  SOUTHEAST OF: 03/05/1998 23:30:21.9,Earthquake mag: 7.5; Max water height (m): 0.13; Magnitude (Iida): NADeaths: NA,1998-05-03,1998-05-03,15,DOI:10.7289/V5PN93H7,2023-02-02
List of tsunamis,JAPAN-SANRIKU: 30/05/1998 18:18:15,Earthquake mag: 6.2; Max water height (m): 0.01; Magnitude (Iida): NADeaths: NA,1998-05-30,1998-05-30,0,DOI:10.7289/V5PN93H7,2023-02-02
List of tsunamis,PAPUA NEW GUINEA-PAPUA NEW GUINEA: 17/07/1998 08:49:16.1,Earthquake mag: 7; Max water height (m): 15.03; Magnitude (Iida): NADeaths: 1636,1998-07-17,1998-07-17,93,DOI:10.7289/V5PN93H7,2023-02-02
List of tsunamis,INDONESIA-TALIABU ISLAND: 29/11/1998 14:10:31.9,Earthquake mag: 7.7; Max water height (m): 2.75; Magnitude (Iida): NADeaths: NA,1998-11-29,1998-11-29,1,DOI:10.7289/V5PN93H7,2023-02-02
List of tsunamis,MONTSERRAT-SOUFRIERE HILLS VOLCANO: 20/01/1999 NA:NA:NA,Earthquake mag: NA; Max water height (m): 2; Magnitude (Iida): NADeaths: NA,1999-01-20,1999-01-20,3,DOI:10.7289/V5PN93H7,2023-02-02
List of tsunamis,"TURKEY-KOCAELI, TURKEY: 17/08/1999 00:01:39.1",Earthquake mag: 7.6; Max water height (m): 2.52; Magnitude (Iida): NADeaths: 155,1999-08-17,1999-08-17,26,DOI:10.7289/V5PN93H7,2023-02-02
List of tsunamis,FRENCH POLYNESIA-FATU HIVA: 13/09/1999 NA:NA:NA,Earthquake mag: NA; Max water height (m): 8; Magnitude (Iida): NADeaths: NA,1999-09-13,1999-09-13,9,DOI:10.7289/V5PN93H7,2023-02-02
List of tsunamis,VANUATU-VANUATU ISLANDS: 26/11/1999 13:21:15.5,Earthquake mag: 7.5; Max water height (m): 6.6; Magnitude (Iida): NADeaths: 5,1999-11-26,1999-11-26,53,DOI:10.7289/V5PN93H7,2023-02-02
List of tsunamis,"PHILIPPINES-TAWI-TAWI, PHILIPPINES: 26/01/2000 NA:NA:NA",Earthquake mag: NA; Max water height (m): 20; Magnitude (Iida): NADeaths: NA,2000-01-26,2000-01-26,4,DOI:10.7289/V5PN93H7,2023-02-02
List of tsunamis,GREECE-CRETE: 05/04/2000 04:36:59.8,Earthquake mag: 5.5; Max water height (m): 0.5; Magnitude (Iida): NADeaths: NA,2000-04-05,2000-04-05,1,DOI:10.7289/V5PN93H7,2023-02-02
List of tsunamis,INDONESIA-SULAWESI: 04/05/2000 04:21:16.2,Earthquake mag: 7.6; Max water height (m): 6; Magnitude (Iida): NADeaths: NA,2000-05-04,2000-05-04,2,DOI:10.7289/V5PN93H7,2023-02-02
List of tsunamis,AUSTRALIA-SOUTH INDIAN OCEAN: 18/06/2000 14:44:13.3,Earthquake mag: 7.9; Max water height (m): 0.3; Magnitude (Iida): NADeaths: NA,2000-06-18,2000-06-18,1,DOI:10.7289/V5PN93H7,2023-02-02
List of tsunamis,"JAPAN-KOZU-SHIMA ISLAND, HONSHU: 01/07/2000 07:01:55.5",Earthquake mag: 6.1; Max water height (m): 0.07; Magnitude (Iida): NADeaths: NA,2000-07-01,2000-07-01,4,DOI:10.7289/V5PN93H7,2023-02-02
List of tsunamis,JAPAN-HONSHU: S COAST: 15/07/2000 01:30:30.5,Earthquake mag: 6.1; Max water height (m): 0.07; Magnitude (Iida): NADeaths: NA,2000-07-15,2000-07-15,1,DOI:10.7289/V5PN93H7,2023-02-02
List of tsunamis,JAPAN-HONSHU: S COAST: 30/07/2000 12:25:45.5,Earthquake mag: 6.5; Max water height (m): 0.14; Magnitude (Iida): NADeaths: NA,2000-07-30,2000-07-30,1,DOI:10.7289/V5PN93H7,2023-02-02
List of tsunamis,"USA-POINT ARGUELLO, S. CALIFORNIA: 04/11/2000 19:30:00",Earthquake mag: NA; Max water height (m): 4.6; Magnitude (Iida): NADeaths: NA,2000-11-04,2000-11-04,1,DOI:10.7289/V5PN93H7,2023-02-02
List of tsunamis,PAPUA NEW GUINEA-BISMARCK SEA: 16/11/2000 04:54:55.9,Earthquake mag: 8; Max water height (m): 3; Magnitude (Iida): NADeaths: NA,2000-11-16,2000-11-16,9,DOI:10.7289/V5PN93H7,2023-02-02
List of tsunamis,"GREENLAND-PAATUUT, GREENLAND: 21/11/2000 18:04:50",Earthquake mag: NA; Max water height (m): 50; Magnitude (Iida): NADeaths: NA,2000-11-21,2000-11-21,4,DOI:10.7289/V5PN93H7,2023-02-02
List of tsunamis,RUSSIA-KERCH STRAIT: NA/NA/2000 NA:NA:NA,Earthquake mag: NA; Max water height (m): NA; Magnitude (Iida): NADeaths: NA,,,0,DOI:10.7289/V5PN93H7,2023-02-02
List of tsunamis,EL SALVADOR-EL SALVADOR: 13/01/2001 17:33:32.3,Earthquake mag: 7.7; Max water height (m): 0.25; Magnitude (Iida): NADeaths: NA,2001-01-13,2001-01-13,1,DOI:10.7289/V5PN93H7,2023-02-02
List of tsunamis,PERU-S. PERU: 23/06/2001 20:33:14.1,Earthquake mag: 8.4; Max water height (m): 8.8; Magnitude (Iida): NADeaths: 26,2001-06-23,2001-06-23,152,DOI:10.7289/V5PN93H7,2023-02-02
List of tsunamis,CANADA-QUEEN CHARLOTTE ISLANDS: 12/10/2001 05:02:34,Earthquake mag: 6.1; Max water height (m): 0.11; Magnitude (Iida): NADeaths: NA,2001-10-12,2001-10-12,4,DOI:10.7289/V5PN93H7,2023-02-02
List of tsunamis,TAIWAN-TAIWAN: 18/12/2001 04:02:58.2,Earthquake mag: 6.8; Max water height (m): 0.16; Magnitude (Iida): NADeaths: NA,2001-12-18,2001-12-18,6,DOI:10.7289/V5PN93H7,2023-02-02
List of tsunamis,VANUATU-VANUATU ISLANDS: 02/01/2002 17:22:48.7,Earthquake mag: 7.2; Max water height (m): 3; Magnitude (Iida): -4.64Deaths: NA,2002-01-02,2002-01-02,2,DOI:10.7289/V5PN93H7,2023-02-02
List of tsunamis,"PHILIPPINES-MINDANAO ISLAND, PHILIPPINES: 05/03/2002 21:16:9.1",Earthquake mag: 7.5; Max water height (m): 3; Magnitude (Iida): NADeaths: NA,2002-03-05,2002-03-05,3,DOI:10.7289/V5PN93H7,2023-02-02
List of tsunamis,GREECE-DODECANESE ISLANDS: 24/03/2002 NA:NA:NA,Earthquake mag: NA; Max water height (m): 4; Magnitude (Iida): NADeaths: NA,2002-03-24,2002-03-24,1,DOI:10.7289/V5PN93H7,2023-02-02
List of tsunamis,JAPAN-JAPAN: 26/03/2002 03:45:48.7,Earthquake mag: 6.4; Max water height (m): 0.05; Magnitude (Iida): NADeaths: NA,2002-03-26,2002-03-26,3,DOI:10.7289/V5PN93H7,2023-02-02
List of tsunamis,TAIWAN-TAIWAN: 31/03/2002 06:52:50.4,Earthquake mag: 7.1; Max water height (m): 0.2; Magnitude (Iida): NADeaths: NA,2002-03-31,2002-03-31,11,DOI:10.7289/V5PN93H7,2023-02-02
List of tsunamis,PAPUA NEW GUINEA-BISMARCK SEA: 08/09/2002 18:44:25.5,Earthquake mag: 7.6; Max water height (m): 5.5; Magnitude (Iida): 0.58Deaths: NA,2002-09-08,2002-09-08,88,DOI:10.7289/V5PN93H7,2023-02-02
List of tsunamis,"INDIA-ANDAMAN ISLANDS, INDIA: 13/09/2002 22:28:29.4",Earthquake mag: 6.5; Max water height (m): NA; Magnitude (Iida): NADeaths: NA,2002-09-13,2002-09-13,4,DOI:10.7289/V5PN93H7,2023-02-02
List of tsunamis,INDONESIA-IRIAN JAYA: 10/10/2002 10:50:20.5,Earthquake mag: 7.6; Max water height (m): 5; Magnitude (Iida): 2.32Deaths: NA,2002-10-10,2002-10-10,3,DOI:10.7289/V5PN93H7,2023-02-02
List of tsunamis,NEW ZEALAND-ALBERT TOWN: 04/11/2002 NA:NA:NA,Earthquake mag: NA; Max water height (m): NA; Magnitude (Iida): NADeaths: NA,2002-11-04,2002-11-04,1,DOI:10.7289/V5PN93H7,2023-02-02
List of tsunamis,ITALY-STROMBOLI ISLAND: 30/12/2002 12:15:NA,Earthquake mag: NA; Max water height (m): 10.9; Magnitude (Iida): NADeaths: NA,2002-12-30,2002-12-30,41,DOI:10.7289/V5PN93H7,2023-02-02
List of tsunamis,SOLOMON ISLANDS-SOLOMON ISLANDS: 20/01/2003 08:43:06,Earthquake mag: 7.3; Max water height (m): 2; Magnitude (Iida): NADeaths: NA,2003-01-20,2003-01-20,2,DOI:10.7289/V5PN93H7,2023-02-02
List of tsunamis,MEXICO-S. MEXICO: 22/01/2003 02:06:34.6,Earthquake mag: 7.5; Max water height (m): 0.61; Magnitude (Iida): NADeaths: NA,2003-01-22,2003-01-22,6,DOI:10.7289/V5PN93H7,2023-02-02
List of tsunamis,ALGERIA-N. ALGERIA: 21/05/2003 18:44:20.1,Earthquake mag: 6.8; Max water height (m): 3; Magnitude (Iida): 1Deaths: NA,2003-05-21,2003-05-21,39,DOI:10.7289/V5PN93H7,2023-02-02
List of tsunamis,ALGERIA-ALGIERS: 27/05/2003 17:11:28.8,Earthquake mag: 5.7; Max water height (m): 0.08; Magnitude (Iida): NADeaths: NA,2003-05-27,2003-05-27,2,DOI:10.7289/V5PN93H7,2023-02-02
List of tsunamis,MONTSERRAT-SOUFRIERE HILLS VOLCANO: 12/07/2003 NA:NA:NA,Earthquake mag: NA; Max water height (m): 4; Magnitude (Iida): NADeaths: NA,2003-07-12,2003-07-12,5,DOI:10.7289/V5PN93H7,2023-02-02
List of tsunamis,ANTARCTICA-SCOTIA SEA: 04/08/2003 04:37:20.1,Earthquake mag: 7.6; Max water height (m): NA; Magnitude (Iida): NADeaths: NA,2003-08-04,2003-08-04,1,DOI:10.7289/V5PN93H7,2023-02-02
List of tsunamis,GREECE-IONIAN SEA: 14/08/2003 05:14:54.7,Earthquake mag: 6.3; Max water height (m): 0.5; Magnitude (Iida): NADeaths: NA,2003-08-14,2003-08-14,1,DOI:10.7289/V5PN93H7,2023-02-02
List of tsunamis,NEW ZEALAND-SOUTH ISLAND: 21/08/2003 12:12:49.7,Earthquake mag: 7.2; Max water height (m): 0.15; Magnitude (Iida): NADeaths: NA,2003-08-21,2003-08-21,2,DOI:10.7289/V5PN93H7,2023-02-02
List of tsunamis,JAPAN-HOKKAIDO ISLAND: 25/09/2003 19:50:6.3,Earthquake mag: 8.3; Max water height (m): 4.4; Magnitude (Iida): NADeaths: 2,2003-09-25,2003-09-25,268,DOI:10.7289/V5PN93H7,2023-02-02
List of tsunamis,JAPAN-E. HONSHU ISLAND: 31/10/2003 01:06:28.2,Earthquake mag: 7; Max water height (m): 0.32; Magnitude (Iida): NADeaths: NA,2003-10-31,2003-10-31,4,DOI:10.7289/V5PN93H7,2023-02-02
List of tsunamis,"USA-RAT ISLANDS, ALEUTIAN ISLANDS, AK: 17/11/2003 06:43:6.8",Earthquake mag: 7.8; Max water height (m): 0.33; Magnitude (Iida): NADeaths: NA,2003-11-17,2003-11-17,20,DOI:10.7289/V5PN93H7,2023-02-02
List of tsunamis,NEW CALEDONIA-LOYALTY ISLANDS: 27/12/2003 16:00:59,Earthquake mag: 7.3; Max water height (m): 0.15; Magnitude (Iida): NADeaths: NA,2003-12-27,2003-12-27,2,DOI:10.7289/V5PN93H7,2023-02-02
List of tsunamis,INDONESIA-SERAM ISLAND: 28/01/2004 22:15:30.7,Earthquake mag: 6.7; Max water height (m): NA; Magnitude (Iida): NADeaths: NA,2004-01-28,2004-01-28,1,DOI:10.7289/V5PN93H7,2023-02-02
List of tsunamis,JORDAN-DEAD SEA: 11/02/2004 08:15:3.8,Earthquake mag: 5.3; Max water height (m): 1; Magnitude (Iida): NADeaths: NA,2004-02-11,2004-02-11,1,DOI:10.7289/V5PN93H7,2023-02-02
List of tsunamis,FRANCE-MARSEILLES: 24/08/2004 NA:NA:NA,Earthquake mag: NA; Max water height (m): NA; Magnitude (Iida): NADeaths: NA,2004-08-24,2004-08-24,1,DOI:10.7289/V5PN93H7,2023-02-02
List of tsunamis,JAPAN-SOUTH COAST HONSHU ISLAND: 05/09/2004 10:07:7.8,Earthquake mag: 7.2; Max water height (m): 0.63; Magnitude (Iida): NADeaths: NA,2004-09-05,2004-09-05,12,DOI:10.7289/V5PN93H7,2023-02-02
List of tsunamis,JAPAN-SOUTH COAST HONSHU ISLAND: 05/09/2004 14:57:18.6,Earthquake mag: 7.4; Max water height (m): 0.93; Magnitude (Iida): NADeaths: NA,2004-09-05,2004-09-05,24,DOI:10.7289/V5PN93H7,2023-02-02
List of tsunamis,CANADA-VANCOUVER ISLAND: 02/11/2004 10:02:12.8,Earthquake mag: 6.6; Max water height (m): 0.06; Magnitude (Iida): NADeaths: NA,2004-11-02,2004-11-02,2,DOI:10.7289/V5PN93H7,2023-02-02
List of tsunamis,INDONESIA-KEPULAUAN ALOR: 11/11/2004 21:26:41.1,Earthquake mag: 7.5; Max water height (m): 2; Magnitude (Iida): NADeaths: NA,2004-11-11,2004-11-11,3,DOI:10.7289/V5PN93H7,2023-02-02
List of tsunamis,"GUADELOUPE (FRENCH TERRITORY)-BASSE-TERRE, LES SAINTES: 21/11/2004 11:41:7.7",Earthquake mag: 6.3; Max water height (m): 2; Magnitude (Iida): NADeaths: NA,2004-11-21,2004-11-21,9,DOI:10.7289/V5PN93H7,2023-02-02
List of tsunamis,NEW ZEALAND-PUYSEGUR TRENCH: 22/11/2004 20:26:23.9,Earthquake mag: 7.1; Max water height (m): NA; Magnitude (Iida): NADeaths: NA,2004-11-22,2004-11-22,1,DOI:10.7289/V5PN93H7,2023-02-02
List of tsunamis,JAPAN-HOKKAIDO ISLAND: 28/11/2004 18:32:14.1,Earthquake mag: 7; Max water height (m): 0.12; Magnitude (Iida): NADeaths: NA,2004-11-28,2004-11-28,2,DOI:10.7289/V5PN93H7,2023-02-02
List of tsunamis,AUSTRALIA-MACQUARIE ISLAND: 23/12/2004 14:59:4.4,Earthquake mag: 8.1; Max water height (m): 0.3; Magnitude (Iida): NADeaths: NA,2004-12-23,2004-12-23,4,DOI:10.7289/V5PN93H7,2023-02-02
List of tsunamis,INDONESIA-OFF W. COAST OF SUMATRA: 26/12/2004 00:58:53.4,Earthquake mag: 9.1; Max water height (m): 50.9; Magnitude (Iida): NADeaths: 227899,2004-12-26,2004-12-26,1715,DOI:10.7289/V5PN93H7,2023-02-02
List of tsunamis,JAPAN-E. HONSHU ISLAND: 19/01/2005 06:11:36.4,Earthquake mag: 6.6; Max water height (m): 0.39; Magnitude (Iida): NADeaths: NA,2005-01-19,2005-01-19,11,DOI:10.7289/V5PN93H7,2023-02-02
List of tsunamis,GUADELOUPE (FRENCH TERRITORY)-DOMINICA PASSAGE: 14/02/2005 18:05:59.3,Earthquake mag: 5.8; Max water height (m): NA; Magnitude (Iida): NADeaths: NA,2005-02-14,2005-02-14,2,DOI:10.7289/V5PN93H7,2023-02-02
List of tsunamis,INDONESIA-INDONESIA: 28/03/2005 16:09:36.5,Earthquake mag: 8.6; Max water height (m): 4.2; Magnitude (Iida): NADeaths: 10,2005-03-28,2005-03-28,65,DOI:10.7289/V5PN93H7,2023-02-02
List of tsunamis,INDONESIA-KEPULAUAN MENTAWAI: 10/04/2005 10:29:11.2,Earthquake mag: 6.7; Max water height (m): 0.4; Magnitude (Iida): NADeaths: NA,2005-04-10,2005-04-10,1,DOI:10.7289/V5PN93H7,2023-02-02
List of tsunamis,USA-N. CALIFORNIA: 15/06/2005 02:50:53.1,Earthquake mag: 7.2; Max water height (m): 0.1; Magnitude (Iida): NADeaths: NA,2005-06-15,2005-06-15,5,DOI:10.7289/V5PN93H7,2023-02-02
List of tsunamis,JAPAN-E. COAST HONSHU ISLAND: 16/08/2005 02:46:28.4,Earthquake mag: 7.2; Max water height (m): 0.05; Magnitude (Iida): NADeaths: NA,2005-08-16,2005-08-16,1,DOI:10.7289/V5PN93H7,2023-02-02
List of tsunamis,JAPAN-E. COAST HONSHU ISLAND: 14/11/2005 21:38:51.4,Earthquake mag: 7; Max water height (m): 0.42; Magnitude (Iida): NADeaths: NA,2005-11-14,2005-11-14,1,DOI:10.7289/V5PN93H7,2023-02-02
List of tsunamis,CANADA-BRITISH COLUMBIA: 09/12/2005 01:57:NA,Earthquake mag: NA; Max water height (m): 0.08; Magnitude (Iida): NADeaths: NA,2005-12-09,2005-12-09,14,DOI:10.7289/V5PN93H7,2023-02-02
List of tsunamis,JAPAN-S. OF HONSHU ISLAND: 01/01/2006 07:11:57,Earthquake mag: 5.6; Max water height (m): NA; Magnitude (Iida): NADeaths: NA,2006-01-01,2006-01-01,0,DOI:10.7289/V5PN93H7,2023-02-02
List of tsunamis,INDONESIA-SERAM ISLAND: 14/03/2006 06:57:33.8,Earthquake mag: 6.7; Max water height (m): 3.5; Magnitude (Iida): NADeaths: 4,2006-03-14,2006-03-14,1,DOI:10.7289/V5PN93H7,2023-02-02
List of tsunamis,TONGA-TONGA: 03/05/2006 15:26:40.2,Earthquake mag: 8; Max water height (m): 0.27; Magnitude (Iida): NADeaths: NA,2006-05-03,2006-05-03,55,DOI:10.7289/V5PN93H7,2023-02-02
List of tsunamis,MONTSERRAT-SOUFRIERE HILLS VOLCANO: 20/05/2006 11:20:NA,Earthquake mag: NA; Max water height (m): 1; Magnitude (Iida): NADeaths: NA,2006-05-20,2006-05-20,4,DOI:10.7289/V5PN93H7,2023-02-02
List of tsunamis,"SPAIN-CIUTADELLA, MENORCA ISLAND: 15/06/2006 NA:NA:NA",Earthquake mag: NA; Max water height (m): 6; Magnitude (Iida): NADeaths: NA,2006-06-15,2006-06-15,1,DOI:10.7289/V5PN93H7,2023-02-02
List of tsunamis,INDONESIA-SOUTH OF JAVA: 17/07/2006 08:19:28.7,Earthquake mag: 7.7; Max water height (m): 20.9; Magnitude (Iida): NADeaths: 802,2006-07-17,2006-07-17,202,DOI:10.7289/V5PN93H7,2023-02-02
List of tsunamis,SOUTH KOREA-YELLOW SEA: 27/08/2006 NA:NA:NA,Earthquake mag: NA; Max water height (m): NA; Magnitude (Iida): NADeaths: 1,2006-08-27,2006-08-27,1,DOI:10.7289/V5PN93H7,2023-02-02
List of tsunamis,SAMOA-SAMOA ISLANDS: 28/09/2006 06:22:9.7,Earthquake mag: 6.9; Max water height (m): 0.08; Magnitude (Iida): NADeaths: NA,2006-09-28,2006-09-28,1,DOI:10.7289/V5PN93H7,2023-02-02
List of tsunamis,USA-HAWAII: 15/10/2006 17:07:49.2,Earthquake mag: 6.7; Max water height (m): 0.1; Magnitude (Iida): NADeaths: NA,2006-10-15,2006-10-15,1,DOI:10.7289/V5PN93H7,2023-02-02
List of tsunamis,TAIWAN-SOUTH CHINA SEA: 13/11/2006 08:02:44.4,Earthquake mag: 5.2; Max water height (m): 0.15; Magnitude (Iida): NADeaths: NA,2006-11-13,2006-11-13,1,DOI:10.7289/V5PN93H7,2023-02-02
List of tsunamis,RUSSIA-S. KURIL ISLANDS: 15/11/2006 11:14:13.5,Earthquake mag: 8.3; Max water height (m): 21.9; Magnitude (Iida): NADeaths: NA,2006-11-15,2006-11-15,258,DOI:10.7289/V5PN93H7,2023-02-02
List of tsunamis,TAIWAN-TAIWAN: 26/12/2006 12:26:21.4,Earthquake mag: 7; Max water height (m): 0.07; Magnitude (Iida): NADeaths: NA,2006-12-26,2006-12-26,4,DOI:10.7289/V5PN93H7,2023-02-02
List of tsunamis,RUSSIA-S. KURIL ISLANDS: 13/01/2007 04:23:21.1,Earthquake mag: 8.1; Max water height (m): 0.4; Magnitude (Iida): NADeaths: NA,2007-01-13,2007-01-13,38,DOI:10.7289/V5PN93H7,2023-02-02
List of tsunamis,VANUATU-VANUATU ISLANDS: 25/03/2007 00:40:1.6,Earthquake mag: 7.1; Max water height (m): 0.08; Magnitude (Iida): NADeaths: NA,2007-03-25,2007-03-25,2,DOI:10.7289/V5PN93H7,2023-02-02
List of tsunamis,JAPAN-HONSHU: W COAST: 25/03/2007 00:41:57.8,Earthquake mag: 6.7; Max water height (m): 0.1; Magnitude (Iida): NADeaths: NA,2007-03-25,2007-03-25,2,DOI:10.7289/V5PN93H7,2023-02-02
List of tsunamis,SOUTH KOREA-YELLOW SEA: 31/03/2007 NA:NA:NA,Earthquake mag: NA; Max water height (m): 1.65; Magnitude (Iida): NADeaths: 4,2007-03-31,2007-03-31,2,DOI:10.7289/V5PN93H7,2023-02-02
List of tsunamis,SOLOMON ISLANDS-SOLOMON ISLANDS: 01/04/2007 20:39:56.3,Earthquake mag: 8.1; Max water height (m): 12.1; Magnitude (Iida): NADeaths: 50,2007-04-01,2007-04-01,247,DOI:10.7289/V5PN93H7,2023-02-02
List of tsunamis,CHILE-SOUTHERN CHILE: 21/04/2007 17:53:46.3,Earthquake mag: 6.2; Max water height (m): 50; Magnitude (Iida): NADeaths: 8,2007-04-21,2007-04-21,7,DOI:10.7289/V5PN93H7,2023-02-02
List of tsunamis,BULGARIA-BLACK SEA: 07/05/2007 NA:NA:NA,Earthquake mag: NA; Max water height (m): 3; Magnitude (Iida): NADeaths: NA,2007-05-07,2007-05-07,2,DOI:10.7289/V5PN93H7,2023-02-02
List of tsunamis,"PAPUA NEW GUINEA-RITTER ISLAND, PAPUA NEW GUINEA: 19/05/2007 NA:NA:NA",Earthquake mag: NA; Max water height (m): 10; Magnitude (Iida): NADeaths: NA,2007-05-19,2007-05-19,2,DOI:10.7289/V5PN93H7,2023-02-02
List of tsunamis,"CHINA-DAYANTANG, ENSHI: 15/06/2007 NA:NA:NA",Earthquake mag: NA; Max water height (m): 50; Magnitude (Iida): NADeaths: 8,2007-06-15,2007-06-15,8,DOI:10.7289/V5PN93H7,2023-02-02
List of tsunamis,JAPAN-HONSHU: W COAST: 16/07/2007 01:13:22,Earthquake mag: 6.6; Max water height (m): NA; Magnitude (Iida): NADeaths: NA,2007-07-16,2007-07-16,1,DOI:10.7289/V5PN93H7,2023-02-02
List of tsunamis,RUSSIA-TATAR STRAIT: 02/08/2007 02:37:42.3,Earthquake mag: 6.2; Max water height (m): 3.2; Magnitude (Iida): NADeaths: NA,2007-08-02,2007-08-02,18,DOI:10.7289/V5PN93H7,2023-02-02
List of tsunamis,"USA-ALEUTIAN ISLANDS, AK: 02/08/2007 03:21:42.8",Earthquake mag: 6.7; Max water height (m): 0.03; Magnitude (Iida): NADeaths: NA,2007-08-02,2007-08-02,1,DOI:10.7289/V5PN93H7,2023-02-02
List of tsunamis,PERU-S. PERU: 15/08/2007 23:40:57.8,Earthquake mag: 8; Max water height (m): 10.05; Magnitude (Iida): NADeaths: 3,2007-08-15,2007-08-15,135,DOI:10.7289/V5PN93H7,2023-02-02
List of tsunamis,SOLOMON ISLANDS-SANTA CRUZ ISLANDS: 02/09/2007 01:05:18.1,Earthquake mag: 7.2; Max water height (m): 0.05; Magnitude (Iida): NADeaths: NA,2007-09-02,2007-09-02,2,DOI:10.7289/V5PN93H7,2023-02-02
List of tsunamis,INDONESIA-SUMATRA: 12/09/2007 11:10:26.8,Earthquake mag: 8.4; Max water height (m): 5; Magnitude (Iida): NADeaths: NA,2007-09-12,2007-09-12,52,DOI:10.7289/V5PN93H7,2023-02-02
List of tsunamis,NEW ZEALAND-AUCKLAND ISLANDS: 30/09/2007 05:23:34,Earthquake mag: 7.4; Max water height (m): 0.35; Magnitude (Iida): NADeaths: NA,2007-09-30,2007-09-30,8,DOI:10.7289/V5PN93H7,2023-02-02
List of tsunamis,CHILE-NORTHERN CHILE: 14/11/2007 15:40:50.5,Earthquake mag: 7.7; Max water height (m): 0.28; Magnitude (Iida): NADeaths: NA,2007-11-14,2007-11-14,6,DOI:10.7289/V5PN93H7,2023-02-02
List of tsunamis,MARTINIQUE (FRENCH TERRITORY)-MARTINIQUE: 29/11/2007 19:00:20.4,Earthquake mag: 7.4; Max water height (m): NA; Magnitude (Iida): NADeaths: NA,2007-11-29,2007-11-29,0,DOI:10.7289/V5PN93H7,2023-02-02
List of tsunamis,"CANADA-CHEHALIS LAKE, CHILLIWACK: 04/12/2007 NA:NA:NA",Earthquake mag: NA; Max water height (m): 38; Magnitude (Iida): NADeaths: NA,2007-12-04,2007-12-04,1,DOI:10.7289/V5PN93H7,2023-02-02
List of tsunamis,KERMADEC ISLANDS-KERMADEC ISLANDS: 09/12/2007 07:28:20.8,Earthquake mag: 7.8; Max water height (m): 0.03; Magnitude (Iida): NADeaths: NA,2007-12-09,2007-12-09,1,DOI:10.7289/V5PN93H7,2023-02-02
List of tsunamis,INDONESIA-SUMATRA: 25/02/2008 08:36:33,Earthquake mag: 6.5; Max water height (m): 0.12; Magnitude (Iida): NADeaths: NA,2008-02-25,2008-02-25,1,DOI:10.7289/V5PN93H7,2023-02-02
List of tsunamis,NEW CALEDONIA-LOYALTY ISLANDS: 09/04/2008 12:46:12.7,Earthquake mag: 7.3; Max water height (m): 0.16; Magnitude (Iida): NADeaths: NA,2008-04-09,2008-04-09,1,DOI:10.7289/V5PN93H7,2023-02-02
List of tsunamis,VANUATU-VANUATU ISLANDS: 28/04/2008 18:33:34.2,Earthquake mag: 6.4; Max water height (m): 0.03; Magnitude (Iida): NADeaths: NA,2008-04-28,2008-04-28,2,DOI:10.7289/V5PN93H7,2023-02-02
List of tsunamis,SOUTH KOREA-YELLOW SEA: 04/05/2008 NA:NA:NA,Earthquake mag: NA; Max water height (m): 1.3; Magnitude (Iida): NADeaths: 9,2008-05-04,2008-05-04,2,DOI:10.7289/V5PN93H7,2023-02-02
List of tsunamis,CHINA-SICHUAN PROVINCE: 12/05/2008 06:28:0.5,Earthquake mag: 7.9; Max water height (m): NA; Magnitude (Iida): NADeaths: NA,2008-05-12,2008-05-12,1,DOI:10.7289/V5PN93H7,2023-02-02
List of tsunamis,JAPAN-OFF EAST COAST OF HONSHU ISLAND: 19/07/2008 02:39:28.7,Earthquake mag: 6.9; Max water height (m): 0.2; Magnitude (Iida): NADeaths: NA,2008-07-19,2008-07-19,3,DOI:10.7289/V5PN93H7,2023-02-02
List of tsunamis,"USA-KASATOCHI VOLCANO, ALEUTIAN IS, AK: 08/08/2008 NA:NA:NA",Earthquake mag: NA; Max water height (m): 0.19; Magnitude (Iida): NADeaths: NA,2008-08-08,2008-08-08,2,DOI:10.7289/V5PN93H7,2023-02-02
List of tsunamis,SOUTH AFRICA-SOUTHERN ATLANTIC OCEAN: 20/08/2008 23:00:00,Earthquake mag: NA; Max water height (m): 2.55; Magnitude (Iida): NADeaths: NA,2008-08-20,2008-08-20,2,DOI:10.7289/V5PN93H7,2023-02-02
List of tsunamis,JAPAN-HOKKAIDO ISLAND: 11/09/2008 00:20:50.9,Earthquake mag: 6.8; Max water height (m): 0.09; Magnitude (Iida): NADeaths: NA,2008-09-11,2008-09-11,1,DOI:10.7289/V5PN93H7,2023-02-02
List of tsunamis,USA-MAINE: 28/10/2008 NA:NA:NA,Earthquake mag: NA; Max water height (m): 3.6; Magnitude (Iida): NADeaths: NA,2008-10-28,2008-10-28,5,DOI:10.7289/V5PN93H7,2023-02-02
List of tsunamis,INDONESIA-SULAWESI: 16/11/2008 17:02:32.7,Earthquake mag: 7.3; Max water height (m): 0.13; Magnitude (Iida): NADeaths: NA,2008-11-16,2008-11-16,3,DOI:10.7289/V5PN93H7,2023-02-02
List of tsunamis,"CHINA-WU GORGE, WUSHAN COUNTY: 23/11/2008 NA:NA:NA",Earthquake mag: NA; Max water height (m): 13.1; Magnitude (Iida): NADeaths: NA,2008-11-23,2008-11-23,1,DOI:10.7289/V5PN93H7,2023-02-02
List of tsunamis,INDONESIA-NEAR NORTH COAST: 03/01/2009 19:43:50.6,Earthquake mag: 7.6; Max water height (m): 0.39; Magnitude (Iida): NADeaths: NA,2009-01-03,2009-01-03,24,DOI:10.7289/V5PN93H7,2023-02-02
List of tsunamis,INDONESIA-NEAR NORTH COAST: 03/01/2009 22:33:40.2,Earthquake mag: 7.3; Max water height (m): NA; Magnitude (Iida): NADeaths: NA,2009-01-03,2009-01-03,0,DOI:10.7289/V5PN93H7,2023-02-02
List of tsunamis,RUSSIA-KAMCHATKA: 15/01/2009 17:49:39,Earthquake mag: 7.4; Max water height (m): 0.11; Magnitude (Iida): NADeaths: NA,2009-01-15,2009-01-15,11,DOI:10.7289/V5PN93H7,2023-02-02
List of tsunamis,"USA-COLUMBIA RIVER VALLEY, WA: 16/01/2009 NA:NA:NA",Earthquake mag: NA; Max water height (m): 9; Magnitude (Iida): NADeaths: NA,2009-01-16,2009-01-16,1,DOI:10.7289/V5PN93H7,2023-02-02
List of tsunamis,INDONESIA-CELEBES SEA: 11/02/2009 17:34:50.8,Earthquake mag: 7.2; Max water height (m): 0.13; Magnitude (Iida): NADeaths: NA,2009-02-11,2009-02-11,1,DOI:10.7289/V5PN93H7,2023-02-02
List of tsunamis,EAST CHINA SEA-E. CHINA SEA-S.JAPAN: 24/02/2009 NA:NA:NA,Earthquake mag: NA; Max water height (m): 1.45; Magnitude (Iida): NADeaths: NA,2009-02-24,2009-02-24,6,DOI:10.7289/V5PN93H7,2023-02-02
List of tsunamis,TONGA-TONGA: 19/03/2009 18:17:40.9,Earthquake mag: 7.6; Max water height (m): 0.15; Magnitude (Iida): NADeaths: NA,2009-03-19,2009-03-19,27,DOI:10.7289/V5PN93H7,2023-02-02
List of tsunamis,HONDURAS-OFF COAST OF HONDURAS: 28/05/2009 08:24:45,Earthquake mag: 7.3; Max water height (m): 4; Magnitude (Iida): NADeaths: NA,2009-05-28,2009-05-28,2,DOI:10.7289/V5PN93H7,2023-02-02
List of tsunamis,GREECE-CRETE: 01/07/2009 09:30:10.4,Earthquake mag: 6.4; Max water height (m): 0.3; Magnitude (Iida): NADeaths: NA,2009-07-01,2009-07-01,3,DOI:10.7289/V5PN93H7,2023-02-02
List of tsunamis,NEW ZEALAND-OFF WEST COAST OF SOUTH ISLAND: 15/07/2009 09:22:29,Earthquake mag: 7.8; Max water height (m): 0.47; Magnitude (Iida): NADeaths: NA,2009-07-15,2009-07-15,9,DOI:10.7289/V5PN93H7,2023-02-02
List of tsunamis,INDIA-ANDAMAN ISLANDS: 10/08/2009 19:55:35.6,Earthquake mag: 7.5; Max water height (m): 0.01; Magnitude (Iida): NADeaths: NA,2009-08-10,2009-08-10,1,DOI:10.7289/V5PN93H7,2023-02-02
List of tsunamis,JAPAN-HONSHU: S COAST: 10/08/2009 20:07:9.1,Earthquake mag: 6.4; Max water height (m): 0.6; Magnitude (Iida): NADeaths: NA,2009-08-10,2009-08-10,5,DOI:10.7289/V5PN93H7,2023-02-02
List of tsunamis,INDONESIA-SUMATRA: 16/08/2009 07:38:21.7,Earthquake mag: 6.7; Max water height (m): 0.18; Magnitude (Iida): NADeaths: NA,2009-08-16,2009-08-16,1,DOI:10.7289/V5PN93H7,2023-02-02
List of tsunamis,"USA-COLUMBIA RIVER VALLEY, WA: 25/08/2009 NA:NA:NA",Earthquake mag: NA; Max water height (m): NA; Magnitude (Iida): NADeaths: NA,2009-08-25,2009-08-25,1,DOI:10.7289/V5PN93H7,2023-02-02
List of tsunamis,INDONESIA-JAVA SEA: 02/09/2009 07:55:01,Earthquake mag: 7; Max water height (m): 0.4; Magnitude (Iida): NADeaths: NA,2009-09-02,2009-09-02,2,DOI:10.7289/V5PN93H7,2023-02-02
List of tsunamis,SAMOA-SAMOA ISLANDS: 29/09/2009 17:48:10.9,Earthquake mag: 8.1; Max water height (m): 22.35; Magnitude (Iida): NADeaths: 192,2009-09-29,2009-09-29,625,DOI:10.7289/V5PN93H7,2023-02-02
List of tsunamis,INDONESIA-SUMATRA: 30/09/2009 10:16:9.2,Earthquake mag: 7.5; Max water height (m): 0.27; Magnitude (Iida): NADeaths: NA,2009-09-30,2009-09-30,1,DOI:10.7289/V5PN93H7,2023-02-02
List of tsunamis,VANUATU-VANUATU ISLANDS: 07/10/2009 22:03:14.4,Earthquake mag: 7.6; Max water height (m): 0.29; Magnitude (Iida): NADeaths: NA,2009-10-07,2009-10-07,37,DOI:10.7289/V5PN93H7,2023-02-02
List of tsunamis,SOUTH KOREA-CHEJU (JEJU) STRAIT: 02/01/2010 NA:NA:NA,Earthquake mag: NA; Max water height (m): NA; Magnitude (Iida): NADeaths: 1,2010-01-02,2010-01-02,0,DOI:10.7289/V5PN93H7,2023-02-02
List of tsunamis,SOLOMON ISLANDS-SOLOMON ISLANDS: 03/01/2010 21:48:5.3,Earthquake mag: 6.6; Max water height (m): 0.01; Magnitude (Iida): NADeaths: NA,2010-01-03,2010-01-03,1,DOI:10.7289/V5PN93H7,2023-02-02
List of tsunamis,SOLOMON ISLANDS-SOLOMON ISLANDS: 03/01/2010 22:36:27.9,Earthquake mag: 7.1; Max water height (m): 7.52; Magnitude (Iida): NADeaths: NA,2010-01-03,2010-01-03,51,DOI:10.7289/V5PN93H7,2023-02-02
List of tsunamis,SOLOMON ISLANDS-SOLOMON ISLANDS: 05/01/2010 12:15:32.2,Earthquake mag: 6.8; Max water height (m): 0.03; Magnitude (Iida): NADeaths: NA,2010-01-05,2010-01-05,1,DOI:10.7289/V5PN93H7,2023-02-02
List of tsunamis,HAITI-HAITI & DOMINICAN REPUBLIC: 12/01/2010 21:53:10,Earthquake mag: 7; Max water height (m): 3.21; Magnitude (Iida): NADeaths: 7,2010-01-12,2010-01-12,25,DOI:10.7289/V5PN93H7,2023-02-02
List of tsunamis,JAPAN-RYUKYU ISLANDS: 26/02/2010 20:31:26.9,Earthquake mag: 7; Max water height (m): 0.1; Magnitude (Iida): NADeaths: NA,2010-02-26,2010-02-26,2,DOI:10.7289/V5PN93H7,2023-02-02
List of tsunamis,CHILE-CENTRAL CHILE: 27/02/2010 06:34:11.5,Earthquake mag: 8.8; Max water height (m): 29; Magnitude (Iida): NADeaths: 156,2010-02-27,2010-02-27,659,DOI:10.7289/V5PN93H7,2023-02-02
List of tsunamis,CHILE-CENTRAL CHILE: 11/03/2010 14:39:43.9,Earthquake mag: 6.9; Max water height (m): 0.14; Magnitude (Iida): NADeaths: NA,2010-03-11,2010-03-11,2,DOI:10.7289/V5PN93H7,2023-02-02
List of tsunamis,INDONESIA-SUMATRA: 06/04/2010 22:15:1.5,Earthquake mag: 7.8; Max water height (m): 0.44; Magnitude (Iida): NADeaths: NA,2010-04-06,2010-04-06,6,DOI:10.7289/V5PN93H7,2023-02-02
List of tsunamis,"PERU-513 LAKE, HUALCAN GLACIER: 13/04/2010 NA:NA:NA",Earthquake mag: NA; Max water height (m): 23; Magnitude (Iida): NADeaths: 1,2010-04-13,2010-04-13,1,DOI:10.7289/V5PN93H7,2023-02-02
List of tsunamis,"COOK ISLANDS-MANGAIA ISLAND, COOK ISLANDS: 13/04/2010 NA:NA:NA",Earthquake mag: NA; Max water height (m): NA; Magnitude (Iida): NADeaths: NA,2010-04-13,2010-04-13,1,DOI:10.7289/V5PN93H7,2023-02-02
List of tsunamis,"USA TERRITORY-SOUTH OF SARIGAN IS, N. MARIANA IS: 29/05/2010 11:46:50",Earthquake mag: NA; Max water height (m): 0.04; Magnitude (Iida): NADeaths: NA,2010-05-29,2010-05-29,1,DOI:10.7289/V5PN93H7,2023-02-02
List of tsunamis,INDIA-LITTLE NICOBAR ISLAND: 12/06/2010 19:26:50.4,Earthquake mag: 7.5; Max water height (m): 0.03; Magnitude (Iida): NADeaths: NA,2010-06-12,2010-06-12,2,DOI:10.7289/V5PN93H7,2023-02-02
List of tsunamis,VANUATU-VANUATU ISLANDS: 10/08/2010 05:23:44.9,Earthquake mag: 7.2; Max water height (m): 0.23; Magnitude (Iida): NADeaths: NA,2010-08-10,2010-08-10,1,DOI:10.7289/V5PN93H7,2023-02-02
List of tsunamis,"USA TERRITORY-GUAM, MARIANA ISLANDS: 13/08/2010 21:19:33",Earthquake mag: 6.9; Max water height (m): 0.07; Magnitude (Iida): NADeaths: NA,2010-08-13,2010-08-13,1,DOI:10.7289/V5PN93H7,2023-02-02
List of tsunamis,INDONESIA-SUMATRA: 25/10/2010 14:42:22,Earthquake mag: 7.8; Max water height (m): 16.9; Magnitude (Iida): NADeaths: 431,2010-10-25,2010-10-25,358,DOI:10.7289/V5PN93H7,2023-02-02
List of tsunamis,JAPAN-BONIN ISLANDS: 21/12/2010 17:19:40.6,Earthquake mag: 7.4; Max water height (m): 0.13; Magnitude (Iida): NADeaths: NA,2010-12-21,2010-12-21,4,DOI:10.7289/V5PN93H7,2023-02-02
List of tsunamis,VANUATU-VANUATU ISLANDS: 25/12/2010 13:16:37,Earthquake mag: 7.3; Max water height (m): 4.1; Magnitude (Iida): NADeaths: NA,2010-12-25,2010-12-25,12,DOI:10.7289/V5PN93H7,2023-02-02
List of tsunamis,VANUATU-VANUATU ISLANDS: 09/01/2011 10:03:44.2,Earthquake mag: 6.5; Max water height (m): 0.03; Magnitude (Iida): NADeaths: NA,2011-01-09,2011-01-09,1,DOI:10.7289/V5PN93H7,2023-02-02
List of tsunamis,CHILE-CENTRAL CHILE: 11/02/2011 20:05:30.7,Earthquake mag: 6.8; Max water height (m): 0.15; Magnitude (Iida): NADeaths: NA,2011-02-11,2011-02-11,1,DOI:10.7289/V5PN93H7,2023-02-02
List of tsunamis,NORWAY-SVALBARD: 17/02/2011 NA:NA:NA,Earthquake mag: NA; Max water height (m): 0.3; Magnitude (Iida): NADeaths: NA,2011-02-17,2011-02-17,0,DOI:10.7289/V5PN93H7,2023-02-02
List of tsunamis,NEW ZEALAND-SOUTH ISLAND: 21/02/2011 23:51:42.3,Earthquake mag: 6.1; Max water height (m): 3.5; Magnitude (Iida): NADeaths: NA,2011-02-21,2011-02-21,1,DOI:10.7289/V5PN93H7,2023-02-02
List of tsunamis,JAPAN-HONSHU ISLAND: 09/03/2011 02:45:20.3,Earthquake mag: 7.5; Max water height (m): 0.6; Magnitude (Iida): NADeaths: NA,2011-03-09,2011-03-09,11,DOI:10.7289/V5PN93H7,2023-02-02
List of tsunamis,JAPAN-HONSHU ISLAND: 11/03/2011 05:46:24.1,Earthquake mag: 9.1; Max water height (m): 39.26; Magnitude (Iida): NADeaths: 18428,2011-03-11,2011-03-11,6289,DOI:10.7289/V5PN93H7,2023-02-02
List of tsunamis,JAPAN-E. COAST HONSHU ISLAND: 07/04/2011 14:32:43.2,Earthquake mag: 7.1; Max water height (m): 0.08; Magnitude (Iida): NADeaths: NA,2011-04-07,2011-04-07,1,DOI:10.7289/V5PN93H7,2023-02-02
List of tsunamis,NEW CALEDONIA-LOYALTY ISLANDS: 10/05/2011 08:55:09,Earthquake mag: 6.8; Max water height (m): 0.03; Magnitude (Iida): NADeaths: NA,2011-05-10,2011-05-10,1,DOI:10.7289/V5PN93H7,2023-02-02
List of tsunamis,"USA-ATKA, ALEUTIAN ISLANDS, AK: 24/06/2011 03:09:39.4",Earthquake mag: 7.3; Max water height (m): 0.1; Magnitude (Iida): NADeaths: NA,2011-06-24,2011-06-24,7,DOI:10.7289/V5PN93H7,2023-02-02
List of tsunamis,"UK-PLYMOUTH, ENGLAND: 27/06/2011 NA:NA:NA",Earthquake mag: NA; Max water height (m): 0.4; Magnitude (Iida): NADeaths: NA,2011-06-27,2011-06-27,4,DOI:10.7289/V5PN93H7,2023-02-02
List of tsunamis,NEW ZEALAND-KERMADEC ISLANDS: 06/07/2011 19:03:18.2,Earthquake mag: 7.6; Max water height (m): 1.2; Magnitude (Iida): NADeaths: NA,2011-07-06,2011-07-06,24,DOI:10.7289/V5PN93H7,2023-02-02
List of tsunamis,JAPAN-OFF EAST COAST OF HONSHU ISLAND: 10/07/2011 00:57:10.8,Earthquake mag: 7; Max water height (m): 0.09; Magnitude (Iida): NADeaths: NA,2011-07-10,2011-07-10,1,DOI:10.7289/V5PN93H7,2023-02-02
List of tsunamis,"NORWAY-LYSEFJOREN, WESTERN NORWAY: 30/07/2011 05:30:NA",Earthquake mag: NA; Max water height (m): 1.5; Magnitude (Iida): NADeaths: NA,2011-07-30,2011-07-30,1,DOI:10.7289/V5PN93H7,2023-02-02
List of tsunamis,"NORWAY-LYSEFJOREN, WESTERN NORWAY: 06/08/2011 12:55:NA",Earthquake mag: NA; Max water height (m): NA; Magnitude (Iida): NADeaths: NA,2011-08-06,2011-08-06,0,DOI:10.7289/V5PN93H7,2023-02-02
List of tsunamis,VANUATU-VANUATU ISLANDS: 20/08/2011 16:55:2.5,Earthquake mag: 7.1; Max water height (m): 0.19; Magnitude (Iida): NADeaths: NA,2011-08-20,2011-08-20,4,DOI:10.7289/V5PN93H7,2023-02-02
List of tsunamis,VANUATU-VANUATU ISLANDS: 20/08/2011 18:19:23.5,Earthquake mag: 7; Max water height (m): 0.15; Magnitude (Iida): NADeaths: NA,2011-08-20,2011-08-20,1,DOI:10.7289/V5PN93H7,2023-02-02
List of tsunamis,"USA-FOX ISLANDS, ALEUTIAN ISLANDS, AK: 02/09/2011 10:55:53.5",Earthquake mag: 6.8; Max water height (m): 0.06; Magnitude (Iida): NADeaths: NA,2011-09-02,2011-09-02,1,DOI:10.7289/V5PN93H7,2023-02-02
List of tsunamis,NEW ZEALAND-KERMADEC ISLANDS: 21/10/2011 17:57:16.1,Earthquake mag: 7.4; Max water height (m): 0.14; Magnitude (Iida): NADeaths: NA,2011-10-21,2011-10-21,3,DOI:10.7289/V5PN93H7,2023-02-02
List of tsunamis,VANUATU-VANUATU ISLANDS: 02/02/2012 13:34:40.6,Earthquake mag: 7; Max water height (m): 0.08; Magnitude (Iida): NADeaths: NA,2012-02-02,2012-02-02,1,DOI:10.7289/V5PN93H7,2023-02-02
List of tsunamis,VANUATU-OFF EAST COAST OF VANUATU: 09/03/2012 07:09:50.9,Earthquake mag: 6.7; Max water height (m): 0.05; Magnitude (Iida): NADeaths: NA,2012-03-09,2012-03-09,2,DOI:10.7289/V5PN93H7,2023-02-02
List of tsunamis,JAPAN-HOKKAIDO ISLAND: 14/03/2012 09:08:35.1,Earthquake mag: 6.9; Max water height (m): 0.2; Magnitude (Iida): NADeaths: NA,2012-03-14,2012-03-14,2,DOI:10.7289/V5PN93H7,2023-02-02
List of tsunamis,MEXICO-S. MEXICO: 20/03/2012 18:02:47.4,Earthquake mag: 7.4; Max water height (m): 0.2; Magnitude (Iida): NADeaths: NA,2012-03-20,2012-03-20,2,DOI:10.7289/V5PN93H7,2023-02-02
List of tsunamis,INDONESIA-OFF W. COAST OF N SUMATRA: 11/04/2012 08:38:36.7,Earthquake mag: 8.6; Max water height (m): 1.08; Magnitude (Iida): NADeaths: NA,2012-04-11,2012-04-11,25,DOI:10.7289/V5PN93H7,2023-02-02
List of tsunamis,INDONESIA-OFF W. COAST OF N SUMATRA: 11/04/2012 10:43:10.8,Earthquake mag: 8.2; Max water height (m): NA; Magnitude (Iida): NADeaths: NA,2012-04-11,2012-04-11,4,DOI:10.7289/V5PN93H7,2023-02-02
List of tsunamis,VANUATU-VANUATU ISLANDS: 14/04/2012 22:05:26.4,Earthquake mag: 6.3; Max water height (m): NA; Magnitude (Iida): NADeaths: NA,2012-04-14,2012-04-14,1,DOI:10.7289/V5PN93H7,2023-02-02
List of tsunamis,"GREENLAND-ILULISSAT ICEFJORD, GREENLAND: 15/07/2012 NA:NA:NA",Earthquake mag: NA; Max water height (m): NA; Magnitude (Iida): NADeaths: NA,2012-07-15,2012-07-15,0,DOI:10.7289/V5PN93H7,2023-02-02
List of tsunamis,EL SALVADOR-EL SALVADOR-NICARAGUA: 27/08/2012 04:37:19.4,Earthquake mag: 7.3; Max water height (m): 6.3; Magnitude (Iida): NADeaths: NA,2012-08-27,2012-08-27,38,DOI:10.7289/V5PN93H7,2023-02-02
List of tsunamis,PHILIPPINES-PHILIPPINE ISLANDS: 31/08/2012 12:47:33.3,Earthquake mag: 7.6; Max water height (m): 0.15; Magnitude (Iida): NADeaths: NA,2012-08-31,2012-08-31,17,DOI:10.7289/V5PN93H7,2023-02-02
List of tsunamis,COSTA RICA-COSTA RICA: 05/09/2012 14:42:7.8,Earthquake mag: 7.6; Max water height (m): 0.16; Magnitude (Iida): NADeaths: NA,2012-09-05,2012-09-05,4,DOI:10.7289/V5PN93H7,2023-02-02
List of tsunamis,CANADA-BRITISH COLUMBIA: 28/10/2012 03:04:8.8,Earthquake mag: 7.7; Max water height (m): 12.98; Magnitude (Iida): NADeaths: 1,2012-10-28,2012-10-28,178,DOI:10.7289/V5PN93H7,2023-02-02
List of tsunamis,GUATEMALA-GUATEMALA: 07/11/2012 16:35:46.9,Earthquake mag: 7.3; Max water height (m): 0.35; Magnitude (Iida): NADeaths: NA,2012-11-07,2012-11-07,7,DOI:10.7289/V5PN93H7,2023-02-02
List of tsunamis,JAPAN-OFF EAST COAST OF HONSHU ISLAND: 07/12/2012 08:18:23.1,Earthquake mag: 7.2; Max water height (m): 1; Magnitude (Iida): NADeaths: NA,2012-12-07,2012-12-07,3,DOI:10.7289/V5PN93H7,2023-02-02
List of tsunamis,"CHINA-ZHAOJUN BRIDGE, HUBEI PROVINCE: 28/12/2012 NA:NA:NA",Earthquake mag: NA; Max water height (m): NA; Magnitude (Iida): NADeaths: NA,2012-12-28,2012-12-28,0,DOI:10.7289/V5PN93H7,2023-02-02
List of tsunamis,"USA-SE. ALASKA, AK: 05/01/2013 08:58:19.3",Earthquake mag: 7.5; Max water height (m): 1.5; Magnitude (Iida): NADeaths: NA,2013-01-05,2013-01-05,8,DOI:10.7289/V5PN93H7,2023-02-02
List of tsunamis,SOLOMON ISLANDS-SANTA CRUZ ISLANDS: 06/02/2013 01:12:25.8,Earthquake mag: 7.9; Max water height (m): 11; Magnitude (Iida): NADeaths: 10,2013-02-06,2013-02-06,124,DOI:10.7289/V5PN93H7,2023-02-02
List of tsunamis,SOLOMON ISLANDS-SANTA CRUZ ISLANDS: 08/02/2013 15:26:38.4,Earthquake mag: 7; Max water height (m): 0.09; Magnitude (Iida): NADeaths: NA,2013-02-08,2013-02-08,1,DOI:10.7289/V5PN93H7,2023-02-02
List of tsunamis,RUSSIA-S. KURIL ISLANDS: 19/04/2013 03:05:52.6,Earthquake mag: 7.2; Max water height (m): 0.2; Magnitude (Iida): NADeaths: NA,2013-04-19,2013-04-19,1,DOI:10.7289/V5PN93H7,2023-02-02
List of tsunamis,MEXICO-MEXICO: 22/04/2013 01:16:32,Earthquake mag: 6; Max water height (m): 0.13; Magnitude (Iida): NADeaths: NA,2013-04-22,2013-04-22,1,DOI:10.7289/V5PN93H7,2023-02-02
List of tsunamis,USA-NORTHWEST ATLANTIC OCEAN: 13/06/2013 NA:NA:NA,Earthquake mag: NA; Max water height (m): 1.8; Magnitude (Iida): NADeaths: NA,2013-06-13,2013-06-13,38,DOI:10.7289/V5PN93H7,2023-02-02
List of tsunamis,GREECE-CRETE: 15/06/2013 16:11:02,Earthquake mag: 6.2; Max water height (m): 0.01; Magnitude (Iida): NADeaths: NA,2013-06-15,2013-06-15,1,DOI:10.7289/V5PN93H7,2023-02-02
List of tsunamis,NEW ZEALAND-COOK STRAIT: 21/07/2013 05:09:31.4,Earthquake mag: 6.5; Max water height (m): 0.07; Magnitude (Iida): NADeaths: NA,2013-07-21,2013-07-21,2,DOI:10.7289/V5PN93H7,2023-02-02
List of tsunamis,NEW ZEALAND-WELLINGTON: 16/08/2013 02:31:47,Earthquake mag: 6.5; Max water height (m): 0.08; Magnitude (Iida): NADeaths: NA,2013-08-16,2013-08-16,2,DOI:10.7289/V5PN93H7,2023-02-02
List of tsunamis,PAKISTAN-OFF COAST GWADAR: 24/09/2013 NA:NA:NA,Earthquake mag: NA; Max water height (m): 0.57; Magnitude (Iida): NADeaths: NA,2013-09-24,2013-09-24,11,DOI:10.7289/V5PN93H7,2023-02-02
List of tsunamis,GREECE-CRETE: 12/10/2013 13:11:35,Earthquake mag: 6.6; Max water height (m): 0.01; Magnitude (Iida): NADeaths: NA,2013-10-12,2013-10-12,1,DOI:10.7289/V5PN93H7,2023-02-02
List of tsunamis,JAPAN-E. COAST HONSHU ISLAND: 25/10/2013 17:10:00,Earthquake mag: 7.1; Max water height (m): 0.4; Magnitude (Iida): NADeaths: NA,2013-10-25,2013-10-25,9,DOI:10.7289/V5PN93H7,2023-02-02
List of tsunamis,ANTARCTICA-SCOTIA SEA: 17/11/2013 09:04:53,Earthquake mag: 7.7; Max water height (m): 0.15; Magnitude (Iida): NADeaths: NA,2013-11-17,2013-11-17,2,DOI:10.7289/V5PN93H7,2023-02-02
List of tsunamis,CHILE-NORTHERN CHILE: 16/03/2014 21:16:00,Earthquake mag: 6.7; Max water height (m): 0.26; Magnitude (Iida): NADeaths: NA,2014-03-16,2014-03-16,7,DOI:10.7289/V5PN93H7,2023-02-02
List of tsunamis,CHILE-NORTHERN CHILE: 01/04/2014 23:46:26,Earthquake mag: 8.2; Max water height (m): 4.63; Magnitude (Iida): NADeaths: NA,2014-04-01,2014-04-01,201,DOI:10.7289/V5PN93H7,2023-02-02
List of tsunamis,CHILE-NORTHERN CHILE: 03/04/2014 02:43:11,Earthquake mag: 7.7; Max water height (m): 0.74; Magnitude (Iida): NADeaths: NA,2014-04-03,2014-04-03,5,DOI:10.7289/V5PN93H7,2023-02-02
List of tsunamis,SOLOMON ISLANDS-SOLOMON ISLANDS: 12/04/2014 20:14:03,Earthquake mag: 7.6; Max water height (m): 0.05; Magnitude (Iida): NADeaths: NA,2014-04-12,2014-04-12,8,DOI:10.7289/V5PN93H7,2023-02-02
List of tsunamis,SOLOMON ISLANDS-SOLOMON ISLANDS: 13/04/2014 12:36:23,Earthquake mag: 7.4; Max water height (m): 0.16; Magnitude (Iida): NADeaths: NA,2014-04-13,2014-04-13,9,DOI:10.7289/V5PN93H7,2023-02-02
List of tsunamis,MEXICO-S. MEXICO: 18/04/2014 14:28:32,Earthquake mag: 7.2; Max water height (m): 0.43; Magnitude (Iida): NADeaths: NA,2014-04-18,2014-04-18,3,DOI:10.7289/V5PN93H7,2023-02-02
List of tsunamis,PAPUA NEW GUINEA-SOLOMON SEA: 19/04/2014 13:29:21,Earthquake mag: 7.5; Max water height (m): 0.11; Magnitude (Iida): NADeaths: NA,2014-04-19,2014-04-19,1,DOI:10.7289/V5PN93H7,2023-02-02
List of tsunamis,GREECE-NORTH AEGEAN SEA: 24/05/2014 09:25:05,Earthquake mag: 6.9; Max water height (m): 0.16; Magnitude (Iida): NADeaths: NA,2014-05-24,2014-05-24,1,DOI:10.7289/V5PN93H7,2023-02-02
List of tsunamis,"NEW ZEALAND-S OF RAOUL ISLAND, KERMADEC ISLANDS: 23/06/2014 19:20:34",Earthquake mag: 6.9; Max water height (m): 0.13; Magnitude (Iida): NADeaths: NA,2014-06-23,2014-06-23,5,DOI:10.7289/V5PN93H7,2023-02-02
List of tsunamis,"USA-ALEUTIAN ISLANDS, AK: 23/06/2014 20:53:07",Earthquake mag: 7.9; Max water height (m): 0.17; Magnitude (Iida): NADeaths: NA,2014-06-23,2014-06-23,20,DOI:10.7289/V5PN93H7,2023-02-02
List of tsunamis,SPAIN-MEDITERRANEAN AND BLACK SEAS: 23/06/2014 NA:NA:NA,Earthquake mag: NA; Max water height (m): 2.5; Magnitude (Iida): NADeaths: NA,2014-06-23,2014-06-23,5,DOI:10.7289/V5PN93H7,2023-02-02
List of tsunamis,UKRAINE-ODESSA: 27/06/2014 10:37:NA,Earthquake mag: NA; Max water height (m): 2; Magnitude (Iida): NADeaths: NA,2014-06-27,2014-06-27,0,DOI:10.7289/V5PN93H7,2023-02-02
List of tsunamis,"GREENLAND-ILULISSAT ICEFJORD, GREENLAND: 02/07/2014 14:06:NA",Earthquake mag: NA; Max water height (m): 10; Magnitude (Iida): NADeaths: NA,2014-07-02,2014-07-02,1,DOI:10.7289/V5PN93H7,2023-02-02
List of tsunamis,JAPAN-SANRIKU: 11/07/2014 19:23:22,Earthquake mag: 6.5; Max water height (m): 0.2; Magnitude (Iida): NADeaths: NA,2014-07-11,2014-07-11,6,DOI:10.7289/V5PN93H7,2023-02-02
List of tsunamis,ICELAND-ASKJA LAKE: 21/07/2014 23:24:NA,Earthquake mag: NA; Max water height (m): 60; Magnitude (Iida): NADeaths: NA,2014-07-21,2014-07-21,1,DOI:10.7289/V5PN93H7,2023-02-02
List of tsunamis,"USA-PALMA BAY, AK: 25/07/2014 10:55:12",Earthquake mag: 6.1; Max water height (m): 0.08; Magnitude (Iida): NADeaths: NA,2014-07-25,2014-07-25,1,DOI:10.7289/V5PN93H7,2023-02-02
List of tsunamis,CHILE-EASTER ISLAND REGION: 09/10/2014 02:14:44,Earthquake mag: 7; Max water height (m): 0.47; Magnitude (Iida): NADeaths: NA,2014-10-09,2014-10-09,5,DOI:10.7289/V5PN93H7,2023-02-02
List of tsunamis,EL SALVADOR-GULF OF FONSECA: 14/10/2014 03:51:46,Earthquake mag: 7.3; Max water height (m): 0.02; Magnitude (Iida): NADeaths: NA,2014-10-14,2014-10-14,2,DOI:10.7289/V5PN93H7,2023-02-02
List of tsunamis,INDONESIA-N. MOLUCCAS ISLANDS: 15/11/2014 02:32:12,Earthquake mag: 7.1; Max water height (m): 0.09; Magnitude (Iida): NADeaths: NA,2014-11-15,2014-11-15,3,DOI:10.7289/V5PN93H7,2023-02-02
List of tsunamis,JAPAN-HONSHU: 16/02/2015 23:06:27,Earthquake mag: 6.7; Max water height (m): 0.27; Magnitude (Iida): NADeaths: NA,2015-02-16,2015-02-16,3,DOI:10.7289/V5PN93H7,2023-02-02
List of tsunamis,VANUATU-VANUATU ISLANDS: 19/02/2015 13:18:32,Earthquake mag: 6.4; Max water height (m): 8; Magnitude (Iida): NADeaths: NA,2015-02-19,2015-02-19,6,DOI:10.7289/V5PN93H7,2023-02-02
List of tsunamis,PAPUA NEW GUINEA-BISMARCK SEA: 29/03/2015 23:48:01,Earthquake mag: 7.5; Max water height (m): 0.5; Magnitude (Iida): NADeaths: NA,2015-03-29,2015-03-29,2,DOI:10.7289/V5PN93H7,2023-02-02
List of tsunamis,JAPAN-S. OF HONSHU ISLAND: 02/05/2015 16:51:39,Earthquake mag: 5.7; Max water height (m): 0.6; Magnitude (Iida): NADeaths: NA,2015-05-02,2015-05-02,3,DOI:10.7289/V5PN93H7,2023-02-02
List of tsunamis,PAPUA NEW GUINEA-NEW BRITAIN: 05/05/2015 01:44:38,Earthquake mag: 7.5; Max water height (m): 1; Magnitude (Iida): NADeaths: NA,2015-05-05,2015-05-05,1,DOI:10.7289/V5PN93H7,2023-02-02
List of tsunamis,NORWAY-NORTHERN NORWAY: 10/05/2015 NA:NA:NA,Earthquake mag: NA; Max water height (m): NA; Magnitude (Iida): NADeaths: NA,2015-05-10,2015-05-10,0,DOI:10.7289/V5PN93H7,2023-02-02
List of tsunamis,"CHINA-WUSHAN, CHONGQING: 24/06/2015 NA:NA:NA",Earthquake mag: NA; Max water height (m): 6.2; Magnitude (Iida): NADeaths: 2,2015-06-24,2015-06-24,1,DOI:10.7289/V5PN93H7,2023-02-02
List of tsunamis,SCOTLAND-NORTH SEA: 01/07/2015 NA:NA:NA,Earthquake mag: NA; Max water height (m): 0.18; Magnitude (Iida): NADeaths: NA,2015-07-01,2015-07-01,3,DOI:10.7289/V5PN93H7,2023-02-02
List of tsunamis,SOLOMON ISLANDS-SOLOMON ISLANDS: 10/07/2015 04:12:54,Earthquake mag: 6.7; Max water height (m): 0.01; Magnitude (Iida): NADeaths: NA,2015-07-10,2015-07-10,1,DOI:10.7289/V5PN93H7,2023-02-02
List of tsunamis,SOLOMON ISLANDS-SANTA CRUZ ISLANDS: 18/07/2015 02:28:22,Earthquake mag: 7; Max water height (m): 0.09; Magnitude (Iida): NADeaths: NA,2015-07-18,2015-07-18,5,DOI:10.7289/V5PN93H7,2023-02-02
List of tsunamis,"USA-FOX ISLANDS, ALEUTIAN ISLANDS, AK: 27/07/2015 04:49:00",Earthquake mag: 6.9; Max water height (m): 0.08; Magnitude (Iida): NADeaths: NA,2015-07-27,2015-07-27,2,DOI:10.7289/V5PN93H7,2023-02-02
List of tsunamis,CHILE-CENTRAL CHILE: 16/09/2015 22:55:26,Earthquake mag: 8.3; Max water height (m): 13.6; Magnitude (Iida): 8.4Deaths: 8,2015-09-16,2015-09-16,1094,DOI:10.7289/V5PN93H7,2023-02-02
List of tsunamis,"USA-ICY BAY, AK: 18/10/2015 05:19:NA",Earthquake mag: NA; Max water height (m): 193; Magnitude (Iida): NADeaths: NA,2015-10-18,2015-10-18,3,DOI:10.7289/V5PN93H7,2023-02-02
List of tsunamis,CHILE-CENTRAL CHILE: 11/11/2015 01:54:00,Earthquake mag: 6.9; Max water height (m): 0.55; Magnitude (Iida): NADeaths: NA,2015-11-11,2015-11-11,2,DOI:10.7289/V5PN93H7,2023-02-02
List of tsunamis,JAPAN-JAPAN: 13/11/2015 20:51:03,Earthquake mag: 6.7; Max water height (m): 0.3; Magnitude (Iida): NADeaths: NA,2015-11-13,2015-11-13,1,DOI:10.7289/V5PN93H7,2023-02-02
List of tsunamis,GREECE-IONIAN SEA: 17/11/2015 07:10:03,Earthquake mag: 6.5; Max water height (m): 0.15; Magnitude (Iida): NADeaths: NA,2015-11-17,2015-11-17,1,DOI:10.7289/V5PN93H7,2023-02-02
List of tsunamis,SOLOMON ISLANDS-SOLOMON ISLANDS: 18/11/2015 18:31:57,Earthquake mag: 6.8; Max water height (m): 0.1; Magnitude (Iida): NADeaths: NA,2015-11-18,2015-11-18,1,DOI:10.7289/V5PN93H7,2023-02-02
List of tsunamis,MOROCCO-MOROCCO: 25/01/2016 04:23:13,Earthquake mag: 6.3; Max water height (m): 0.02; Magnitude (Iida): NADeaths: NA,2016-01-25,2016-01-25,2,DOI:10.7289/V5PN93H7,2023-02-02
List of tsunamis,INDONESIA-SW. SUMATRA: 02/03/2016 12:49:11,Earthquake mag: 7.8; Max water height (m): 0.21; Magnitude (Iida): NADeaths: NA,2016-03-02,2016-03-02,13,DOI:10.7289/V5PN93H7,2023-02-02
List of tsunamis,ECUADOR-OFF COAST: 16/04/2016 23:58:00,Earthquake mag: 7.8; Max water height (m): 0.6; Magnitude (Iida): NADeaths: NA,2016-04-16,2016-04-16,7,DOI:10.7289/V5PN93H7,2023-02-02
List of tsunamis,VANUATU-VANUATU ISLANDS: 28/04/2016 19:33:07,Earthquake mag: 7; Max water height (m): 0.02; Magnitude (Iida): NADeaths: NA,2016-04-28,2016-04-28,2,DOI:10.7289/V5PN93H7,2023-02-02
List of tsunamis,NEW CALEDONIA-LOYALTY ISLANDS: 12/08/2016 01:26:28,Earthquake mag: 7.2; Max water height (m): 0.19; Magnitude (Iida): NADeaths: NA,2016-08-12,2016-08-12,1,DOI:10.7289/V5PN93H7,2023-02-02
List of tsunamis,UK TERRITORY-SOUTHERN ATLANTIC OCEAN: 19/08/2016 07:33:11,Earthquake mag: 7.4; Max water height (m): 0.1; Magnitude (Iida): NADeaths: NA,2016-08-19,2016-08-19,1,DOI:10.7289/V5PN93H7,2023-02-02
List of tsunamis,JAPAN-SANRIKU: 20/08/2016 09:01:26,Earthquake mag: 6; Max water height (m): 0.01; Magnitude (Iida): NADeaths: NA,2016-08-20,2016-08-20,0,DOI:10.7289/V5PN93H7,2023-02-02
List of tsunamis,NEW ZEALAND-GISBORNE: 01/09/2016 16:37:03,Earthquake mag: 7; Max water height (m): 0.21; Magnitude (Iida): NADeaths: NA,2016-09-01,2016-09-01,4,DOI:10.7289/V5PN93H7,2023-02-02
List of tsunamis,NEW ZEALAND-OFF EAST COAST OF SOUTH ISLAND: 13/11/2016 11:02:34,Earthquake mag: 7.8; Max water height (m): 6.9; Magnitude (Iida): NADeaths: NA,2016-11-13,2016-11-13,17,DOI:10.7289/V5PN93H7,2023-02-02
List of tsunamis,JAPAN-E. COAST HONSHU ISLAND: 21/11/2016 20:59:27,Earthquake mag: 6.9; Max water height (m): 1.44; Magnitude (Iida): NADeaths: NA,2016-11-21,2016-11-21,9,DOI:10.7289/V5PN93H7,2023-02-02
List of tsunamis,NICARAGUA-NICARAGUA: 24/11/2016 18:43:00,Earthquake mag: 6.9; Max water height (m): 0.08; Magnitude (Iida): NADeaths: NA,2016-11-24,2016-11-24,3,DOI:10.7289/V5PN93H7,2023-02-02
List of tsunamis,SOLOMON ISLANDS-SOLOMON ISLANDS: 08/12/2016 17:38:28,Earthquake mag: 7.8; Max water height (m): 0.43; Magnitude (Iida): NADeaths: NA,2016-12-08,2016-12-08,11,DOI:10.7289/V5PN93H7,2023-02-02
List of tsunamis,SOLOMON ISLANDS-SOLOMON ISLANDS: 09/12/2016 19:11:24,Earthquake mag: 6.9; Max water height (m): 0.05; Magnitude (Iida): NADeaths: NA,2016-12-09,2016-12-09,5,DOI:10.7289/V5PN93H7,2023-02-02
List of tsunamis,PAPUA NEW GUINEA-SOLOMON SEA: 17/12/2016 10:51:05,Earthquake mag: 7.9; Max water height (m): 0.08; Magnitude (Iida): NADeaths: NA,2016-12-17,2016-12-17,5,DOI:10.7289/V5PN93H7,2023-02-02
List of tsunamis,CHILE-SOUTHERN CHILE: 25/12/2016 14:22:00,Earthquake mag: 7.6; Max water height (m): 0.44; Magnitude (Iida): NADeaths: NA,2016-12-25,2016-12-25,4,DOI:10.7289/V5PN93H7,2023-02-02
List of tsunamis,FIJI-FIJI ISLANDS: 03/01/2017 21:53:07,Earthquake mag: 6.9; Max water height (m): 0.01; Magnitude (Iida): NADeaths: NA,2017-01-03,2017-01-03,1,DOI:10.7289/V5PN93H7,2023-02-02
List of tsunamis,PAPUA NEW GUINEA-BOUGAINVILLE ISLAND: 22/01/2017 04:31:36,Earthquake mag: 7.9; Max water height (m): 0.04; Magnitude (Iida): NADeaths: NA,2017-01-22,2017-01-22,1,DOI:10.7289/V5PN93H7,2023-02-02
List of tsunamis,IRAN-PERSIAN GULF: 19/03/2017 04:30:NA,Earthquake mag: NA; Max water height (m): 3; Magnitude (Iida): NADeaths: 5,2017-03-19,2017-03-19,27,DOI:10.7289/V5PN93H7,2023-02-02
List of tsunamis,CHILE-CENTRAL CHILE: 24/04/2017 21:39:22,Earthquake mag: 6.9; Max water height (m): 0.16; Magnitude (Iida): NADeaths: NA,2017-04-24,2017-04-24,4,DOI:10.7289/V5PN93H7,2023-02-02
List of tsunamis,"PHILIPPINES-SOCCSKSARGEN, PHILIPPINES: 28/04/2017 20:23:26",Earthquake mag: 6.9; Max water height (m): 0.2; Magnitude (Iida): NADeaths: NA,2017-04-28,2017-04-28,1,DOI:10.7289/V5PN93H7,2023-02-02
List of tsunamis,"USA-SKAGWAY, AK: 01/05/2017 12:31:03",Earthquake mag: 6.2; Max water height (m): 0.06; Magnitude (Iida): NADeaths: NA,2017-05-01,2017-05-01,1,DOI:10.7289/V5PN93H7,2023-02-02
List of tsunamis,NETHERLANDS-NORTH SEA: 29/05/2017 03:45:NA,Earthquake mag: NA; Max water height (m): 2; Magnitude (Iida): NADeaths: NA,2017-05-29,2017-05-29,2,DOI:10.7289/V5PN93H7,2023-02-02
List of tsunamis,GREECE-LESBOS: 12/06/2017 12:28:15,Earthquake mag: 6.3; Max water height (m): 0.4; Magnitude (Iida): NADeaths: NA,2017-06-12,2017-06-12,1,DOI:10.7289/V5PN93H7,2023-02-02
List of tsunamis,"GREENLAND-KARRAT FJORD, GREENLAND: 17/06/2017 23:39:17",Earthquake mag: NA; Max water height (m): 90; Magnitude (Iida): NADeaths: 4,2017-06-17,2017-06-17,5,DOI:10.7289/V5PN93H7,2023-02-02
List of tsunamis,RUSSIA-BERING ISLAND: 17/07/2017 23:35:14,Earthquake mag: 7.7; Max water height (m): 0.1; Magnitude (Iida): NADeaths: NA,2017-07-17,2017-07-17,1,DOI:10.7289/V5PN93H7,2023-02-02
List of tsunamis,COLOMBIA-OFF THE COAST NEAR SANTA MARTA: 19/07/2017 12:50:00,Earthquake mag: NA; Max water height (m): 8; Magnitude (Iida): NADeaths: NA,2017-07-19,2017-07-19,7,DOI:10.7289/V5PN93H7,2023-02-02
List of tsunamis,TURKEY-GULF OF GKOVA: 20/07/2017 22:31:26,Earthquake mag: 6.6; Max water height (m): 1.9; Magnitude (Iida): NADeaths: NA,2017-07-20,2017-07-20,40,DOI:10.7289/V5PN93H7,2023-02-02
List of tsunamis,MEXICO-S. MEXICO: 08/09/2017 04:49:02,Earthquake mag: 8.2; Max water height (m): 2.7; Magnitude (Iida): NADeaths: NA,2017-09-08,2017-09-08,68,DOI:10.7289/V5PN93H7,2023-02-02
List of tsunamis,NEW CALEDONIA-LOYALTY ISLANDS: 31/10/2017 00:43:12,Earthquake mag: 6.7; Max water height (m): 0.15; Magnitude (Iida): NADeaths: NA,2017-10-31,2017-10-31,4,DOI:10.7289/V5PN93H7,2023-02-02
List of tsunamis,NEW CALEDONIA-LOYALTY ISLANDS: 01/11/2017 02:24:07,Earthquake mag: 6.6; Max water height (m): 0.1; Magnitude (Iida): NADeaths: NA,2017-11-01,2017-11-01,4,DOI:10.7289/V5PN93H7,2023-02-02
List of tsunamis,VIETNAM-QUANG NAM: 05/11/2017 09:00:00,Earthquake mag: NA; Max water height (m): 8.5; Magnitude (Iida): NADeaths: 1,2017-11-05,2017-11-05,1,DOI:10.7289/V5PN93H7,2023-02-02
List of tsunamis,NEW CALEDONIA-LOYALTY ISLANDS: 19/11/2017 09:26:13,Earthquake mag: 6.3; Max water height (m): 0.05; Magnitude (Iida): NADeaths: NA,2017-11-19,2017-11-19,1,DOI:10.7289/V5PN93H7,2023-02-02
List of tsunamis,NEW CALEDONIA-LOYALTY ISLANDS: 19/11/2017 15:10:28,Earthquake mag: 6.6; Max water height (m): 0.08; Magnitude (Iida): NADeaths: NA,2017-11-19,2017-11-19,1,DOI:10.7289/V5PN93H7,2023-02-02
List of tsunamis,NEW CALEDONIA-LOYALTY ISLANDS: 19/11/2017 22:43:25,Earthquake mag: 7; Max water height (m): 0.37; Magnitude (Iida): NADeaths: NA,2017-11-19,2017-11-19,5,DOI:10.7289/V5PN93H7,2023-02-02
List of tsunamis,KERMADEC ISLANDS-KERMADEC ISLANDS: 08/12/2017 NA:NA:NA,Earthquake mag: NA; Max water height (m): 0.5; Magnitude (Iida): NADeaths: NA,2017-12-08,2017-12-08,6,DOI:10.7289/V5PN93H7,2023-02-02
List of tsunamis,HONDURAS-OFF COAST OF HONDURAS: 10/01/2018 02:51:29,Earthquake mag: 7.5; Max water height (m): 0.4; Magnitude (Iida): NADeaths: NA,2018-01-10,2018-01-10,8,DOI:10.7289/V5PN93H7,2023-02-02
List of tsunamis,PERU-S. PERU: 14/01/2018 09:18:00,Earthquake mag: 7.1; Max water height (m): 0.15; Magnitude (Iida): NADeaths: NA,2018-01-14,2018-01-14,4,DOI:10.7289/V5PN93H7,2023-02-02
List of tsunamis,"USA-KODIAK ISLAND, AK: 23/01/2018 09:32:29",Earthquake mag: 7.9; Max water height (m): 0.25; Magnitude (Iida): NADeaths: NA,2018-01-23,2018-01-23,64,DOI:10.7289/V5PN93H7,2023-02-02
List of tsunamis,"PAPUA NEW GUINEA-KADOVAR ISLAND, PAPUA NEW GUINEA: 09/02/2018 NA:NA:NA",Earthquake mag: NA; Max water height (m): 1; Magnitude (Iida): NADeaths: NA,2018-02-09,2018-02-09,1,DOI:10.7289/V5PN93H7,2023-02-02
List of tsunamis,USA-HAWAII: 04/05/2018 22:32:37,Earthquake mag: 6.9; Max water height (m): 0.4; Magnitude (Iida): NADeaths: NA,2018-05-04,2018-05-04,7,DOI:10.7289/V5PN93H7,2023-02-02
List of tsunamis,JAPAN-S. OF HONSHU ISLAND: 06/05/2018 06:03:33,Earthquake mag: 5.4; Max water height (m): 0.15; Magnitude (Iida): NADeaths: NA,2018-05-06,2018-05-06,1,DOI:10.7289/V5PN93H7,2023-02-02
List of tsunamis,USA-NORTHEAST U.S.A.: 15/05/2018 NA:NA:NA,Earthquake mag: NA; Max water height (m): 0.22; Magnitude (Iida): NADeaths: NA,2018-05-15,2018-05-15,10,DOI:10.7289/V5PN93H7,2023-02-02
List of tsunamis,SPAIN-BALEARIC ISLANDS: 16/07/2018 NA:NA:NA,Earthquake mag: NA; Max water height (m): 0.75; Magnitude (Iida): NADeaths: 1,2018-07-16,2018-07-16,3,DOI:10.7289/V5PN93H7,2023-02-02
List of tsunamis,INDONESIA-BALI SEA: 28/07/2018 22:48:14,Earthquake mag: 6.4; Max water height (m): 2.5; Magnitude (Iida): NADeaths: NA,2018-07-28,2018-07-28,2,DOI:10.7289/V5PN93H7,2023-02-02
List of tsunamis,INDONESIA-BALI SEA: 05/08/2018 11:47:03,Earthquake mag: 6.9; Max water height (m): 2; Magnitude (Iida): NADeaths: NA,2018-08-05,2018-08-05,6,DOI:10.7289/V5PN93H7,2023-02-02
List of tsunamis,FIJI-FIJI ISLANDS: 19/08/2018 00:20:07,Earthquake mag: 8.2; Max water height (m): NA; Magnitude (Iida): NADeaths: NA,2018-08-19,2018-08-19,0,DOI:10.7289/V5PN93H7,2023-02-02
List of tsunamis,INDONESIA-BALI SEA: 19/08/2018 04:11:04,Earthquake mag: 6.3; Max water height (m): NA; Magnitude (Iida): NADeaths: NA,2018-08-19,2018-08-19,0,DOI:10.7289/V5PN93H7,2023-02-02
List of tsunamis,VENEZUELA-SUCRE: 21/08/2018 21:31:06,Earthquake mag: 7.3; Max water height (m): NA; Magnitude (Iida): NADeaths: NA,2018-08-21,2018-08-21,1,DOI:10.7289/V5PN93H7,2023-02-02
List of tsunamis,NEW CALEDONIA-LOYALTY ISLANDS: 29/08/2018 03:51:01,Earthquake mag: 7.1; Max water height (m): 0.27; Magnitude (Iida): NADeaths: NA,2018-08-29,2018-08-29,7,DOI:10.7289/V5PN93H7,2023-02-02
List of tsunamis,INDONESIA-SULAWESI: 28/09/2018 10:02:25,Earthquake mag: 7.5; Max water height (m): 10.73; Magnitude (Iida): NADeaths: 4340,2018-09-28,2018-09-28,291,DOI:10.7289/V5PN93H7,2023-02-02
List of tsunamis,NEW CALEDONIA-LOYALTY ISLANDS: 16/10/2018 01:03:58,Earthquake mag: 6.5; Max water height (m): 0.05; Magnitude (Iida): NADeaths: NA,2018-10-16,2018-10-16,1,DOI:10.7289/V5PN93H7,2023-02-02
List of tsunamis,GREECE-IONIAN SEA: 25/10/2018 22:55:03,Earthquake mag: 6.8; Max water height (m): 0.5; Magnitude (Iida): NADeaths: NA,2018-10-25,2018-10-25,9,DOI:10.7289/V5PN93H7,2023-02-02
List of tsunamis,NEW CALEDONIA-LOYALTY ISLANDS: 05/12/2018 04:18:42,Earthquake mag: 7.5; Max water height (m): 2; Magnitude (Iida): NADeaths: NA,2018-12-05,2018-12-05,34,DOI:10.7289/V5PN93H7,2023-02-02
List of tsunamis,"RUSSIA-BUREYA, FAR EASTERN RUSSIA: 11/12/2018 04:48:NA",Earthquake mag: NA; Max water height (m): 90; Magnitude (Iida): NADeaths: NA,2018-12-11,2018-12-11,49,DOI:10.7289/V5PN93H7,2023-02-02
List of tsunamis,INDONESIA-KRAKATAU: 22/12/2018 13:55:NA,Earthquake mag: NA; Max water height (m): 85; Magnitude (Iida): NADeaths: 437,2018-12-22,2018-12-22,410,DOI:10.7289/V5PN93H7,2023-02-02
List of tsunamis,"JAPAN-NAGASAKI, JAPAN: 20/03/2019 NA:NA:NA",Earthquake mag: NA; Max water height (m): 2.9; Magnitude (Iida): NADeaths: NA,2019-03-20,2019-03-20,2,DOI:10.7289/V5PN93H7,2023-02-02
List of tsunamis,USA-LAKE ERIE: 14/04/2019 23:17:NA,Earthquake mag: NA; Max water height (m): 1.75; Magnitude (Iida): NADeaths: NA,2019-04-14,2019-04-14,2,DOI:10.7289/V5PN93H7,2023-02-02
List of tsunamis,"PAPUA NEW GUINEA-RABAUL, NEW BRITAIN: 14/05/2019 12:58:25",Earthquake mag: 7.6; Max water height (m): NA; Magnitude (Iida): NADeaths: NA,2019-05-14,2019-05-14,0,DOI:10.7289/V5PN93H7,2023-02-02
List of tsunamis,CHILE-CENTRAL CHILE: 14/06/2019 00:19:12,Earthquake mag: 6.4; Max water height (m): 0.07; Magnitude (Iida): NADeaths: NA,2019-06-14,2019-06-14,1,DOI:10.7289/V5PN93H7,2023-02-02
List of tsunamis,"NEW ZEALAND-S OF RAOUL ISLAND, KERMADEC ISLANDS: 15/06/2019 22:55:02",Earthquake mag: 7.2; Max water height (m): 0.14; Magnitude (Iida): NADeaths: NA,2019-06-15,2019-06-15,7,DOI:10.7289/V5PN93H7,2023-02-02
List of tsunamis,JAPAN-NIIGATA: 18/06/2019 13:22:19,Earthquake mag: 6.4; Max water height (m): 0.1; Magnitude (Iida): NADeaths: NA,2019-06-18,2019-06-18,5,DOI:10.7289/V5PN93H7,2023-02-02
List of tsunamis,INDONESIA-W. JAVA: 02/08/2019 12:03:27,Earthquake mag: 6.9; Max water height (m): NA; Magnitude (Iida): NADeaths: NA,2019-08-02,2019-08-02,6,DOI:10.7289/V5PN93H7,2023-02-02
List of tsunamis,ITALY-STROMBOLI ISLAND: 28/08/2019 NA:NA:NA,Earthquake mag: NA; Max water height (m): 0.3; Magnitude (Iida): NADeaths: NA,2019-08-28,2019-08-28,1,DOI:10.7289/V5PN93H7,2023-02-02
List of tsunamis,INDONESIA-N. MOLUCCAS ISLANDS: 14/11/2019 16:17:40,Earthquake mag: 7.1; Max water height (m): 0.11; Magnitude (Iida): NADeaths: NA,2019-11-14,2019-11-14,8,DOI:10.7289/V5PN93H7,2023-02-02
List of tsunamis,USA TERRITORY-PUERTO RICO: 07/01/2020 08:24:26,Earthquake mag: 6.4; Max water height (m): 0.06; Magnitude (Iida): NADeaths: NA,2020-01-07,2020-01-07,6,DOI:10.7289/V5PN93H7,2023-02-02
List of tsunamis,CUBA-OFF SE COAST: 28/01/2020 19:10:25,Earthquake mag: 7.7; Max water height (m): 0.11; Magnitude (Iida): NADeaths: NA,2020-01-28,2020-01-28,2,DOI:10.7289/V5PN93H7,2023-02-02
List of tsunamis,RUSSIA-N. KURIL ISLANDS: 25/03/2020 02:49:21,Earthquake mag: 7.5; Max water height (m): 0.5; Magnitude (Iida): NADeaths: NA,2020-03-25,2020-03-25,11,DOI:10.7289/V5PN93H7,2023-02-02
List of tsunamis,USA-GULF OF MEXICO: 23/04/2020 NA:NA:NA,Earthquake mag: NA; Max water height (m): 0.5; Magnitude (Iida): NADeaths: NA,2020-04-23,2020-04-23,1,DOI:10.7289/V5PN93H7,2023-02-02
List of tsunamis,GREECE-CRETE: 02/05/2020 12:51:06,Earthquake mag: 6.6; Max water height (m): 0.95; Magnitude (Iida): NADeaths: NA,2020-05-02,2020-05-02,15,DOI:10.7289/V5PN93H7,2023-02-02
List of tsunamis,INDONESIA-LESSER SUNDA: BALI: IJEN VOLCANO: 29/05/2020 05:30:NA,Earthquake mag: NA; Max water height (m): 3; Magnitude (Iida): NADeaths: NA,2020-05-29,2020-05-29,1,DOI:10.7289/V5PN93H7,2023-02-02
List of tsunamis,USA-GULF OF MEXICO: 13/06/2020 NA:NA:NA,Earthquake mag: NA; Max water height (m): 0.5; Magnitude (Iida): NADeaths: NA,2020-06-13,2020-06-13,1,DOI:10.7289/V5PN93H7,2023-02-02
List of tsunamis,"NEW ZEALAND-S OF RAOUL ISLAND, KERMADEC ISLANDS: 18/06/2020 12:49:53",Earthquake mag: 7.4; Max water height (m): 0.11; Magnitude (Iida): NADeaths: NA,2020-06-18,2020-06-18,4,DOI:10.7289/V5PN93H7,2023-02-02
List of tsunamis,MEXICO-OFF OF COAST OF OAXACA: 23/06/2020 15:29:05,Earthquake mag: 7.4; Max water height (m): 1.57; Magnitude (Iida): NADeaths: NA,2020-06-23,2020-06-23,9,DOI:10.7289/V5PN93H7,2023-02-02
List of tsunamis,"USA-SHUMAGIN ISLANDS, AK: 22/07/2020 06:12:44",Earthquake mag: 7.8; Max water height (m): 0.24; Magnitude (Iida): NADeaths: NA,2020-07-22,2020-07-22,9,DOI:10.7289/V5PN93H7,2023-02-02
List of tsunamis,"USA-SHUMAGIN ISLANDS, AK: 19/10/2020 20:54:39",Earthquake mag: 7.6; Max water height (m): 0.76; Magnitude (Iida): NADeaths: NA,2020-10-19,2020-10-19,17,DOI:10.7289/V5PN93H7,2023-02-02
List of tsunamis,TURKEY-AEGEAN SEA: 30/10/2020 11:51:27,Earthquake mag: 7; Max water height (m): 5.3; Magnitude (Iida): NADeaths: 1,2020-10-30,2020-10-30,272,DOI:10.7289/V5PN93H7,2023-02-02
List of tsunamis,"SPAIN-VALLE GRAN REY, LA GOMERA ISLAND: 14/11/2020 15:00:00",Earthquake mag: NA; Max water height (m): 0.5; Magnitude (Iida): NADeaths: NA,2020-11-14,2020-11-14,1,DOI:10.7289/V5PN93H7,2023-02-02
List of tsunamis,"CANADA-ELLIOT CREEK, BC: 28/11/2020 NA:NA:NA",Earthquake mag: NA; Max water height (m): NA; Magnitude (Iida): NADeaths: NA,2020-11-28,2020-11-28,0,DOI:10.7289/V5PN93H7,2023-02-02
List of tsunamis,CHILE-CENTRAL CHILE: 27/12/2020 21:39:14,Earthquake mag: 6.7; Max water height (m): 0.16; Magnitude (Iida): NADeaths: NA,2020-12-27,2020-12-27,1,DOI:10.7289/V5PN93H7,2023-02-02
List of tsunamis,ANTARCTICA-SCOTIA SEA: 23/01/2021 23:36:50,Earthquake mag: 6.9; Max water height (m): 0.04; Magnitude (Iida): NADeaths: NA,2021-01-23,2021-01-23,2,DOI:10.7289/V5PN93H7,2023-02-02
List of tsunamis,NEW CALEDONIA-LOYALTY ISLANDS: 10/02/2021 13:19:55,Earthquake mag: 7.7; Max water height (m): 0.78; Magnitude (Iida): NADeaths: NA,2021-02-10,2021-02-10,20,DOI:10.7289/V5PN93H7,2023-02-02
List of tsunamis,JAPAN-OFF FUKUSHIMA PREFECTURE: 13/02/2021 14:07:50,Earthquake mag: 7.1; Max water height (m): 0.1; Magnitude (Iida): NADeaths: NA,2021-02-13,2021-02-13,4,DOI:10.7289/V5PN93H7,2023-02-02
List of tsunamis,NEW ZEALAND-GISBORNE: 04/03/2021 13:27:36,Earthquake mag: 7.3; Max water height (m): 0.28; Magnitude (Iida): NADeaths: NA,2021-03-04,2021-03-04,9,DOI:10.7289/V5PN93H7,2023-02-02
List of tsunamis,"NEW ZEALAND-S OF RAOUL ISLAND, KERMADEC ISLANDS: 04/03/2021 17:41:25",Earthquake mag: 7.4; Max water height (m): 0.31; Magnitude (Iida): NADeaths: NA,2021-03-04,2021-03-04,8,DOI:10.7289/V5PN93H7,2023-02-02
List of tsunamis,"NEW ZEALAND-S OF RAOUL ISLAND, KERMADEC ISLANDS: 04/03/2021 19:28:31",Earthquake mag: 8.1; Max water height (m): 1; Magnitude (Iida): NADeaths: NA,2021-03-04,2021-03-04,84,DOI:10.7289/V5PN93H7,2023-02-02
List of tsunamis,ALGERIA-N. ALGERIA: 18/03/2021 00:04:06,Earthquake mag: 6; Max water height (m): 0.06; Magnitude (Iida): NADeaths: NA,2021-03-18,2021-03-18,4,DOI:10.7289/V5PN93H7,2023-02-02
List of tsunamis,INDONESIA-BANDA SEA: 16/06/2021 04:43:07,Earthquake mag: 5.8; Max water height (m): 0.51; Magnitude (Iida): NADeaths: NA,2021-06-16,2021-06-16,3,DOI:10.7289/V5PN93H7,2023-02-02
List of tsunamis,"USA-KODIAK ISLAND, AK: 29/07/2021 06:15:47",Earthquake mag: 8.2; Max water height (m): 0.42; Magnitude (Iida): NADeaths: NA,2021-07-29,2021-07-29,40,DOI:10.7289/V5PN93H7,2023-02-02
List of tsunamis,"PHILIPPINES-MINDANAO ISLAND, PHILIPPINES: 11/08/2021 17:46:14",Earthquake mag: 7.1; Max water height (m): 0.05; Magnitude (Iida): NADeaths: NA,2021-08-11,2021-08-11,2,DOI:10.7289/V5PN93H7,2023-02-02
List of tsunamis,UK TERRITORY-SOUTHERN ATLANTIC OCEAN: 12/08/2021 18:35:20,Earthquake mag: 8.1; Max water height (m): 0.64; Magnitude (Iida): NADeaths: NA,2021-08-12,2021-08-12,52,DOI:10.7289/V5PN93H7,2023-02-02
List of tsunamis,HAITI-PORT-AU-PRINCE: 14/08/2021 12:29:08,Earthquake mag: 7.2; Max water height (m): NA; Magnitude (Iida): NADeaths: NA,2021-08-14,2021-08-14,3,DOI:10.7289/V5PN93H7,2023-02-02
List of tsunamis,MEXICO-S. MEXICO: 08/09/2021 01:47:47,Earthquake mag: 7; Max water height (m): 0.48; Magnitude (Iida): NADeaths: NA,2021-09-08,2021-09-08,1,DOI:10.7289/V5PN93H7,2023-02-02
List of tsunamis,GREECE-CRETE: 12/10/2021 09:24:03,Earthquake mag: 6.4; Max water height (m): NA; Magnitude (Iida): NADeaths: NA,2021-10-12,2021-10-12,0,DOI:10.7289/V5PN93H7,2023-02-02
List of tsunamis,INDONESIA-FLORES SEA: 14/12/2021 03:20:24,Earthquake mag: 7.3; Max water height (m): 0.07; Magnitude (Iida): NADeaths: NA,2021-12-14,2021-12-14,2,DOI:10.7289/V5PN93H7,2023-02-02
List of tsunamis,TONGA-TONGA ISLANDS: 13/01/2022 NA:NA:NA,Earthquake mag: NA; Max water height (m): 0.15; Magnitude (Iida): NADeaths: NA,2022-01-13,2022-01-13,1,DOI:10.7289/V5PN93H7,2023-02-02
List of tsunamis,TONGA-TONGA ISLANDS: 15/01/2022 04:14:45,Earthquake mag: NA; Max water height (m): 22; Magnitude (Iida): NADeaths: 6,2022-01-15,2022-01-15,661,DOI:10.7289/V5PN93H7,2023-02-02
List of tsunamis,TONGA-TONGA ISLANDS: 16/01/2022 NA:NA:NA,Earthquake mag: NA; Max water height (m): 0.36; Magnitude (Iida): NADeaths: NA,2022-01-16,2022-01-16,1,DOI:10.7289/V5PN93H7,2023-02-02
List of tsunamis,NEW ZEALAND-KERMADEC ISLANDS: 29/01/2022 02:46:39,Earthquake mag: 6.5; Max water height (m): 0.1; Magnitude (Iida): NADeaths: NA,2022-01-29,2022-01-29,1,DOI:10.7289/V5PN93H7,2023-02-02
List of tsunamis,JAPAN-OFF FUKUSHIMA PREFECTURE: 16/03/2022 14:36:33,Earthquake mag: 7.3; Max water height (m): 0.3; Magnitude (Iida): NADeaths: NA,2022-03-16,2022-03-16,5,DOI:10.7289/V5PN93H7,2023-02-02
List of tsunamis,NEW CALEDONIA-LOYALTY ISLANDS: 30/03/2022 20:56:58,Earthquake mag: 6.9; Max water height (m): 0.07; Magnitude (Iida): NADeaths: NA,2022-03-30,2022-03-30,3,DOI:10.7289/V5PN93H7,2023-02-02
List of tsunamis,NEW CALEDONIA-LOYALTY ISLANDS: 31/03/2022 05:44:01,Earthquake mag: 7; Max water height (m): 0.05; Magnitude (Iida): NADeaths: NA,2022-03-31,2022-03-31,1,DOI:10.7289/V5PN93H7,2023-02-02
List of tsunamis,MEXICO-S. MEXICO: 25/05/2022 21:43:02,Earthquake mag: 5.5; Max water height (m): 0.24; Magnitude (Iida): NADeaths: NA,2022-05-25,2022-05-25,4,DOI:10.7289/V5PN93H7,2023-02-02
List of tsunamis,CHILE-TODOS LOS SANTOS LAKE: 29/06/2022 14:15:NA,Earthquake mag: NA; Max water height (m): 0.8; Magnitude (Iida): NADeaths: NA,2022-06-29,2022-06-29,1,DOI:10.7289/V5PN93H7,2023-02-02
List of tsunamis,PHILIPPINES-N. LUZON ISLAND: 27/07/2022 00:43:24,Earthquake mag: 7; Max water height (m): 0.08; Magnitude (Iida): NADeaths: NA,2022-07-27,2022-07-27,1,DOI:10.7289/V5PN93H7,2023-02-02
List of tsunamis,MEXICO-MEXICO: 19/09/2022 18:05:06,Earthquake mag: 7.6; Max water height (m): 0.79; Magnitude (Iida): NADeaths: NA,2022-09-19,2022-09-19,14,DOI:10.7289/V5PN93H7,2023-02-02
List of tsunamis,MEXICO-S. MEXICO: 22/09/2022 06:16:09,Earthquake mag: 6.8; Max water height (m): 0.09; Magnitude (Iida): NADeaths: NA,2022-09-22,2022-09-22,3,DOI:10.7289/V5PN93H7,2023-02-02
List of tsunamis,ITALY-STROMBOLI ISLAND: 09/10/2022 07:23:NA,Earthquake mag: NA; Max water height (m): 0.04; Magnitude (Iida): NADeaths: NA,2022-10-09,2022-10-09,2,DOI:10.7289/V5PN93H7,2023-02-02
List of tsunamis,TONGA-TONGA ISLANDS: 11/11/2022 10:48:45,Earthquake mag: 7.3; Max water height (m): 0.12; Magnitude (Iida): NADeaths: NA,2022-11-11,2022-11-11,4,DOI:10.7289/V5PN93H7,2023-02-02
List of tsunamis,SOLOMON ISLANDS-SOLOMON ISLANDS: 22/11/2022 02:03:07,Earthquake mag: 7; Max water height (m): 0.03; Magnitude (Iida): NADeaths: NA,2022-11-22,2022-11-22,1,DOI:10.7289/V5PN93H7,2023-02-02
List of tsunamis,"NEW ZEALAND-LAKE TAUPO, NORTH ISLAND: 30/11/2022 10:48:00",Earthquake mag: 5.4; Max water height (m): 1; Magnitude (Iida): NADeaths: NA,2022-11-30,2022-11-30,4,DOI:10.7289/V5PN93H7,2023-02-02
List of tsunamis,ITALY-STROMBOLI ISLAND: 04/12/2022 NA:NA:NA,Earthquake mag: NA; Max water height (m): 0.75; Magnitude (Iida): NADeaths: NA,2022-12-04,2022-12-04,3,DOI:10.7289/V5PN93H7,2023-02-02
List of tsunamis,INDONESIA-SOUTH MALUKU: 09/01/2023 17:47:35,Earthquake mag: 7.6; Max water height (m): 0.09; Magnitude (Iida): NADeaths: NA,2023-01-09,2023-01-09,2,DOI:10.7289/V5PN93H7,2023-02-02
