Category ID,Category,Event,Event description,Country
G14,Crowd crushes,"Unnamed - Kikwit, Democratic Republic of Congo","During a memorial concert for singer King Kester Emeneya, power was lost to the stadium and a crush formed at the exit.",Democratic Republic of Congo
G14,Crowd crushes,"2014 Stade Tata Raphaël disaster - Kinshasa, Democratic Republic of Congo",Crush at a football match between TP Mazembe and Vita Club when police fired a tear gas canister in order to control the crowds.,Democratic Republic of Congo
G14,Crowd crushes,"Unnamed - Conakry, Guinea",Crush at the end of a rap concert after the attendees tried to leave the venue through a small gate.,Guinea
G14,Crowd crushes,"2014 Patna stampede - Patna, India",26 others injured in a crowd crush shortly after the Dussehra celebrations at the Gandhi Maidan.,India
G14,Crowd crushes,"2014 Multan stampede - Multan District, Punjab, Pakistan","40 others injured as a result of a crush at Ibn-e-Qasim Bagh Stadium after a speech of Pakistan Tehreek-e-Insaf party chairman, Imran Khan. The latter alleged that only two gates of the venue were opened at the end of the rally and the lights were also switched off, but this was later denied by the DCO and local authorities.",Pakistan
G14,Crowd crushes,"Kwekwe stadium stampede - Kwekwe, Zimbabwe",40 others injured in a crush during a religious service.,Zimbabwe
G14,Crowd crushes,"2014 Shanghai stampede - Shanghai, China",42 others injured in a crush during New Year's celebrations at The Bund.,China
G14,Crowd crushes,"30 June Stadium stampede - Cairo, Egypt",Crush at a football game between Zamalek and ENPPI.,Egypt
G14,Crowd crushes,"2015 Haiti Carnival stampede - Port-au-Prince, Haiti",Crush during the Shrove Tuesday festival after a man was electrocuted by high-voltage wires.,Haiti
G14,Crowd crushes,"Unnamed - Mymensingh, Bangladesh",50 others injured following a crush at a free clothing drive.,Bangladesh
G14,Crowd crushes,"Unnamed - Godavari River, Andhra Pradesh, India",Pilgrims died in a crush on the banks of the Godavari River. The Hindu pilgrims had gathered to take a dip in the river at the start of the Maha Pushkaralu festival.,India
G14,Crowd crushes,"Unnamed - Jharkhand, India",At least 50 more injured when people rushing the queue crushed those who fell and were asleep at the Baidyanath Temple.,India
G14,Crowd crushes,"2015 Mina stampede - Mina, Saudi Arabia",Overcrowding incident during the Hajj pilgrimage. A further 934 were injured.,Saudi Arabia
G14,Crowd crushes,"Unnamed - Taloqan, Afghanistan",Girls aged ten to fifteen were killed and another 42 were injured in a crush on a stairway while trying to escape the school during the 2015 Hindu Kush earthquake.,Afghanistan
G14,Crowd crushes,"2016 Ethiopian protests - Various, Ethiopia","Occurred during the annual thanksgiving festival of the Oromo people after police confronted protesters during the 2016 Ethiopian protests, resulting in a crush. The opposition political party Oromo Federalist Congress, claimed the number of people confirmed dead was 678. While the government claimed only tear gas and rubber bullets were fired by security forces on the ground as well as from the helicopter, eyewitness as well as some videos allegedly from the scene show security forces firing what seemed to be live rounds of ammunition.",Ethiopia
G14,Crowd crushes,"Unnamed - Varanasi, India","Occurred near the Rajghat Bridge when many times the expected number of people were heading towards a religious retreat, causing a crush, and later a stampede due to rumors that the bridge had collapsed.",India
G14,Crowd crushes,"Unnamed - Sagar Island, West Bengal, India","Occurred while pilgrims were trying to board vessels to Kolkata ahead of high tide, after a religious festival on the island.",India
G14,Crowd crushes,"Unnamed - Uíge, Angola","At least 61 others injured, during a crush in the Estádio 4 de Janeiro ahead of the opening match of the Angolan football season while trying to enter the stadium before a match between Santa Rita de Cássia FC and Recreativo do Libolo.",Angola
G14,Crowd crushes,"Unnamed - Lusaka, Zambia",28 others injured during a crush over food aid from a church group.,Zambia
G14,Crowd crushes,"Resorts World Manila attack - Pasay, Metro Manila, Philippines",Crush during the evacuation of the Resorts World Manila complex after a gunman opened fire and burned casino gambling equipment.,Philippines
G14,Crowd crushes,"Unnamed - Lilongwe, Malawi",7 of the dead were children. At least 40 others injured during a crush at the Bingu National Stadium during the nation's independence day celebrations while trying to enter before a match between Nyasa Big Bullets and Silver Strikers F.C.,Malawi
G14,Crowd crushes,"Unnamed - Dakar, Senegal",60 more injured in a crush when a wall collapsed at Demba Diop stadium as police fired tear gas at both sets of fans after a Senegalese League Cup final game between US Ouakam and Stade de Mbour.,Senegal
G14,Crowd crushes,"Unnamed - Mumbai, India",Hundreds more injured in a crush following heavy rains in a footbridge between Parel and Elphinstone road stations.,India
G14,Crowd crushes,"Unnamed - Sidi Boulaalam, Morocco",15 women were killed and 40 women injured after breaking down barriers during a food-aid distribution.,Morocco
G14,Crowd crushes,"Unnamed - Chittagong, Bangladesh",At least 50 more injured during a funeral ritual for former mayor A.B.M. Mohiuddin Chowdhury when people tried to rush down a sloped gateway into the Rima Community Center.,Bangladesh
G14,Crowd crushes,"Unnamed - Chittagong, Bangladesh",A further 50 were injured in a crush while collecting alms before Ramadan.,Bangladesh
G14,Crowd crushes,"El Paraíso stampede - Caracas, Venezuela",Stampede after a tear gas canister was detonated in a crowded club.,Venezuela
G14,Crowd crushes,"Corinaldo stampede - Corinaldo, Marche, Italy",Dozens more injured in a crush as concertgoers tried to leave the packed Lanterna Azzurra club after pepper spray was fired inside.,Italy
G14,Crowd crushes,"2019 Antananarivo crush - Antananarivo, Madagascar","101 more injured in a crush before a concert on the country's 59th Independence Day at the Mahamasina Municipal Stadium. The show was about to start and people believed they could enter the stadium and began to push, but the police left the doors closed.",Madagascar
G14,Crowd crushes,"Karbala stampede - Karbala, Iraq",Pilgrims killed and at least 100 others injured in a crush near a major Shiite shrine while marking Ashura.,Iraq
G14,Crowd crushes,"Unnamed - São Paulo, Brazil","Crush at a funk music party at Paraisópolis, São Paulo after police entered the venue in pursuit of suspects, causing panic.",Brazil
G14,Crowd crushes,"Qasem Soleimani funeral stampede - Kerman, Iran",200 more injured in a crush at the funeral of general Qasem Soleimani.,Iran
G14,Crowd crushes,"Unnamed - Moshi, Tanzania","16 more injured in crush at a church when more than 4,500 attendees were being ushered through an exit so that they could walk on ""anointed oil"" during a prayer meeting",Tanzania
G14,Crowd crushes,"Kakamega Primary School stampede - Kakamega, Kenya",Pupils killed in a staircase crush when they were leaving for the day.,Kenya
G14,Crowd crushes,"Unnamed - Diffa, Niger","Crush while relief aid was being distributed, mostly to refugees from Nigeria.",Niger
G14,Crowd crushes,"Los Olivos stampede - Lima, Peru","6 others injured in the Los Olivos District, when the police raided the Thomas Restobar nightclub to break up an illegal gathering amid the COVID-19 pandemic.",Peru
G14,Crowd crushes,"Afghanistan Visa crush - Jalalabad, Afghanistan","At least 15 killed (11 women) and many more injured in a crowd crush at a stadium, after thousands of people gathered to apply for permits to Pakistan when visa applications resumed after a seven-month pause due to the COVID-19 pandemic.",Afghanistan
G14,Crowd crushes,"2021 Dar es Salaam stampede - Dar es Salaam, Tanzania",Crush at Uhuru Stadium at the wake of President John Magufuli.,Tanzania
G14,Crowd crushes,"2021 Meron stampede - Meron, Israel","Dozens more critically wounded in a crush at the annual Meron pilgrimage during Lag BaOmer. Organizers estimated that 100,000 people, the vast majority of whom were Ultra-Orthodox Jews, arrived on the night of 29 April.",Israel
G14,Crowd crushes,"Astroworld Festival crowd crush - Houston, United States","Numerous others injured in a crowd surge at the Astroworld Festival hosted by rapper Travis Scott at NRG Park. 300 people were treated for injuries, and 11 people suffered cardiac arrest.",United States
G14,Crowd crushes,"Vaishno Devi Temple stampede - Jammu and Kashmir, India","16 more injured during a crush at a Hindu shrine, triggered by a heavy rush of people coming to celebrate the New Year.",India
G14,Crowd crushes,"Yaoundé football crush - Yaoundé, Cameroon",Crush at Olembe Stadium to watch a 2021 Africa Cup of Nations football match between Cameroon and Comoros.,Cameroon
G14,Crowd crushes,"Port Harcourt stampede - Port Harcourt, Nigeria","Crush at a charity event at Port Harcourt Polo Club organised by Kings Assembly Pentecostal Church. Hundreds of people who had arrived hoping to receive free food and clothing broke through a fence, causing a panic.",Nigeria
G14,Crowd crushes,"Giza church fire - Giza, Egypt",A fire at the Abu Sefein Church caused panic and a crowd crush.,Egypt
G14,Crowd crushes,"Kanjuruhan Stadium disaster - Malang, East Java, Indonesia",Football fans were killed while fleeing from tear gas fired inside the stadium after a Super East Java Derby between Arema FC versus Persebaya Surabaya ended in a riot.,Indonesia
G14,Crowd crushes,"Seoul Halloween crowd crush - Seoul, South Korea","Crush at a narrow alley in the Itaewon district during Halloween celebrations; at least 172 more people were injured. In December 2022, the death of one survivor from suicide was ruled by authorities to have been caused by the disaster, legally declaring him the 159th victim.",South Korea
G14,Crowd crushes,"Unnamed - Kinshasa, Democratic Republic of Congo",Crush at a concert headlined by music star Fally Ipupa at the Martyrs' Stadium,Democratic Republic of Congo
G14,Crowd crushes,"Unnamed - Kandukur, Andhra Pradesh, India",Crush at a political rally as crowds gathered to hear a speech by former Chief Minister N. Chandrababu Naidu.,India
G14,Crowd crushes,"Freedom City mall crush - Kampala, Uganda",Crowds rushing to see a New Year's firework display got stuck in a narrow corridor in a shopping mall.,Uganda
G14,Crowd crushes,"Sanaa stampede - Sanaa, Yemen","Armed Houthis fired into the air in an attempt at crowd control during a Ramadan charity distribution event and hit an electrical wire, which exploded and caused panic among those waiting. More than 300 others were injured.",Yemen
G14,Crowd crushes,"San Salvador crowd crush - San Salvador, El Salvador","During a Primera División football match between Alianza F.C. and C.D. FAS, fans tried to enter Estadio Cuscatlán after the gates had been closed, leading to a crush after they overran the barricades. More than 500 others were injured.",El Salvador
